	name	count
2117	LOL DON'T EVEN WANT	1
2116	NEED GO ROOMS SWITCH	1
2113	RANGE FLUCTUATIONS PROBLEMS CONNECTED	1
2112	KIDDING STUPID THING COST	1
2111	CONSUMERS KNOW COULD POSSIBLY	1
2110	LIKELY RETURN BETTER SIGNAL	1
2107	S***TY 20 WIRELESS ADAPTER	1
2106	PS4 HOME STRENGTH RETURNED	1
2105	SUPPORT PEOPLE DON'T SPEAK	1
2103	RETURNED REPLACED ALMOND 2015	1
1243	I'M SURE WORK BETTER	1
1240	GREAT DON'T NEED TECH	1
5066	HORRIBLE COMPLETE PROPAGANDA NETGEAR	1
420	HORRIBLE QOS CAPACITY PERFORMANCE	1
437	GREAT PRODUCT WIFI ROUTER	1
434	AC1900 DUAL BAND WI-FI	1
433	SQ FT HOUSE COMPARING	1
431	FRIENDLY HOOK EXTEND WIFI	1
430	IFFY USE MIGHT UPGRADE	1
429	SPEEDS UNFRIENDLY USER EXPERIENCE	1
428	HELP SETTING RECEIVING WIFI	1
427	INITIALLY KEEPS DROPPING CONNECTION	1
426	CAME DECENT WARRANTY USELESS	1
424	SCREEN WIN10 LATEST DRIVER	1
423	REALLY WELL.....FOR 20 MIN	1
418	MUCH POTENTIAL FAILED MACBOOK	1
478	PORT DESKTOP BUY OK	1
417	WEB INTERFACE NETGEAR ASHAMED	1
416	AC600 WORKS MONTHS ANYMORE	1
414	GREAT PRODUCT MASTER DEGREES	1
413	ISSUES SCAM IDENTITY THEFT	1
412	RUNS FINE ISSUE CONNECTIONS	1
411	FINE BOUGHT COULD USE	1
410	SHORTLY FIRST MONTH USING	1
409	IT'S FAST LOOKING WORKS	1
408	WIFI REAL PROBLEM NONE	1
406	AMAZING SPEED RANGE PARENTAL	1
403	I'M DISAPPOINTED DEVICE DIDN'T	1
438	DROPPING CONNECTIONS LESS CUSTOMIZABLE	1
439	FIX SEEMED RUN OK	1
440	GENIE FAILED NETGEAR SUPPORT	1
441	TOOK NEARLY WEEK FIRST	1
475	CONTROLS OPENDNS COMPLETE GARBAGE	1
473	POOR SUPPORT POOR RELIABILITY	1
471	LOT POTENTIAL LOOK ELSEWHERE	1
469	BROWSING ALMOST LIKE INTERLACED	1
468	MAYBE DONT GO SUPER	1
466	SLEEK RANGE WASN'T ASKED	1
465	IMPROVEMENT WASTE MONEY RETURN	1
464	AVOID LIKE PLAGUE SAMSUNG	1
463	DHCPV6 PREFIX DELEGATION YET	1
462	OPTIMUM SERVICES DON'T BOTHER	1
461	PRODUCT SET-UP SUPPORT APPLE	1
460	THING NIGHTHAWK LOOKS COOL	1
459	DROPPED INTERNET UPDATING FIRMWARE	1
458	TIME MACHINE BACKUP MAC	1
457	WORK WINDOWS 10 DRIVERS	1
456	COULD WOULD RATE ZERO	1
455	TERRIBLE ROUTER MONTHS I'VE	1
454	BEST RANGE BEST WORKS	1
451	DIED WEEKS NETGEAR WOULDN'T	1
448	WIFI ROUTER FEELS LIKE	1
445	GOT DUD HOPING WORKING	1
444	SIGNAL TERRIBLE INTERFACE FEATURES	1
442	WIRELESS CONNECTION VIA MAC	1
402	CUSTOMER SUPPORT CHARGES WIRELESS	1
401	WOULD RECOMMEND RETURN INFO	1
399	WORKS OK LOOSE POWER	1
355	WORKED FINE TODAY USUALLY	1
351	RANGE EXTENDER CONFIGURATION OPTIONS	1
349	WIFI EXTENDERS PRODUCT GETTING	1
347	WORKED IT'S SOFTWARE WASN'T	1
345	SEEMS WORK INTERMITTENTLY LOSE	1
343	PACKET LOSS DOOMS ADAPTER	1
341	V1 V2 BETTER ABILITY	1
338	TRAFFIC LOAD DISCONNECTS FREQUENTLY	1
337	BEWARE PRODUCT TELEPHONE TECH	1
336	SIGNAL ADJACENT ROOM BEYOND	1
335	XFINITY HIGH SPEED INTERNET	1
334	AMAZON RETURN WINDOW CLOSED	1
333	R6700 ROUTER DON'T WASTE	1
332	UNPUBLISHED LIMITATIONS SUITABLE HOMES	1
331	RETURN KEPT DROPPING CONNECTION	1
330	OKAY RANGE CERTAINLY ISN'T	1
329	GOING ISP PROVIDED MODEM	1
328	NET GEAR WIRELESS ROUTER	1
326	KEEP PROBLEM WIRELESS CONNECTION	1
325	RECOMMEND RETURN INFO 30	1
324	REVIEW SINCE NEVER USED	1
323	CONSTANTLY DISCONNECT WIFI MONTH	1
322	IT'S WIFI INTERFERENCE ANYTHING	1
320	UNHAPPY NETGEAR CUSTOMER SERVICE	1
353	TECH SUPPORT PERIOD ENDS	1
357	WORKED MONTHS DAM THING	1
398	REPLACEMENT EXCELLENT RESENT ANOTHER	1
358	DEFECTIVE ROUTER POOR TECHNICAL	1
397	SUCKS WOULDN'T BUY HERE'S	1
395	SHARING WORKING DESPITE HOURS	1
393	TECH FINALLY DETERMINED YET	1
392	SUCKS EVEN GET RANGE	1
391	AMAZON SHIPPING V4 V3	1
386	WORKED CONSISTENTLY DROPPED CONNECTION	1
384	JANUARY 2016 STOPPED WORKING	1
383	NETWORK ACCESS WIRELESS DEVICE	1
381	DESIGNED BETTER LOUD BULKY	1
380	MODEL LONGER SUPPORTED DD-WRT	1
379	PRODUCTS DON'T WORK ADVERTISED	1
376	ROUTER CALLED SPEAK SUPERVISOR	1
375	NETFLIX VIA CHROME CAST	1
373	BOX CAME APPEARED OPEN	1
372	TROUBLESHOOT WIFI ROUTER FEELS	1
371	I'VE FOUND BETTER PRODUCTS	1
370	CONFIGURATION HORRIBLE PROCESS KEEPS	1
367	WORST BUY EVER CUSTOMER	1
366	WORKS GREAT DON'T DECIDE	1
364	GREAT SOMETHING WOULD BUY	1
362	PROBLEMS NIGHTHAWK ROUTER UPDATE	1
361	ROOM SIGNAL WORSE BASIC	1
359	LIKE WASTE ENERGY TIME	1
477	PRODUCT EXTENSIVE TROUBLESHOOTING EFFORT	1
479	COMPETITORS WORKED MUCH BETTER	1
318	IT'S GREAT CUTS FREQUENTLY	1
564	REFURBISHED ROUTER CAME INSTALLATION	1
578	DROPS LATENCY POOR RELIABILITY	1
576	OLDER ROUTER TERMS SECURITY	1
575	BOUGHT FEBRUARY 2016 COMPLETELY	1
573	SURE MAKES MARKET DEVICE	1
572	MAKE SURE CURRENT ROUTER	1
571	INTERNET CIRCA 1994 DIAL-UP	1
570	GREAT FIRST WEEK BESIDES	1
569	OKAY STILL ISSUES GETTING	1
568	ROUTER TOTAL CRAP BOX	1
566	NOISE NEVER BUY ROUTER	1
565	BUY PIECE JUNK USED	1
562	WORKS BETTER CHEAPER UNIT	1
480	NETGEAR GENIE SEEMED LIKE	1
561	DOESN'T NICELY APPLE SONOS	1
560	WNR1000 V1 V2 BETTER	1
558	ROUTERNET LIKE GOING 10	1
557	OFFICE VOIP PHONE INCOMING	1
556	SMART PHONES SMART TV'S	1
555	BOUGHT ASUS LIKE BETTER	1
554	WORKS FIRMWARE UPGRADE MANUAL	1
553	PROBLEMATIC SHORTLY FIRST MONTH	1
552	ALTHOUGH WORK GREAT AMAZON	1
551	V2 VERSION ROUTER OPEN	1
550	HARDWARE ISSUE REQUIRED REPLACEMENT	1
580	I'VE CONSISTENTLY RESET THING	1
581	MONTH CUSTOMER SERVICE MONTHS	1
583	COULD DESIGNED BETTER LOUD	1
584	SLOW AC GREAT PRICE	1
614	NOISY FAN COMES WITHOUT	1
613	SUPPORT REALLY BROUGHT COSYT	1
612	DOESN'T FEEL LIKE UPGRADE	1
611	ROUTER WIFI STOPPED WORKING	1
610	SIGNAL 2000 SQ FT	1
609	CLUNKY MANAGEMENT INTERFACE INCOMPATIBLE	1
607	RETURN WOULD SETUP GOT	1
606	LATEST CISCO LINKSYS PERFORMED	1
605	PROBLEMS NETGEAR SUPPORT EXPERTS	1
603	LASTS MONTHS STARTS DROPPING	1
602	HARD DRIVE FUNCTIONALITY HELL	1
600	GREAT LUCK DIFFERENT MODELS	1
599	VIA OPENDNS WORK RENDERS	1
598	GARBAGE PRODUCT BUY NETGEAR	1
596	CLAIM IT'LL KEEP DISCONNECTED	1
595	SPEED GREATLY REDUCED EXTENDER	1
593	APP UPGRADED FIRMWARE CHECK	1
592	RECOMMEND HOLDING PURCHASE NETGEAR	1
590	ADAPTER FAILED LESS MONTHS	1
589	SINCE BROUGHT BETTER ROUTER	1
588	MBS UNINSTALLER USED N300	1
586	FREEZES COMPLETE EVERY COUPLE	1
585	USELESS CLUNKY BARELY WORKS	1
548	ROUTER WORKS WELL REALLY	1
547	REALLY NEED ROUTER AGGRAVATION	1
546	ENHANCING WIRELESS RELIABILITY THROUGHOUT	1
512	STILL PUT BUGGY GARBAGE	1
509	BASIC FEATURE LOCAL DNS	1
508	FIGURE NEITHER PRINTERS FIND	1
507	RECEPTION COMPARED MODELS BEST	1
506	35 DAYS YET COULD	1
505	ROUTER EVEN CONNECT 30	1
504	RESETS BLOCKS CERTAIN SITES	1
503	TIME DROPS INTERNET EVERY	1
502	WORKED WELL MONTH WIFI	1
501	CONNECT SMART TV INTERNET	1
500	BEST DON'T IT'S WOULD	1
499	WANTED LIKE DROPS UPDATED	1
498	DNS PROXY DHCP BUG	1
497	BUY GO BELKIN PRODUCTS	1
495	HYPE JUNK DON'T WASTE	1
492	ROUTER TERRIBLE FIRST WOULD	1
491	PACKET LOSS GOES 98	1
490	CUSTOMERS ISSUES SCAM IDENTITY	1
489	DUAL BAND WEP SECURITY	1
486	WOULD RECOMMEND PURCHASING NETGEAR	1
484	NETGEAR WOULDN'T SETUP RETURN	1
483	SENT SWITCHED ROUTER 2005	1
482	AROUND FIND BEST SPOT	1
481	ASUS 68U PERFECT SURPRISED	1
511	POORLY DESIGNED PRODUCT UNSATISFACTORY	1
514	RETURNING PRODUCT SOMETHING BETTER	1
545	FALSE REPRESENTATION PRODUCT PRODUCT	1
515	SOFTWARE INSTALLED MALWARE SYSTEM	1
543	WORKED FINE SEVERAL MONTHS	1
542	BETTER CABLE-BASED INTERNET ROUTER--THIS	1
541	CONNECT VIA WEP WPA	1
540	WORKS OKAY CAN'T UPDATE	1
538	USE IPADS STREAMING NETFLIX	1
536	I'M SURE GREAT ROUTER	1
535	CAUTIONARY TALE TRY AVOID	1
533	OVERPRICED UNDERPERFORMED BUGGY ROUTER	1
531	DEFINITELY HAPPY BOX CAME	1
530	SOFTWARE GLITCH SHUT EXTRA	1
529	ALSO SAMSUNG GALAXY S8	1
528	HARD BUYING NETGEAR PRODUCTS	1
527	DIFFERENCE MBPS PAY 60	1
526	MANAGEMENT INTERFACE INCOMPATIBLE NETWORK	1
525	AWAY TIME CLOCK STILL	1
524	STOPPED WORKING 90 SUPPORT	1
523	ABSOLUTELY TRIED SEVERAL TIMES	1
522	WASTE HOURS LIFE BUY	1
521	CHECK N300 ROUTER INSTEAD	1
520	FIRMWARE WITHOUT FIX OFFICIAL	1
518	PRODUCT BECAME PROBLEMATIC SHORTLY	1
517	LAST LONGER YEARS YOU'D	1
516	WORKED GREAT MONTHS BUY	1
319	CAN'T RATE CAN'T INSTALL	1
317	HIGH HOPES HARD LET	1
618	PLEASE GO NETGEAR FORUMS	1
91	DECENT DOESN'T CANDLE ORBI	1
107	SUPPORT WANTED 169.95 GET	1
106	WORKED GREAT WEEK CONSTANT	1
105	GREAT HOUR MAX PROBLEMS	1
103	SOLD HENRY FORD PUT	1
101	SPEEDS DEFINITELY WORTH PRICE	1
100	CHANGE WIFI SIGNAL SPEED	1
99	BUY ROUTER PRODUCT EVEN	1
98	WORTHLESS BETTER GO PRICE	1
95	ONES FLOP PRETTY EASY	1
94	PLUG ETHERNET CABLE LAPTOP	1
93	PUTTING TRAINING WHEELS DUCATI	1
90	PERFORMANCE IDEAL SMALLER AREAS	1
151	GREAT DAYS SUPER FAST	1
89	DOA NETGEAR PLEASE IMPROVE	1
87	EXTEND SERVICE BARELY MAYBE	1
86	IDEA ORBI GREAT ALSO	1
85	INCOMING CALLS MAY ALWAYS	1
84	NETGEAR WANTS PAY SHIPPING	1
82	FIRMWARE WIFI DROPS RANDOMLY	1
81	REFURB DIDN'T WORK AMAZON	1
76	DON'T CALL CUSTOMER SERVICE	1
74	GREAT LIKE REBOOTING MULTIPLE	1
73	DIRECT FIBER OPTIC INTERNET	1
72	FINE MONTHS KEEPS DISCONNECTING	1
108	WORST PIECES TECHNOLOGY I'VE	1
111	DIED WITHIN WEEK USE	1
112	NETGEAR GOT HELP STILL	1
113	ARBITRARY CODE EXECUTION SECURITY	1
148	PRODUCT BEYOND BELIEF CUSTOMER	1
147	WORKS RESEARCH FIRST BUYING	1
146	WORST CUSTOMER SERVICE PRODUCT	1
145	WORKED RELIABLY FIRST WEEK	1
144	MOVIES VIDEOS NOTE HAPPY	1
143	NOTHING SPECIAL...DEFINITELY TERM ROUTER	1
140	SIMPLE SERVICEABLE WI-FI ROUTER	1
139	FIRST WORKS PERFECT STILL	1
138	WIFI EVERY TIME NEED	1
137	CANNOT RECOMMEND 24 HOURS	1
135	SETUP TECH SUPPORT READ	1
134	IT'S LIKE MID 300MB	1
130	DEVICES CONNECT CLOSE ROUTER	1
128	CREATES NET-NEW NETWORKS MAKES	1
127	20 MINS RANGE HORRIBLE	1
126	DEVICES LOSE INTERNET CONNECTION	1
125	TECHNOLOGY I'VE EVER PURCHASED	1
123	CABLE INTERNET COMPANY MADE	1
121	ANYTHING BEYOND BASIC INTERNET	1
118	DM 200 COMPATIBLE CENTURYTEL	1
117	BASIC GIGABIT ROUTER LIMITATIONS	1
116	ADEQUATE USE STOPPED WORKING	1
115	SEVERAL CALLS NETGEAR AGREED	1
71	BACKUP MAC AWFUL SUPPORT	1
69	INITIAL CUSTOMER SERVICE GUIDE	1
68	SUPPOSED MAYBE DONT GO	1
32	WORKED FINE INITIALLY KEEPS	1
30	AWAY ROUTER EVEN CONNECT	1
29	WOULD SETUP GOT MAL-WARE	1
28	SUPPORT APPLE TIME MACHINE	1
27	REPEATER EVEN THOUGH NETGEAR	1
25	FLAWLESSLY WEEKS RESET UNIT	1
24	REAL ND NETGEAR EITHER	1
23	FINE DESIGN TAD INFERIOR	1
22	GREAT HOMES UPDATE FIRMWARE	1
21	WIFI ROUTER SYSTEM WORK	1
19	BROWSE WEB FINE DAYS	1
18	WORK APPLE AIRPORT EXTREME	1
16	DEVICE BEWARE PLAN USE	1
15	FAST LACKING IMPORTANT FEATURES	1
14	2015 ROUTER STILL UNACCEPTABLY	1
13	CONNECTION STILL GREAT STILL	1
12	TONS NAG-WARE WEIRD FORM-FACTOR	1
10	COMPANY PRODUCT QUALITY ISSUES	1
8	OK FIRMWARE ISSUES 1.0.0.32	1
7	BUY DONT GET REFURBER	1
6	SETUP EASY TRANSFER SPEEDS	1
5	WINDOWS 10 WOULD BECOME	1
3	USELESS PRESS RESET BUTTON	1
2	THING ROUTER WIFI EXTENDER	1
31	PROVIDED USELESS INSTRUCTIONS RESOLVING	1
34	WOULD RECOMMEND ROUTER BEYOND	1
67	CRASH'S TRAFFIC LOAD DISCONNECTS	1
35	SOFTWARE USER FRIENDLY EASY	1
66	SIMPLER UI COMPARED REGULAR	1
65	ROUTER SUB-PAR WIFI SCHEDULING	1
64	NICE LOOKING ROUTER NETGEAR	1
63	OKAY ALMOST HARDCOPY DOCUMENTATION	1
61	300MBPS LIKE PRODUCT CLAIMED	1
58	PHASE BROWSING ALMOST LIKE	1
57	FANCY ROUTER LOTS FEATURES	1
56	HOPED WOULD SOLVE PROBLEM	1
55	PRODUCT DOESN'T WORK I'M	1
54	GET AC SPEED WINDOWS	1
53	SOMETHING ACTUALLY WORKS ADVERTISED	1
51	BOUGHT PRODUCT MONTHS AGO	1
49	IT'S MARGINALLY BETTER BEST	1
48	WORKING BETTER FIRST ROUTER	1
45	COULD BEAUTIFUL RELATIONSHIP ENDED	1
44	GIVES TERRIBLE CONNECTION LARGE	1
43	ADVERTISED TRY NETGEAR DUAL	1
42	BUNDLED SOFTWARE INSTALLED MALWARE	1
41	SAVE MONEY ADD 41	1
40	MONTHS REPLACED USED CHIPPED	1
39	FALSE ADVERTISING POORLY PROGRAMMED	1
38	PRODUCT EXTEND RANGE WI-FI	1
37	USING THIRD PARTY FIRMWARE	1
150	LOUSY INTERMITTENT CONNECTION BRICKED	1
152	ITEM CAME QUICKLY SET	1
316	STARTING DELIVER IT'S POTENTIAL	1
257	GREAT SINGLE-FAMILY HOMES GUESS	1
272	BEWARE FAKE REVIEWS BEGINNING	1
271	POWERED WI-FI WON'T HANDLE	1
270	DON'T EXPECT TECH SUPPORT	1
269	TERRIBLE NETGEAR PROBLEMS PARENTAL	1
268	WASTED COUPLE HOURS TRYING	1
267	LAN PORTS RANDOMLY STOP	1
266	SUPPORT ABYSMAL PRODUCT TEMPERAMENTAL	1
263	80 SOFTWARE SUPPORT HARDWARE	1
262	INSTALL DD-WRT FIRMWARE UNLEASH	1
261	CONTACTED SUPPORT DIDN'T USEFUL	1
258	WIRED CONNECTION BRIEFLY TIMES	1
256	PROBLEM ROUTER TRYING REPLACE	1
153	REALLY DON'T KNOW WOULD	1
254	BETTER STRONGER SIGNAL WHOLE	1
252	FOLLOWING MANUAL CAREFULLY ATTEMPTS	1
251	GREAT SET PASSWORD GUEST	1
250	ABSOLUTELY HORRIBLE TOOK 45	1
249	WIRELESS LAN CONNECTIONS REPEATEDLY	1
248	SPEND MONEY GET SOMETHING	1
247	PLUGGING BELKIN ADAPTER WORKED	1
246	BETTER X4 5GHZ BAND	1
244	IT'S WORKING JOB DON'T	1
243	TAKE LOT TIME GET	1
241	GREAT REVIEWS GREAT REAL	1
275	EXTENSION RANGE DROPPED SIGNAL	1
276	UNSTABLE HASN'T PROVED IT'S	1
280	DISAPPOINTED ROUTER PROBABLY STEER	1
281	NICE EVEN ADMIN PAGE	1
315	CONNECTION WIN7 PLATFORM CONNECTS	1
312	CONTROLS WORK INTENTIONAL FALSE	1
308	TECH SUPPORT ABSOLUTELY HORRIBLE	1
307	INSTEAD WORKED MUCH BETTER	1
306	MEDIUM SIZED SINGLE-FAMILY HOME	1
305	REPEATER ANYONE UNDERSTANDS RADIO	1
304	MONTHS BUY UNLESS LIKE	1
303	WOULD MAKE WIFI LARGER	1
302	CHANCE IT'S GOING FEEL	1
300	AP MODE 1.0.2.68 FIRMWARE	1
299	FINE SEVERAL MONTHS KNOCKED	1
297	WORTH SHELLING 100 BUCKS	1
296	IM PRETTY UPSET ROUTER	1
295	ROUTER ROUTER ARRIVED CONTINUED	1
294	I'VE SET ROUTERS MODEMS	1
292	TRANSMITS 40 LESS INTERNET	1
290	WONT EVEN REACH END	1
289	BUYING PRODUCT GOT COMCAST	1
286	MAY RETURN LIKE STYLE	1
285	PRODUCT I'VE BOUGHT AGES	1
284	TECH SUPPORT 90 DAYS	1
283	WORK LATEST COMPUTERS WINDOWS	1
282	PIECE EQUIPMENT EVER BOUGHT	1
240	PREVIOUS V2 MODEL MAKE	1
239	200 DOLLARS ROUTER PRETTY	1
237	DUAL BAND ROUTER SUPPORT	1
192	LIES DD-WRT GOING HAPPEN	1
190	WENT LINKSYS SHOULD'VE NEVER	1
189	UPLOAD BROKEN BUY ANOTHER	1
186	WORKS GREAT TURNS WIFI	1
185	ROOM 30FT AWAY SLOW	1
184	GET NETGEAR HELP INSTALL	1
183	OUTAGES RANDOMLY BYE INTERNET	1
182	PURCHASED RECOMMENDED HARD DRIVE	1
179	ROUTER CURRENTLY SAID SEVERAL	1
177	STABILITY GREAT ESPECIALLY 5GHZ	1
176	WANT DUAL BAND ROUTER	1
175	AC1200 WIFI RANGE EXTENDER	1
173	BOUGHT JUNE QUIT WORKING	1
172	DEVICE WORKS NEED WHATEVER	1
171	PROBLEMS REAL ND NETGEAR	1
170	CONSTANTLY MANAGE TROUBLESHOOT WIFI	1
169	SIMPLY PUT ADAPTER JUNK	1
164	WN2500RP READY PRIME TIME	1
163	EXTERNAL DRIVES ABLE CONNECT	1
162	RETRANSMITS POOR PERFORMANCE OVERALL	1
161	60 MBPS SERVICE CHARTER	1
157	DIFFICULT SET OLDER ROUTERS	1
156	WIFI SEEMS WORK GREAT	1
154	SLIGHTLY STRONGER SIGNAL SIMPLER	1
191	ABYSMAL PRODUCT TEMPERAMENTAL ASTOUNDING	1
194	WALL PLUG VERSION WI-FI	1
236	WANTED COULDN'T FIX PROBLEM	1
197	WELL BOX COVER STATES	1
234	REALLY TERRIBLE NOTE COMES	1
233	AC750 OK FALLS CONCERNING	1
232	ROUTER(WNR3500 WIFI CONNECTED DEVICES	1
231	DON'T WASTE 200 READ	1
228	DRIVE TERRIBLE CUSTOMER SERVICE	1
227	PATHETIC TIME WARNER WIFI	1
226	TERRIBLE SIGNAL NONE EXISTENT	1
225	HAPPY HOPE AMAZON SEND	1
224	FINE TODAY USUALLY RESET	1
222	GREAT PRODUCT IDEA SEND	1
221	ROUTER FORM DIFFERENT MANUFACTURER	1
220	HOPED BEST GOT MODEM	1
218	TRIED SEVERAL LOCATIONS EVEN	1
215	TOLD NETGEAR SUPPORT BUY	1
214	EMPTOR GREAT PRODUCT WIFI	1
213	USABLE NETGEAR GENIE THEREFORE	1
212	PARENTAL CONTROLS NEARLY USELESS	1
210	WORK INTERNET WOULD DROP	1
209	IT'S OKAY STILL ISSUES	1
208	ROUTER DIDNT WORK TOOK	1
207	1.12.0.18 UPDATE CAUSED MAJOR	1
204	LOVED CONCEPT NEVER WOULD	1
203	WIRELESS ADAPTER LIKE PAST	1
616	WOULDNT RECOMMEND METAL ROOF	1
620	MUCH I'M GLAD LOSES	1
1239	ZERO CUSTOMER SUPPORT WIRELESS	1
1027	SMART DVD PLAYER CAN'T	1
1041	PHONES LOSE WIRELESS CONNECTION	1
1039	HIRES PEOPLE SPEAK ENGLISH	1
1037	PART PRODUCT ACTUALLY NETGEAR	1
1036	ROUTER EASY SETUP TECH	1
1035	RIP COULD NEVER SET	1
1034	SUPPORT TOTALLY USELESS VIA	1
1032	TERRIBLE CONDUCTS WIFI WORST	1
1031	OK DAYS WIFI KEEPS	1
1030	SPEND EXTRA MONEY GET	1
1029	HATE SIGNAL DROPS TIME	1
1028	X4 5GHZ BAND WEAK	1
1026	DAYS PAST RETURN PERIOD	1
1078	SPLURGED BOUGHT BEST MADE	1
1025	SUPERIOR HARDWARE INCOMPLETE FIRMWARE	1
1024	NEVER HELD SIGNAL MOVED	1
1023	SPECIALISTS TRIED TELL ROUTER	1
1022	SPEED SLOW RANGE HORRIBLE	1
1021	REFER S7UDENTMAN REVIEW POSTED	1
1020	BEST THING NIGHTHAWK LOOKS	1
1018	FILTER WIRELESS CONNECTION VIA	1
1017	SUPPORT DIFFICULT IMPOSSIBLE UNDERSTAND	1
1016	KEEPS CRASHING LINKSYS WRT54G	1
1015	CHANGING FACTORY RECOMMENDED POSITION	1
1014	GET ASUS ASIN:B00FB45SI4 ASUS	1
1042	WORK SONY TV MACBOOK	1
1043	RELIABILITY ISSUE FIRMWARE DATE	1
1044	TOOLS HOWEVER TERRIBLY IMPLEMENTED	1
1046	LIKE RE-BOOT TIME ROUTER	1
1073	LAPTOP CONNECT NETGEAR BOOSTER	1
1072	HARD TIME PRODUCT NETGEAR	1
1071	UNGAINLY FORM FACTOR OVERALL	1
1070	GREAT HARDWARE POOR FIRMWARE	1
1069	REFURBISHED PRODUCT STOPPED WORKING	1
1068	ETHERNET HALF FAST SOMETHING	1
1067	WORKED COUPLE WEEKS STARTED	1
1066	USB DRIVE FUNCTIONALITY NEEDS	1
1064	DON'T DIFFERENCE CONNECTION I'VE	1
1063	ROUTER SYSTEM WORK DIRECT	1
1061	BAND STEERING GREAT OVERALL	1
1060	WOULD WORK CENTURY LINK	1
1059	SPOTTY SHOWS STRONG WIFI	1
1058	GREAT RANGE INTELLIGENT WIRELESS	1
1057	WIFI CLIENTS KEEP GETTING	1
1055	GREAT PRICE FAST RELIABLE	1
1054	TOLD WORKS TIME WARNER	1
1053	ABSOLUTELY STAY AWAY TIME	1
1052	MUCH BETTER PRODUCTS AVAILABLE	1
1051	OK RANGE NOTHING EVEN	1
1049	SERVICE SUCKS AVOID COSTS	1
1048	COULD GET EXTENDER WORK	1
1047	SERICE RUN AD SMELLS	1
1013	EVERYTHING COMES LIKE APP	1
1012	TOTAL PIECE IT'S HOURS	1
1011	STRONG WIFI SIGNAL USUALLY	1
974	THRU EVERY POSSIBLE FIX	1
968	BETTER WIFI ROUTER INSTEAD	1
966	WORK WELL EVERY NETGEAR	1
963	BETTER CHEAP N300 BOUGHT	1
961	PRODUCT RETURN WOULD WORK	1
960	MUCH BETTER LIST FORMAT	1
958	ADAPTER WENT TOLD NETGEAR	1
957	BETTER PRODUCTS COST LESS	1
956	BOUGHT HOPING WOULD POWERFUL	1
955	ASUS ROUTER MICRO CENTER	1
954	WELL NETGEAR ROUTER PC	1
953	GREAT SINCE FLASH ROUTER	1
952	OK STILL NEED WORK	1
951	FUNCTIONALITY NEEDS DEVELOPMENT RELIABLE	1
948	WORKED WEEK EVERY MOUSE	1
947	PRICE DECENT MODEM PAINFUL	1
945	PRODUCT NEEDS BETTER ANTENNA	1
944	RETURN WARRANTY 90 DAYS	1
941	COMPLETELY GARBAGE BOUGHT MARCH	1
940	SECURITY CONCERN IMPOSSIBLE RESTRICT	1
937	GREAT MONTHS BUY UNLESS	1
936	MEET MINIMUM PERFORMANCE STANDARDS	1
935	SENDING WIFI APPARENT REASON	1
934	AVERAGE USERS JUNK OTHERWISE	1
971	GREAT CONCEPT DIDNT IMPROVE	1
975	DUAL WIFI ROUTER SUPPORTS	1
1010	SECOND FLOOR ROOMS HOUSE	1
976	MAKES DECENT PRODUCT TERRIBLE	1
1008	NOTHING SERVICE DROPS SINCE	1
1007	COST ADAPTER WINDOWS XP	1
1006	WIFI PRETTY DAMN PROBLEMS	1
1005	WORKED GREAT STARTED USING	1
1004	POOR PRODUCT WORSE CUSTOMER	1
1003	ASSUMED EXPERIENCE WOULD BETTER	1
1001	PLAN USE PARENTAL CONTROLS	1
999	PARENTAL CONTROLS WIRELESS ROUTER	1
998	UNINSTALLER USED N300 NETGEAR	1
997	DELIVERED UNIT WORK SPENT	1
996	MONTHS CAN'T GET RMA	1
995	THOUGH DIRECT REPLACEMENT INSTALLATION	1
993	SURE PRICE PERFORMANCE RATIO	1
992	GARBAGE GOES THANKFULLY ASUS	1
990	PRETTY PERSISTENT GETTING CONNECT	1
989	LOOKS POOR PERFORMANCE LOUSY	1
987	EVER BUY NETGEAR PRODUCT	1
986	BUYING SERVICE CONTRACTS WITHIN	1
985	FINE NORMAL ANTIVIRUS VENDORS	1
983	WON'T KNOW SLOW EXPERIENCE	1
982	MINUTE SUPPORT NETGEAR EITHER	1
981	STOPPED WORKING MONTHS GUESS	1
977	STARTS DROPPING WIFI SIGNAL	1
1077	LACKING BASIC ACCESS RESTRICTIONS	1
1079	SPEEDS HORRIBLE TECH SUPPORT	1
932	CUSTOMER SERVICE PRODUCT BEWARE	1
1181	SIGNAL DROPS TIME 80	1
1195	HASN'T PROVED IT'S WORTH	1
1193	CONSTANT REBOOTING EVERY LITTLE	1
1192	GARBAGE MONTHS DOESN'T CONNECT	1
1191	DEVICE ASK MONEY GET	1
1188	POOR SIGNAL PEOPLE USING	1
1187	INFERIOR R6700V2 R6700 MODEL	1
1186	TRI-BAND AC ROUTER MAKE	1
1185	68U PERFECT SURPRISED 5GHZ	1
1184	NICE LOW COST ADAPTER	1
1183	HORRIBLE CUSTOMER SERVICE WARRANTY	1
1182	MINUTES WASTE TIME MONEY	1
1180	CONNECTIONS DROPS REBOOTS YUCK	1
1083	GARBAGE TRY STREAMING MOVIE	1
1179	DESKTOP BUY OK DON'T	1
1178	IT'S CONSTANTLY MANAGE TROUBLESHOOT	1
1177	WARRANTY 90 DAYS LOOKS	1
1175	NIGHTHAWK X10 SEVERELY LACKING	1
1172	DEAD EVEN LOAD GUI	1
1170	TESTED LEAVES DEVICE NEEDS	1
1169	PROBLEMS CAUSE DISCONNECTS TIME	1
1168	PRODUCT WORTHLESS CUSTOMER SERVICE	1
1167	GOTTEN PERFORMED BETTER 40	1
1166	AWFUL ROUTER BUY MODEL	1
1164	STILL ISSUES GETTING BOOTED	1
1196	PATHETIC PRODUCT PATHETIC CUSTOMER	1
1198	SUPPORT LOUSY BRIDGING REPEATING	1
1204	REPLACED ALMOND 2015 WORKED	1
1206	SETUP SOFTWARE LESS HALF-BAKED	1
1238	WINDOWS GUEST OS VIA	1
1237	EMPTY WALLET REPAIRS PLEASE	1
1236	BEWARE USE IPADS STREAMING	1
1235	SAMSUNG SMART TV ISSUES	1
1234	AWAY NETGEAR SOMEDAY FIXES	1
1232	ANYTHING LIKE SURPRISED HASN'T	1
1231	YOU'RE GOING ISP PROVIDED	1
1230	ROUTER MONTHS NOTHING PROBLEMS	1
1229	LACKING WEB UI 2015	1
1228	SPENT HUNDREDS TECH FIGURE	1
1226	DON'T BUY WASTE MONEY	1
1225	GREAT POTENTIAL POOR PERFORMANCE	1
1224	WORKING MONTHS INTERMITTENT PROBLEMS	1
1223	TOOK FOREVER GET TECH	1
1221	BUY NETGEAR HIGH END	1
1219	WORKS WELL NETGEAR ROUTER	1
1218	BEWARE YOU'RE LOOKING HASSLE-FREE	1
1217	SERVICE POOR QUALITY PRODUCT	1
1216	HARDWARE MEDIOCRE FIRMWARE CRAPPY	1
1215	DOGGED POOR QOS SOFTWARE	1
1213	ROUTER PUT CLEAR SPOT	1
1209	PHONE RATHER NETGEAR TECH	1
1207	GET DUAL BAND ROUTER	1
1162	BRIEF PERIODS TIME WIRELESS	1
1161	NIGHTHAWK X10 BUCKS LITTLE	1
1160	IT'S OK SPEND MONEY	1
1122	NETGEAR CUSTOMER SERVICE WORST	1
1119	PROBLEM EVERYONE ELSE GREAT	1
1117	BROKEN POOR FEATURE SET	1
1116	OLDER BELKIN ROUTER EXTREMELY	1
1115	WARNING R6700 AMAZON SENDS	1
1113	ABSOLUTELY WORST EVER BOUGHT	1
1112	CUSTOMER SUPPORT DON'T WASTE	1
1111	ANDROID IOS DEVICES BUY	1
1110	HORRIBLE SET INSTRUCIONS SUPPORT	1
1109	NICE ROUTER UNLESS WANT	1
1108	HARDWARE BROUGHT TRIVIAL THINGS	1
1107	CUSTOMER SERVICE TERRIBLE SUCKS	1
1105	BETTER BETTER OPTIONS ALSO	1
1103	SPEEDS 30 SNAIL ROUTER	1
1098	ANTENNA PATTERN WHETHER CHANGING	1
1097	FIRMWARE UNLEASH IT'S TRUE	1
1095	VOIP PHONE INCOMING CALLS	1
1093	RESOLVING ISSUE DROPPING 5G	1
1090	MONTHS AGO WORKED EXTREMELY	1
1089	CONNECTED ROUTER WORKS FINE	1
1088	LOVE 7000 WANTING LITTLE	1
1087	WIRED SET WIRELESS ACCESS	1
1086	MODEM WORKS FINE PLUG	1
1084	RETURNED TP-LINK TL-WDR3500 WORKED	1
1121	DEAL ROUTER DON'T WORTH	1
1123	WON'T WORK WINDOWS 8.1	1
1159	GREAT EXTENDER ACCES POINT	1
1124	WORKS CONNECTION WINDOWS 10	1
1158	NETGEAR'S TECH SUPPORT WORST	1
1157	WORKS YEARS WISH WOULD	1
1155	CANNOT FIND VERIZON DSL	1
1153	EXCELLENT CONDITION ROUTER APPEARED	1
1152	PHYSICAL LAN PORTS STOPPED	1
1151	GET WORKING TOOK CALLS	1
1150	SETUP OUTSTANDING RESULTS GARBAGE	1
1149	OK DON'T BUY PERIOD	1
1148	READ POWER SUPPLY PROBLEM	1
1144	CONNECTIVITY ISSUES LOWER FLOOR	1
1143	FINE ALSO WIRED CONNECTION	1
1142	DIED NETGEAR WOULD HONOR	1
1141	MODEM MAY FUNCTION WELL	1
1140	WORKED FINE DEC 2016	1
1137	DRIVES ABLE CONNECT NAS	1
1136	TIME WIRELESS WIRED CONNECTIONS	1
1134	MAINTAIN CONNECTION LESS PURCHASE	1
1133	HARDWARE FAILURE LESS WEEK	1
1132	DISCLOSED SECURITY EXPERTS DEC	1
1131	NEEDS REAL WORLD TESTING	1
1130	INPUT FAILED SWITCH UNPLUG	1
1129	SOMETHING ELSE RELIABILITY POOR	1
1126	AWESOME HARDWARE HORRIBLE LACKING	1
933	CHOKES INTERNET BANDWITH CAUSING	1
930	ROUTER UTTERLY DISASTROUS 100	1
621	BOUGHT ROUTER HOPES WOULD	1
722	GETS JOB DONE SIGNAL	1
742	SIGNIFICANT HARDWARE PROBLEMS DEVICES	1
741	EVER STAY AWAY BUY	1
740	HOURS CHANGE MIGHT WORTH	1
738	WIRELESS-AC1900 DUAL-BAND GIGABIT ROUTER	1
737	WIFI ROUTER CRANK HOOTERVILLE	1
736	CONCEPT SOUNDED GREAT COULD	1
734	PERFECT STILL WORKING SECOND	1
733	LIKE DROPS UPDATED 1/2015	1
730	EXTENDER USED SELL EXPENSIVE	1
729	BUY INSTALLATION CDROM SERIAL	1
728	SQ FT LEVEL TOWN	1
721	WANT TAKE TIME WRITE	1
778	DON'T BUY REFURBISHED NETGEAR	1
719	WORKS GREAT PRICE CERTAINLY	1
718	LITTLE COMPLICATED INSTALLATION GREAT	1
717	DEFAULT WIFI CONFIGURATION WOULDN'T	1
716	CONSISTENT CONNECTION CASES SHOWS	1
715	SPEED NET SAYS SPEED	1
714	HAPPY BOX CAME APPEARED	1
712	GREAT POTENTIAL STABILITY GREAT	1
711	GREAT ITEM DIDN'T RESET	1
710	ROUTER PROVIDES COVERAGE ENTIRE	1
708	5G GUEST NETWORK WORK	1
707	ROUTER PURCHASE COULD MAKE	1
744	WORKED FINE EXCEPT WITHIN	1
745	WORKS FINE PLUG ETHERNET	1
746	WOULD AVOID PURCHASING AC1750	1
747	LIFETIME WARRANTY PAY TECH	1
774	MBPS 50 MBPS LINE	1
772	AVOID EXPENSIVE PIECE JUNK	1
771	WENT TOLD NETGEAR SUPPORT	1
770	BAND WI-FI RANGE EXTENDER	1
768	LOOK COOL DISAPPOINT MUCH	1
767	BROKE SPENT HUNDREDS TECH	1
766	OK FALLS CONCERNING DHCP	1
765	LINK MODEM/ROUTER BUYING ROUTER	1
764	REALLY SUCKS PREPARED EMPTY	1
763	CONECTION COAXIAL CONNECTION ETHERNET	1
762	GOT HELP STILL I'M	1
759	ROUTER MUCH CHEAPER COMPARABLE	1
758	GREAT START FAILED END	1
757	WISH REFURBISHED ROUTER CAME	1
756	QUALITY OK SOFTWARE REACH	1
755	CAREFUL REGISTER IMMEDIATELY RECEIPT	1
754	EASY SETUP PRETTY FAST	1
753	2000 SQ FT HOUSE	1
752	ROUTER PARENTAL CONTROLS NEED	1
751	FINE COULD NEVER GET	1
750	LAST GET 90 SUPPORT	1
749	BETTER RESULTS 40 ROUTER	1
748	BUY PIECE GARBAGE WEEKS	1
705	USE.BUY LOCALLY RETURN EASILY	1
704	ROUTER USABLE NETGEAR GENIE	1
703	FIZZING STATIC NOISE COMING	1
659	RANGE EXTENDER CONSTANTLY LOSES	1
657	EVEN WITHOUT HARD DRIVE	1
656	LOOKS GREAT EVEN MEAN	1
654	TECH SUPPORT WANTED COULDN'T	1
653	BOX COVER STATES BUTTON	1
652	INCREDIBLY FRUSTRATING EXPERIENCE DUE	1
651	WORK FINE BLU RAY	1
649	THING NEVER WORKED WELL	1
647	TERRIBLE UNIT AVOID BUYING	1
646	TOP LINE FEATURES EXPECT	1
644	USB DLNA BROKEN POOR	1
641	COOL BRO PAY ACTIVATE	1
638	HOG MACHINES RETURNED REFUND	1
636	BEWARE I'VE ALREADY MULTIPLE	1
634	SPAN 180 ROUTER PRETTY	1
633	DEVICE LIKE APOLOGIES AMAZON	1
632	EVER BUY THING POOR	1
630	CHARGE 200 FREE LIFETIME	1
629	WOULDN'T WORK NONE DEVICES	1
627	LIKE ROUTER HATE REVIEW	1
626	GREAT STARTED USING ROUTER	1
624	95 LOL DON'T EVEN	1
623	HARD EASY GOOGLE WIFI	1
622	DROPPED CONNECTIONS HARD GET	1
658	RE-INSTALLING DRIVERS ENDED PLUGGING	1
661	ISSUES CONTACTED TECH SUPPORT	1
700	FIRMWARE ISSUES BROKE TRY	1
662	WANTS PAY FIGURE NEITHER	1
697	SENT REPLACEMENT WORKS FINE	1
696	SUDDEN REBOOT EVERY 5-8	1
695	UI PERFORMANCE DEFAULT WIFI	1
693	WORK WINDOWS 10 NETGEAR	1
692	WORKING DESPITE HOURS TECH	1
691	FLOOR GREAT SECOND FLOOR	1
690	LOVED IT.....AT FIRST....3 MONTHS	1
689	SUPER EASY SETUP OUTSTANDING	1
685	WORKS CERTAIN COMPUTERS ALSO	1
682	WORTH WAITING BETTER FIRMWARE	1
680	POOR TECHNICAL SUPPORT SERVICE	1
679	BUY REFURBISHED NETGEAR ROUTER	1
678	PROBLEM CONNECTING WINDOWS LAPTOPS	1
677	GET WI-FI SECOND FLOOR	1
676	SEEMED WORK FINE LITTLE	1
674	FUNNY ACTUALLY RECOMMENDED ROUTER	1
673	AIRPRINT PRINTER SOUNDS LIKE	1
672	WITHOUT SMUDGED STICKY SUBSTANCE	1
671	SUPPORT REPLACEMENT PROCESS MISERABLE	1
