	name	count
7162	WORST CUSTOMER SERVICE EVER	11
3680	DON'T WASTE TIME MONEY	10
2419	UNABLE OBTAIN IP ADDRESS	8
939	WORST ROUTER I'VE EVER	7
4743	ADDRESS UNABLE OBTAIN IP	6
6658	OBTAIN IP ADDRESS UNABLE	6
6113	IP ADDRESS UNABLE OBTAIN	6
5515	BAND WI-FI GIGABIT ROUTER	5
8085	DUAL BAND WI-FI GIGABIT	5
8218	DESKTOP WIFI RANGE EXTENDER	5
2847	NETGEAR AC1200 DESKTOP WIFI	4
808	PRODUCT TERRIBLE CUSTOMER SERVICE	4
2437	AC1200 DESKTOP WIFI RANGE	4
3311	N750 DUAL BAND WI-FI	4
3889	NETGEAR N750 DUAL BAND	4
663	USED NETGEAR NIGHTHAWK X8	3
5848	WORKS GREAT AMAZON DIDN'T	3
8094	PERFORMANCE EASY SETUP POOR	3
2612	RESET EVERY MONTHS NETGEAR	3
7251	BUGGY STAY AWAY COSTS	3
6752	GREAT RANGE LOW BANDWITH	3
1443	NETGEAR SUPPORT SAID EXTENDER	3
3941	ANOTHER UNIT KEEPS DROPPING	3
3940	PROBLEM INCREDIBLY CRAPPY NETGEAR	3
6749	RANGE CUTS DOWNLOAD 50	3
8086	EXPENSIVE WEAK SIGNAL RESTART	3
3934	LOCKS REQUIRING POWER CYCLED	3
3931	PURCHASED APPLE REFURBISHED RANGE	3
3930	EXTENDER GRADUALLY DEGRADED FUNCTIONALLY	3
3929	USB 3.0 HARD DRIVE	3
8080	PREPARED PAY TECHNICAL SUPPORT	3
3968	WON'T ADMIT ONGOING MAJOR	3
8101	WIRELESS NETWORK NETGEAR PRODUCT	3
3969	MONTHS NETGEAR ACCESS ROUTER	3
5829	MISLEADING EQUIPMENT SUGGEST PURCHASING	3
5788	MESH NETWORK EXTENDER ALSO	3
2563	BEWARE PRODUCT WANT USE	3
2564	NETGEAR SUPPORT RECOMMENDED ANOTHER	3
8122	AC1900 WIFI RANGE EXTENDER	3
4033	RECOMMENDED BUY ETHERNET CABLE	3
4032	NEVER BUY ANOTHER NETGEAR	3
4031	NEXTGEAR EXTENDER NETGEAR YET	3
5797	WORST PIECES ELECTRONIC EQUIPMENT	3
4024	NEVER ABLE ESTABLISH CONNECTION	3
6785	OK SUPPORT PRODUCT DURABLE	3
4016	TERRIBLE MAC LOUSY CUSTOMER	3
5803	WORSE PERFORMANCE CONNECTING DIRECTLY	3
4000	WORKED WEEK THAT'S MOVED	3
2589	SUPPORT PRODUCT DURABLE ENOUGH	3
7537	PRIMETIME USED NETGEAR NIGHTHAWK	3
640	SPEED/DISTANCE LIMITS TECHNOLOGY INDIVIDUAL	3
2590	100 EXTENDER WOULD GREAT	3
1458	LOW QUALITY HIGH OVERPRICED	3
5815	WORK SEVERAL WASTED HOURS	3
6762	SPEED EVEN THOUGH CONNECTION	3
8102	SOMETIMES IT'S GET BETTER	3
650	INTERNET FINE LAPTOP DOWNLOAD	3
3919	WELL OUTLET POORLY PLACED	3
2624	EXTENDER BASE ROUTER NIGHTHAWK	3
1435	BEWARE USED EQUIPMENT PURCHASING	3
3918	IT'S ROBUST IT'S 750MBPS	3
3849	X8 TRI-BAND WIFI ROUTER	3
3847	RANGE EXTENDER ACTUALLY GREAT	3
2687	EXTENDED NETWORK HELL TWILIGHT	3
5915	WASTE AROUND HOURS LIFE	3
6700	EFFORT NOTHING EXPENSIVE EMPTY	3
3833	GREAT EASY USE TERRIBLE	3
5921	FINALLY WIFI RANGE EXTENDER	3
5922	SAID EXTENDER WOULD IDEAL	3
6690	WIRELESS ACCESS POINT POOR	3
5927	KEPT FREEZING..NEVER REALLY WORKED	3
8043	IT'S GET BETTER INTERNET	3
3818	GET BETTER WIFI RECEPTION	3
3817	VENDOR WON'T ADMIT ONGOING	3
3813	PROBLEMS SETUP SEEMED EASY	3
1399	FINALLY BECOME CONVINCED FUTILITY	3
3808	WORKS WELL SIMPLIFIED ENVIRONMENTS	3
1397	ENOUGH POSITIONED 60 FEET	3
3803	WOULD SOLUTION GET BETTER	3
1395	REGISTER COULDN'T ACCESS ACCOUNT	3
5943	WOULD GREAT CONNECTIONS TH	3
3794	BOTHERE BUYIN ITEM WORK	3
3793	COULD STAY CONNECTED WEP	3
725	PRODUCT SUPPORT DISAPPOINTED NETGEAR	3
6709	EXTENDER WORK COMCAST XFINITY	3
3915	USE EFFECTIVE EXTENDER BUY	3
6713	OBTAINED WORSE PERFORMANCE CONNECTING	3
687	GOTTEN WORSE BOUGHT AC2200	3
688	RANGE EXTENDER ACTUALLY WORKS	3
2559	WIFI SIGNAL ACTUALLY WORSE	3
2636	FIRST TIME...NOT MUCH NEXT	3
3906	WALKED LIKE 300 FEET	3
5870	ACTUALLY WORKS BETTER EXPECTED	3
1431	ACTUALLY WORSE CONNECTED DEVICE	3
7555	EX6200 CONNECTION NETGEAR R8000	3
2645	SETUP SEEMED EASY ENOUGH	3
699	WIFI RANGE EXTENDER EX6200	3
3887	25 FEET ROUTER WALLS	3
702	MAKES PRODUCT USELESS TIMES	3
2649	SET CALLED NETGEAR CUSTOMER	3
2652	EXTENDER ACTUALLY GREAT EASY	3
706	EXTEND 5GHZ NETWORK UNRELIABLE	3
2659	USER FRIENDLY SUPPORT HELPFUL	3
3879	AC 3200 ROUTER WANTED	3
5888	WORKED OK QUIT CUSTOMER	3
2667	ROUTER WORK GREAT WISH	3
2668	MODERATE BEST COULD COMBINATION	3
1418	QUALITY HIGH OVERPRICED OPINION	3
8125	DEVICE DESTROYS NETWORK SECURITY	3
6800	INCREDIBLY CRAPPY NETGEAR SUPPORT	3
8129	EXTENDER ALSO NIGHTHAWK ROUTER	3
5784	EXCELLENT EXTENDER DON'T BUY	3
5636	WANT USE MAC DEVICES	3
476	BETTER MODEM TIME WARNER	3
8230	JAMS MAIN ROUTER SIGNAL	3
6894	PROBLEMS PRODUCT CUSTOMER SUPPORT	3
8227	PRODUCT UNUSUAL CIRCUMSTANCES POWER	3
5647	STOPPED WORKING 10 MONTHS	3
4242	ELECTRONIC EQUIPMENT EVER OWNED	3
4236	DOA AMAZON WAREHOUSE ITEM	3
7472	DOESN'T ACTUALLY EXTEND NETWORK	3
7473	ACCESS POINT HELPS PERFECT	3
5659	STOPPED WORKING SUPPORT TEAM	3
7474	DISAPPOINTED NETGEAR GOING NEXT	3
5664	READY GET PAY KIDDING	3
8213	MODE POOR DIRECTLY CONNECTING	3
2442	HANGS EVERY 1-2 DAYS	3
5669	RESET SWITCHING INTERNET PROVIDERS	3
2453	THINGS WORSE RATHER BETTER	3
8206	NIGHTHAWK X4 AC2200 WIFI	3
2454	STAY CONNECTED WEP SWITCHED	3
4204	NETWORK HELL TWILIGHT ZONE	3
4197	ADMIT ONGOING MAJOR PROBLEMS	3
4191	CUSTOMER SERVICE ENTIRE LIFE	3
8198	RESETS RE-NAMED NETWORK UNFORTUNATELY	3
472	LOOKS LIKE GOING BIN	3
5634	N600 INITIAL SET QUICK	3
467	SURE ACTUALLY NEED BETTER	3
2382	EXTEND SIGNAL WELL OUTLET	3
2346	DISCONNECTS ROUTER DESPITE 10	3
8267	OK EXTENDER POOR CUSTOMER	3
1593	30 WARRANTY CONSISTENTLY DROPS	3
2352	NETGEAR SUPPORT SUCKS GET	3
432	ETHERNET INTERNET CONNECTION ISSUES	3
4318	XBOX PLAYS DONT LIKE	3
4317	READY PRIMETIME USED NETGEAR	3
4312	EXTENDER WORKS MUCH BETTER	3
1586	WARRANTY SERVICE PART BUYING	3
2378	USED WIRELESS ACCESS POINT	3
449	GET BETTER SPEEDS WANT	3
8237	TOTAL SOLUTIUON WIFI PROBLEM	3
5618	NEARLY 15 OFF-BRAND TRAVEL	3
1574	POWER ON/OFF SWITCH LONGER	3
7455	HARD RESET EVERY MONTHS	3
8246	JUNK POOR QUALITY CONTROL	3
8245	ROUTER GIVES BETTER RECEPTION	3
5626	BIT PROBABLY WASTE MONEY	3
5628	GAVE NIGHTHAWK AC 3200	3
2394	CONSISTENTLY DROPS WIFI BROADCAST	3
2395	PRODUCT SURE GETS REVIEW	3
6908	RECOMMENDED ANOTHER SETTINGS TWEAK	3
519	WORST CUSTOMER SERVICE ENTIRE	3
8196	RANGE EXTENDER CONNECTED MONTHS	3
1532	GET INFO WARRANTY SERVICE	3
5762	POOR QUALITY CONTROL LEADS	3
7506	EVERY 1-2 DAYS CUSTOMER	3
4093	EPIC FAILURE MULTIPLE DISCONNECTS	3
5753	FASTLANE HALF FAST EXPECTING	3
2527	DROPS CONNECTION REQUIRES RESTART	3
579	GREAT BOX EXTENDING RANGE	3
2528	ESTABLISHED NETWORK COULD NEVER	3
8148	SETUP IT'S ROBUST IT'S	3
582	MAY CUSTOMER SERVICE STINKS	3
5758	NETGEAR WORST CUSTOMER SERVICE	3
4084	POOR DIRECTLY CONNECTING ROUTER	3
6815	NETWORK COULD NEVER ACCESS	3
2516	1-2 DAYS CUSTOMER SUPPORT	3
4073	PAIN SET CALLED NETGEAR	3
2533	NETWORK EXTENDER ALSO NIGHTHAWK	3
8139	COMPANY MAKE GREAT PRODUCT	3
4068	WON'T PURCHASE RECOMMEND NETGEAR	3
597	MODEM TIME WARNER RECENTLY	3
2545	DOUBT WORST PIECES ELECTRONIC	3
5779	PIECES ELECTRONIC EQUIPMENT EVER	3
8134	ENTIRE LIFE BUY NETGEAR	3
601	PERSON LITTLE NETWORKING EXPERIENCE	3
6678	PROBABLY BEST AVOID POWERFUL	3
1501	MEAN PRODUCT UNUSUAL CIRCUMSTANCES	3
4120	USELESS ALSO GET 2GEXT	3
5689	PURCHASED PRODUCT REVIEWS SAID	3
8181	WI-FI EXTENDER TOTAL PILE	3
6861	SIGNAL RESTART STAY AWAY	3
6859	FELT LIKE TAKEN STEP	3
8188	EXTENDERS WORKED FINE PROBLEM	3
6851	AVOID EXTENDER BASE ROUTER	3
4174	EASY SETUP IT'S ROBUST	3
2479	CUSTOMER SUPPORT REFURBISHED ITEMS	3
1522	WORKS FINE 3-5 DAYS	3
5699	MAC LOUSY CUSTOMER SERVICE	3
8182	PIECE GARBAGE FREQUENTLY LOCKS	3
539	USELESS COMMUNICATION BARRIER HORRENDOUS	3
544	SEEMED EASY ENOUGH POSITIONED	3
5733	PRODOUCTS MAY CUSTOMER SERVICE	3
1516	INFO WARRANTY SERVICE PART	3
5710	GREAT WISH COULD RETURN	3
5712	FUTILITY EFFORT NOTHING EXPENSIVE	3
549	FAILURE MULTIPLE DISCONNECTS ROUTER	3
8173	FIRMWARE UPDATE 1.0.0.36 1.0.0.38	3
6840	SINCE MID JULY LAST	3
6832	DESIGNED DEVICE SET DOESN'T	3
5718	BETTER SET ASUS MEDIA	3
8163	AVOID VENDOR WON'T ADMIT	3
4123	10 LINE SIGHT PROXIMITY	3
5951	COMPUTER GENIUS LOVE FRUSTRATED	3
1380	CONNECTED WEP SWITCHED WPA2	3
3777	LOOKING GET BETTER SPEEDS	3
3344	RESTART STAY AWAY DEVICE	3
6229	CANT USE WIRED EXTENDER	3
6483	BOUGHT NETGEAR AC1200 DESKTOP	3
6232	GHZ AC2200 EXTENDER NEWEST	3
3364	DEVICE SINCE MID JULY	3
6482	RT 66U WOULD BETTER	3
1214	BOUGHT AC2200 EXTEND SIGNAL	3
3360	EXPERIENCED WORST CUSTOMER SERVICE	3
7707	REFUSES CONNECT CERTAIN TYPES	3
3351	NETGEAR CUSTOMER SERVICE HORRIBLE	3
6241	DON'T EXTENDER PLAN USE	3
7838	DON'T BOTHERE BUYIN ITEM	3
2991	EVERY MONTHS NETGEAR ACCESS	3
6479	BETTER WIFI RECEPTION UPSTAIRS	3
3337	WEP SWITCHED WPA2 ROUTER	3
7834	WORKED FINE PROBLEM PRODUCT	3
3333	TAKEN STEP BACKWARDS INITIAL	3
6478	GET ANOTHER UNIT KEEPS	3
3016	EVERY HOUR CUSTOMER SERVICE	3
1201	PRODUCT USELESS TIMES DIRE	3
3314	MADE THINGS WORSE RATHER	3
1040	MAJOR HEADACHE WORTHLESS CUSTOMER	3
1199	MAKES CREATE NETWORK REALLY	3
6485	DEVICE OVERPRICED PIECE GARBAGE	3
1000	TECH SUPPORT USELESS COMMUNICATION	3
1384	RANGE EXTENDER 1/2 PRICE	3
2974	COULD BETTER COULD WORSE	3
965	175 PAID INCREASED PERFORMANCE	3
6517	WITHIN 25 FEET ROUTER	3
3462	FEET AWAY LOST BAR	3
1241	WITHOUT DOUBT WORST PIECES	3
973	TRYING GET BETTER WIFI	3
2965	MIGHT WORK CAN'T TELL	3
6162	TERRIBLE THROUGHPUT 5GHZ BAND	3
6173	INSTALLATION COULD STAY CONNECTED	3
979	CONNECTION BECOMES UNSTABLE FIRMWARE	3
980	BETTER LIKE TP-LINK RE355	3
6174	EASY SET HARDWARE GET	3
3412	TERRIFIC DISAPPOINTED RANGE EXTENDER	3
984	PRODUCT READ FINE PRINT	3
6495	FASTLAND MODE POOR DIRECTLY	3
6182	WORKED WORKED GREAT QUIT	3
988	LATENCY TERRIBLE THROUGHPUT 5GHZ	3
2983	PRODUCT WASTE MONEY TIME	3
3421	STOPPED WORKING 4-5 MONTHS	3
3419	WIFI RECEPTION UPSTAIRS DOWNSTAIRS	3
3418	GLITCHY FIRMWARE FINICKY PERFORMANCE	3
7694	QUALITY CONTROL LEADS UNITS	3
2985	IT'S GREAT I'VE REGULAR	3
6269	CRAPPY PRODUCT SURE GETS	3
3304	MAJOR DISAPPOINTMENT FIRST UNIT	3
6275	ITEM WORKS TEMPORARILY EVENTUALLY	3
3113	LIKE STILL LOT QUALITY	3
1099	ROUTER DESPITE 10 LINE	3
1102	MAKE SURE ACTUALLY NEED	3
3101	SUPPORT RECOMMENDED ANOTHER SETTINGS	3
3103	DAYS CUSTOMER SUPPORT REFURBISHED	3
1106	KEEP WITHIN 25 FEET	3
6418	CONNECTION ISSUES PS4 DEVICE	3
7745	REPEATER KEEP MIND SPEED/DISTANCE	3
7775	WORKING EVERY SEVERAL DAYS	3
7773	IMPRESSED PLUGGED 10 FEET	3
1114	USB DRIVE FILES BUYING	3
6375	CREATE NETWORK REALLY EXTENDER	3
3028	MONEY IMPOSSIBLE INSTALL WOULD	3
3118	NIGHTHAWK AC 3200 ROUTER	3
1120	GO MESH NETWORK GOOGLE	3
3119	BECOMES UNSTABLE FIRMWARE UPDATE	3
7766	UNIT WORKED FINE BEGINNING	3
6383	RECOMMEND NETGEAR PRODUCTS ANYONE	3
3153	USELESS TIMES DIRE NEED	3
3123	CONTROL LEADS UNITS WORK	3
1128	BEST AVOID POWERFUL WIFI	3
3125	EX6200 WORKED LOT BETTER	3
3140	SUPPORT SAID EXTENDER WOULD	3
3089	WASTED HOUR TIME TRYING	3
1094	ACCESS POINT POOR CUSTOMER	3
6430	INSTRUCTIONS POORLY WRITTEN WEB	3
3209	INSTRUCTIONS CANNOT USED WIRELESS	3
3296	EXTENDER EX7300 WONT CONNECT	3
6282	I'VE REGULAR PROBLEMS SIGNALS	3
3036	BETTER INTERNET GARAGE WAY	3
7813	EXTENDER 1/2 PRICE EXTENDER	3
7716	NETGEAR WIRELESS NETWORK NETGEAR	3
1189	POWERFUL WIFI DEVICE POS	3
3050	SPEED MUCH SLOWER VS	3
3267	WAY MUCH MONEY IMPOSSIBLE	3
1065	PROBLEM AVAILBLE CONNECTION ACTUAL	3
3262	PERFORMANCE CONNECTING DIRECTLY NETGEAR	3
6448	NETGEAR R8000 WIRELESS ROUTER	3
6305	BUY UNLESS COMPUTER GENIUS	3
3256	WORSE BOUGHT AC2200 EXTEND	3
6315	WONT BOOST HARDWR NORMAL	3
7796	WEAK SIGNAL RESTART STAY	3
3241	DOESN'T MEAN PRODUCT UNUSUAL	3
3063	SET ASUS MEDIA BRIDGE	3
1174	UNIT FAIRLY CLOSE ROUTER	3
6337	NETGEAR SUPPORT LIKE OTHERS	3
6338	SWITCHED WPA2 ROUTER WORKS	3
3210	RECOMMEND PURCHASE INADEQUATE INSTALLATION	3
2946	GREAT MONTH LESS CONNECT	3
7679	EASY CASE WPS AVAILABLE	3
6151	DESPITE INSTRUCTIONS CANNOT USED	3
1336	FINE LAPTOP DOWNLOAD 1-2MB'S	3
3694	STOPS WORKING EVERY SEVERAL	3
6635	I'M TRYING GET BETTER	3
822	EXTENDER ACTUALLY WORKS BETTER	3
827	WOULD BETTER SET ASUS	3
7614	BECOME CONVINCED FUTILITY EFFORT	3
6628	BUY ANOTHER NETGEAR PRODUCT	3
833	MIND SPEED/DISTANCE LIMITS TECHNOLOGY	3
1339	EXTENDER BUY MESH INSTEAD	3
838	INITIAL SET QUICK EASY	3
7973	66U WOULD BETTER SET	3
3670	AC2200 WIFI RANGE EXTENDER	3
7956	WARRANTY CONSISTENTLY DROPS WIFI	3
1334	FLOOR PRETTY WELL HARDLY	3
7622	DAYS WARRANTY RAN SERVICE	3
6031	OK QUIT CUSTOMER SUPPORT	3
2809	COMPATIBILITY ISSUES APPLE AIRPORT	3
3654	ROUTER HOUSE SIMPLY HOPING	3
853	NIGHTHAWK X8 TRI-BAND WIFI	3
2815	WORKS FLOOR PRETTY WELL	3
2818	UNSTABLE FIRMWARE UPDATE 1.0.0.36	3
6611	STUPID CANT USE WIRED	3
3647	WIFI SET FORGOT WEEKLY	3
1350	WIFI RANGE EXTENDER ACTUALLY	3
6637	ALSO GET 2GEXT ACTIVATED	3
815	CONNECTING DIRECTLY NETGEAR NIGHTHAWK	3
1355	SIGNAL ACTUALLY WORSE CONNECTED	3
3771	DIRECTLY NETGEAR NIGHTHAWK AC1900	3
773	TOTAL GARBAGE WOULD WORK	3
2343	CALLED NETGEAR CUSTOMER SUPPORT	3
3758	POSITIONED 60 FEET AWAY	3
776	EXTENDER BETTER OVERALL RETURNING	3
5970	SUPPORT SUCKS GET STUCK	3
6670	POORLY WRITTEN WEB SITE	3
6667	OVERPRICED PIECE GARBAGE FREQUENTLY	3
7591	POWER CYCLE SYSTEM-CHECK CONNECTIONS-RELOAD	3
1375	POINT POOR CUSTOMER SERVICE	3
5979	IT'S GOTTEN WORSE BOUGHT	3
3744	WORSE CURRENT NETGEAR WN2500RP	3
3743	HARDWR NORMAL ROUTER GONNA	3
8007	POOR FIRMWARE SETUP BUY	3
794	WI-FI EXTENDER ADDS CONNECTION	3
5990	MADE GHZ NETWORK MUCH	3
7999	WASTED HOURS TECH SUPPORT	3
3724	APPLE REFURBISHED RANGE EXTENDER	3
3718	THOUGHT WOULD SOLUTION GET	3
3706	INTERNET CONNECTION ISSUES PS4	3
1356	REPLACED ASUS RT 66U	3
1321	WORKS WELL SETUP DIFFICULT	3
2820	LEADS UNITS WORK OTHERS	3
1250	GARBAGE FREQUENTLY LOCKS REQUIRING	3
3522	I'M LOOKING GET BETTER	3
6569	DESCRIBE POORLY THING MADE	3
6565	AVOID POWERFUL WIFI DEVICE	3
7655	LIMITS TECHNOLOGY INDIVIDUAL TOPOLOGY	3
910	RANGE EXTENDER EX7300 WONT	3
6561	NETGEAR GOING NEXT E-TRASH	3
7659	NETWORK REALLY EXTENDER ORIGINAL	3
6558	HARDWARE GET INFO WARRANTY	3
2894	COULD RETURN SINCE DOESN'T	3
6112	GET PAY KIDDING IT'S	3
3526	AMAZON DIDN'T MENTION OPENED	3
6122	EASY USE TERRIBLE SUPPORT	3
3641	DIFFICULT SETUP DUE COMPATIBILITY	3
938	IT'S CAN'T IT'S BETTER	3
3506	STOPPED WORKING MANAFACTURE WARRENTY	3
6128	DOESN'T ANYTHING SATISFACTORY KNOBS	3
3500	OTHERS POWER CYCLE SYSTEM-CHECK	3
3498	SAVE MONEY BUY SOMETHING	3
6134	SEEMS IMPROVED WIFI RANGE	3
2937	EFFECTIVE EXTENDER BUY MESH	3
6144	NETGEAR TECH SUPPORT TERRIBLE	3
2938	BUY ETHERNET CABLE TRY	3
3478	EXTENDS RANGE TRANSMIT SPEEDS	3
3577	POORLY THING MADE JUNK	3
7926	SETUP BUY ANOTHER BRAND	3
1293	ACTUALLY EXTEND NETWORK CREATES	3
3581	PRODUCT WITHOUT DOUBT WORST	3
6610	UNIT KEEPS DROPPING CONNECTION	3
865	BROKEN GHZ AC2200 EXTENDER	3
3636	SIGNAL MODERATE BEST COULD	3
6609	INBOUND SIGNAL MODERATE BEST	3
1315	ANTENNAE HANG LOW WOBBLE	3
6604	FIRMWARE SETUP BUY ANOTHER	3
2838	SECURITY DECREASE REQUIRED EXTENDING	3
1312	ETHERNET CABLE TRY DIFFERENT	3
3625	DIRECTLY CONNECTING ROUTER GHZ	3
3617	WOULD PERSON LITTLE NETWORKING	3
6059	DUE COMPATIBILITY ISSUES APPLE	3
7643	PURCHASE INADEQUATE INSTALLATION INSTRUCTIONS	3
7645	AC750'S BETTER LESS COSTLY	3
6071	EXTENDER PLAN USE 2.4GB	3
2854	USELESS UNLESS NETGEAR FULLY	3
2858	EXTENDER TOTAL PILE HORSE	3
1300	WORTH 175 PAID INCREASED	3
3592	SIGNAL WELL OUTLET POORLY	3
2865	HEADACHE WORTHLESS CUSTOMER SUPPORT	3
7651	BUY BETTER LIKE TP-LINK	3
6079	ALWAYS PROBLEM AVAILBLE CONNECTION	3
2344	DROPS OFTEN REFUSES CONNECT	3
1135	GHZ NETWORK MUCH SLOWER	3
1601	WELL CONSTANT DROPPED CONNECTION	3
4867	REFUSES EXTEND 5GHZ NETWORK	3
4524	WIFI EXTENDER DOESNT WORK	3
5448	COVERAGE SPEED MUCH SLOWER	3
5447	WORKS GREAT AV RECEIVER	3
4529	SUPPORT USELESS COMMUNICATION BARRIER	3
2223	SUPPORT LIKE OTHERS POWER	3
1671	PLAYS DONT LIKE CONNECTIONS	3
1839	EASY EXTENDER GRADUALLY DEGRADED	3
1838	USING ROUTER EXTENDER BETTER	3
311	EXTENDS RANGE CUTS DOWNLOAD	3
7312	WORKS TEMPORARILY EVENTUALLY FAILS	3
7205	I'VE RANGE EXTENDER CONNECTED	3
7203	DROPS CONNECTION EVERY MINUTES	3
309	REFURBISHED RANGE EXTENDER 1/2	3
1674	300 FEET AWAY LOST	3
8497	SET HARDWARE GET INFO	3
1936	PAST TERRIFIC DISAPPOINTED RANGE	3
8347	HOUSE SIMPLY HOPING 100	3
7387	NEED BETTER MODEM TIME	3
8349	DISAPPOINTED DOESN'T WORK TIME	3
2214	POORLY DESIGNED DEVICE SET	3
122	MULTIPLE UNITS STOPPED WORKING	3
4551	APPLE WIFI SET FORGOT	3
4930	WRITTEN WEB SITE GET	3
1681	WORKING PROBLEMS SETUP SEEMED	3
219	SATISFACTORY KNOBS SIDE WON'T	3
1773	MESH NETWORK GOOGLE WIFI	3
1829	EXTREMELY DIFFICULT SETUP DUE	3
5422	MUCH SLOWER VS ROUTER	3
7385	POS CONFIGURATION INTERFACE PROCESS	3
5196	SPEED FASTLAND MODE POOR	3
7206	AVAILBLE CONNECTION ACTUAL INTERNET	3
7209	GET BETTER SIGNAL UPSTAIRS	3
4712	EASY ENOUGH POSITIONED 60	3
8465	INCREDIBLY FRUSTRATING NON-FUNCTIONING PRODUCT	3
5296	UNLESS COMPUTER GENIUS LOVE	3
7220	STILL LOT QUALITY RELIABILITY	3
5128	EXPENSIVE EMPTY BOXES WI	3
201	ESPECIALLY SINCE RESEARCH PRODUCT	3
2104	EXTENDING NETGEAR WIRELESS NETWORK	3
4490	EXTENDER POOR CUSTOMER SUPPORT	3
7009	X4 AC2200 WIFI RANGE	3
1655	SUPPORT DISAPPOINTED NETGEAR GOING	3
5474	PURCHASED GO ALONG NETGEAR	3
5299	OK WINDOWS TERRIBLE MAC	3
7214	COULD GET DEVICE CONNECT	3
1746	BOOST HARDWR NORMAL ROUTER	3
110	CANNOT RESET SWITCHING INTERNET	3
2016	ANYTHING SATISFACTORY KNOBS SIDE	3
7011	NETGEAR AC1900 WIFI RANGE	3
7013	ADAMANTLY REFUSES EXTEND 5GHZ	3
8326	CAN'T CONNECT DESPITE HOURS	3
129	SAVE MONEY BUY RELIABLE	3
2242	SIGNAL ROUTER HOUSE SIMPLY	3
7017	SETUP DUE COMPATIBILITY ISSUES	3
5460	SERVICE ENTIRE LIFE BUY	3
5458	HOPE SYSTEM ALREADY COMPATIBLE	3
1741	ASUS RT 66U WOULD	3
5313	ROUTER PRACTICE MAKE PAIR	3
5454	SETUP EASY CASE WPS	3
2232	EXTENDS COVERAGE SPEED MUCH	3
8509	MOBILE DEVICES ROOMATE'S COMPUTER	3
5143	TRY SEVERAL WAYS CONNECT	3
1954	WORK ADVERTISED TECH SUPPORT	3
7036	WORK WELL CONSTANT DROPPED	3
83	NEVER COULD GET WORK	3
1826	ADDS CONNECTION EXTENDS EXISTING	3
7079	WORKS WELL MOBILE DEVICES	3
1998	WOULD LOVE KNOW HAPPENED	3
5371	LOVE KNOW HAPPENED WHETHER	3
4631	QUIT CUSTOMER SUPPORT ATROCIOUS	3
7057	AWFUL ENOUGH WORDS DESCRIBE	3
102	ENOUGH WORDS DESCRIBE POORLY	3
2149	I'VE DEVICE SINCE MID	3
4893	ROUTER EXTENDER BETTER OVERALL	3
2175	ISSUES APPLE AIRPORT EXTREME	3
4642	ACTUALLY GREAT EASY USE	3
4645	WIDER RADIUS AWFUL CONNECTION	3
7304	CONNECTED PROBLEM 5X WOULDN'T	3
2151	BETTER SPEEDS WANT PUT	3
7365	KNOWING NETGEAR PRODUCT PURCHASED	3
8396	DEVICE POS CONFIGURATION INTERFACE	3
4651	GREAT AMAZON DIDN'T MENTION	3
4653	GREAT I'VE REGULAR PROBLEMS	3
7306	NETGEAR ROUTER PRACTICE MAKE	3
2165	SUPPORT CORRUPTED USB DRIVE	3
8476	WOULD WORK NETGEAR NIGHTHAWK	3
5192	DEVICE SET DOESN'T CLOSE	3
8389	NETGEAR FULLY FUNCTIONING FIRMWARE	3
2154	WIZARD USER FRIENDLY SUPPORT	3
2160	CONNECTION NETGEAR R8000 WIRELESS	3
242	DISAPPOINTING PRODUCT PRICE POINT	3
7072	SLOW SPEED EVEN THOUGH	3
5343	PLAN USE 2.4GB BAND	3
1717	IMPOSSIBLE INSTALL WOULD BUY	3
4674	POOR PRODUCT WI-FI RANGE	3
4882	AWFUL PRODUCT SUPPORT DISAPPOINTED	3
1997	SOLUTION GET BETTER SIGNAL	3
114	GET READY GET PAY	3
5174	DEVICE EXTEND 5GHZ NETWORK	3
4896	BUYER BEWARE INTERNET WORSE	3
5410	WORKED GREAT MONTH LESS	3
1689	TRANSMIT SPEEDS STILL SLOW	3
4578	EXTENDER WOULD GREAT CONNECTIONS	3
8490	HOPING 100 EXTENDER WOULD	3
1823	REQUIRED EXTENDING NETGEAR WIRELESS	3
7042	1/2 PRICE EXTENDER WORKS	3
7043	WINDOWS TERRIBLE MAC LOUSY	3
2199	DON'T WASTE TIME DISAPPOINTED	3
7044	NICE REPEATER KEEP MIND	3
7046	NETGEAR R8500 REPLACED ASUS	3
5182	WORK GREAT WISH COULD	3
92	DONT LIKE CONNECTIONS GOING	3
4587	MULTIPLE DISCONNECTS ROUTER DESPITE	3
2143	GARBAGE WEAK SIGNAL BULKY	3
5399	WORKED GREAT QUIT REASON	3
277	KNOW NETGEAR COMPANY MAKE	3
4595	GOT 2X CONNECTED PROBLEM	3
5394	BETTER GO MESH NETWORK	3
4686	EX7300 WONT CONNECT ROUTER	3
273	PRICE EXTENDER WORKS MUCH	3
4603	MONEY BUY RELIABLE UNIT	3
2192	NETGEAR NIGHTHAWK X4 AC2200	3
229	SETUP WIZARD USER FRIENDLY	3
97	WORDS DESCRIBE POORLY THING	3
2190	ACTUALLY NEED BETTER MODEM	3
4616	NETGEAR COMPANY MAKE GREAT	3
4621	NETGEAR TECH SUPPORT USELESS	3
8471	2X CONNECTED PROBLEM 5X	3
7178	ALONG NETGEAR ROUTER PRACTICE	3
131	ALSO NIGHTHAWK ROUTER WORK	3
7010	NEVER ABLE GET WORK	3
2002	SEEMS LIKE FALSE ADVERTISING	3
174	STOP WORKING LESS MONTH	3
5249	TERRIBLE AWFUL ENOUGH WORDS	3
8295	FINE 3-5 DAYS REBOOT	3
1918	DROPS WIFI BROADCAST BEWARE	3
8544	UNLESS NETGEAR FULLY FUNCTIONING	3
5278	MUCH LESS BANDWIDTH EXTENDER	3
6980	5GHZ NETWORK UNRELIABLE JUNK	3
1902	BETTER HOPE SYSTEM ALREADY	3
407	LOOKS LIKE STILL LOT	3
2052	KEEP MIND SPEED/DISTANCE LIMITS	3
7139	EXTENDER INCREASED RANGE WIRELESS	3
1787	REQUIRES HARD RESET EVERY	3
1885	PRODUCT EASY REGISTER COULDN'T	3
7256	LAPTOP DOWNLOAD 1-2MB'S EASY	3
5057	R8500 REPLACED ASUS RT	3
9	MUCH WORSE CURRENT NETGEAR	3
2070	RANGE TRANSMIT SPEEDS STILL	3
6985	MADE WIFI HOUSE WORSE	3
7159	AC2200 EXTENDER NEWEST FIRMWARE	3
5099	WORK NETGEAR NIGHTHAWK R8000	3
5281	SET-UP EASY EXTENDER GRADUALLY	3
4366	GIVES BETTER RECEPTION SO-CALLED	3
8549	WORKS I'M LOOKING GET	3
2311	DESPITE 10 LINE SIGHT	3
4444	GET SIGNAL ROUTER HOUSE	3
382	GREAT UNIT HORRIBLE SETUP	3
1917	NETGEAR NIGHTHAWK X8 TRI-BAND	3
5058	PRETTY WELL HARDLY GO	3
7423	WENT MESH NETWORK EXTENDER	3
5094	GOING NEXT E-TRASH RUN	3
4774	NETGEAR N300 WALL PLUG	3
180	PRODUCT WI-FI RANGE EXTENSION	3
4399	PRIMITIVE BUGGY STAY AWAY	3
5034	15 OFF-BRAND TRAVEL ROUTER	3
4392	DISAPPOINTED ESPECIALLY SINCE RESEARCH	3
4390	EASY REGISTER COULDN'T ACCESS	3
1621	CONVINCED FUTILITY EFFORT NOTHING	3
6965	EVEN THOUGH CONNECTION STRONG	3
390	STILL TRYING FIGURE INSTRUCTIONS	3
1913	RESEARCH BUY BETTER LIKE	3
388	WOW CRAPPY PRODUCT SURE	3
5097	NIGHTHAWK ROUTER WORK GREAT	3
5556	EASY USE EFFECTIVE EXTENDER	3
5246	CONNECT DESPITE HOURS TRYING	3
6972	NOTHING EXPENSIVE EMPTY BOXES	3
1910	EASY SETUP POOR RANGE	3
7324	DEVICE CONSISTENTLY DISCONNECTS ROUTER	3
4809	DIDN'T MENTION OPENED USED	3
5084	NECESSARY READJUSTED SYSTEM WIFI	3
2084	PRODUCT WANT USE MAC	3
149	PICK INTERNET FINE LAPTOP	3
6960	SINCE RESEARCH PRODUCT CAME	3
4820	COMPLETED INSTALLATION COULD STAY	3
8303	EXTENDER ADDS CONNECTION EXTENDS	3
2028	WEAK SIGNAL BULKY RETURNED	3
415	MENTION OPENED USED PREVIOUSLY	3
2260	FREQUENTLY LOCKS REQUIRING POWER	3
1637	BETTER EX6200 CONNECTION NETGEAR	3
7134	WORK DOESN'T MEAN PRODUCT	3
356	KNOW HAPPENED WHETHER SELLER	3
4355	STAY AWAY NETGEAR PRODUCTS	3
4460	OFTEN REFUSES CONNECT CERTAIN	3
136	WELL MOBILE DEVICES ROOMATE'S	3
8554	PROVIDE RELIABLE NETWORK CONNECTION	3
8313	HANG LOW WOBBLE FRO	3
1796	LIKE TAKEN STEP BACKWARDS	3
352	SET QUICK EASY BAT	3
1646	SIGNAL BULKY RETURNED IMMEDIATELY	3
165	SEVERAL WASTED HOURS TECH	3
2336	WISH COULD RETURN SINCE	3
1933	DISAPPOINTMENT FIRST UNIT ARRIVED	3
1934	INCREASED LATENCY TERRIBLE THROUGHPUT	3
2259	PERFORMANCE EXTREMELY DIFFICULT SETUP	3
7275	MUCH MONEY IMPOSSIBLE INSTALL	3
2258	WORKS BETTER EXPECTED ANYMORE	3
166	ROUTER NETGEAR R8500 REPLACED	3
4480	REALLY EXTENDER ORIGINAL NETWORK	3
4481	PAY KIDDING IT'S WORSE	3
4485	SWITCH LONGER WORKS YEARS	3
1797	LIKE OTHERS POWER CYCLE	3
8318	DECREASE REQUIRED EXTENDING NETGEAR	3
2065	WORKING SUPPORT TEAM CARE	3
1619	SERVICE PART BUYING DECISION	3
7114	GARBAGE WOULD WORK NETGEAR	3
5005	WORKED BIT PROBABLY WASTE	3
7228	LIKE 300 FEET AWAY	3
2334	GET BETTER INTERNET GARAGE	3
1640	CORRUPTED USB DRIVE FILES	3
8306	EX7300 WORK ADVERTISED TECH	3
5007	HELPED LITTLE VIDEO STREAMING	3
1925	UNITS STOPPED WORKING 4-5	3
4756	SINGLE DEVICE DESTROYS NETWORK	3
2335	WIFI RANGE EXTENDER EX7300	3
8307	ON/OFF SWITCH LONGER WORKS	3
1753	PRODUCT DURABLE ENOUGH RECOMMENDATION	3
2096	SIMPLY HOPING 100 EXTENDER	3
4	MONEY BUY SOMETHING BETTER	3
8308	GO ALONG NETGEAR ROUTER	3
360	CANNOT USED WIRELESS ACCESS	3
4997	WIFI DEVICE POS CONFIGURATION	3
2272	BETTER RECEPTION SO-CALLED EXTENDER	3
5230	PURCHASE RECOMMEND NETGEAR PRODUCTS	3
2917	ROUTER RETROSPECT WORKED BETTER	2
2925	INSTALLED MAKE USB PORT	2
2913	ENOUGH MENTION POTENTIAL BUYERS	2
2817	DROPS CONNECTIONS TIME BELIEVE	2
2061	SET SIGNAL STRENGTH LACKING	2
2003	5GHZ RADIO FAILURE APPARENTELY	2
2049	GREAT THEORY ZONE HOME	2
6543	WORKS 1/3 SPEEDS ROUTER	2
2814	REFUND NEED KNOW SEND	2
7145	ROUTER FACEBOOK OPTION WOR	2
2050	WORK...SSID SHOWS NOTHING CONNECT	2
2920	SINCE STOCK FIRMWARE USUALLY	2
2059	WNDR4500 ISN'T ROUTER IT'S	2
7167	WOULD LIKE RETURN REFUND	2
7176	DON'T BUY ROUTER REASONS	2
7168	WORK WATCH POOR CUSTOMER	2
2850	GET REFUND NEED KNOW	2
6560	WIFI SIGNAL GOING MISSING	2
6585	GARBAGE NETGEAR EVER RELEASED	2
7170	SERVICE EVER STAY AWAY	2
7160	CHECKED MODEM WORKS FINE	2
2023	TECH SUPPORT ISN'T MUCH	2
2885	CABLES EVERY TEN MINUTES	2
2883	SIGNAL CAN'T COMPARE NIGHTHAWK	2
6579	DIFFICULT TIME GETTING EXTENDER	2
6564	NEWER GET COAX BOX	2
2880	COUPLE MONTHS FACE PROBLEMS	2
2890	NETGEAR SAYS SOLD RETURNED	2
7165	TERRIBLY PICKY IPHONES MOBILE	2
2015	YEAR...WISHED I'D BOUGHT WARRANTY	2
2019	HOUR DEVICES CONNECTED EVERYTHING	2
2864	D-LINK ROUTER BETTER PIECE	2
6567	RANGE NICE ROUTER!...BUT READYSHARE...DOES	2
6576	BETTER FREQUENCY INBOUND UNIT	2
6571	RESETTING DUE WIFI LOSING	2
2867	EXPERIENCE PRETTY CLEAR NETGEAR	2
6572	GREAT BASIC WEB BROWSING	2
2872	STAY CONNECTED INTERNET WEEK	2
6589	SUPPORT ISN'T MUCH BETTER	2
2891	END PRODUCT SET SERVICE	2
2912	INTERRUPTS INTERNET CONNECTION DEVICES	2
7175	BEGINNING COMPLETELY DISAPPOINTING MONTHS	2
2822	RANGE LEAVES SOMETHING DESIRED	2
2044	MONTHS NEEDS RESETTING DAILY	2
2828	PRETTY FREQUENTLY KIND BUMMER	2
6547	COMPUTER IT'S EASY SETUP	2
2043	R6300 V2 DROP CONNECTION	2
7152	FRUSTRATING TECH SUPPORT NETGEAR	2
2905	LISTEN CAREFULLY WORK WORK	2
7154	POOR SUPPORT POOR RETURN	2
2904	CALLED CABLE COMPANY NICE	2
6552	GAVE DISGUST TODAY DECIDED	2
6553	MODEL NETGEAR LASTED YEARS	2
2030	SLOW 2.4G ROUTER-5G BAND	2
2842	PERFECT PRE-RATIFIED 802.11 AC	2
2017	REPLACED 12-YEAR ROUTER RETROSPECT	2
6554	EXTEND WI-FI YARD HOPED	2
7174	USED NETGEAR BIT PAST	2
7173	WEEKS STILL CAN'T GET	2
2898	HARDWARE REVISION RELY CURRENT	2
6555	PORT LOOK LIKE COMPUTER	2
2032	CAME WORKED FINE COUPLE	2
2896	WIFI EXTENDER READY SHARE	2
2892	LITTLE IMPROVEMENT OLDER ROUTER	2
2843	COVERAGE RANGE HOUSE LOW	2
7197	ENOUGH ESPECIALLY CONSIDERING PRICE	2
6533	MONTH NEEDED REPLACED EASY	2
3054	THING PROBABLY WORK SETUP	2
3071	LOOKS GREAT PERFORMANCE DEPENDS	2
1919	WIRELESS ACCESS POINT AVERAGE	2
3069	ROUTER LOUSIEST TECHNICAL SUPPORT	2
3067	FAILURE CONNECT INDIA SUPPORT	2
7232	PROMISING INITIALLY CONFIGURATION OPTIONS	2
6444	WORK I'M SURE WORKS	2
3064	HUNK JUNK BUYER BEWARE	2
3061	SUCKED NET GEAR LEAST	2
3060	PERFORMS POORLY GAMING SHINE	2
7230	DEVICE MAC OWNERS EXPECT	2
1923	STILL ISSUES BETTER SIGNAL	2
7229	PLACED PRODUCT ALMOST EVERYWHERE	2
3058	WASTE TIME GET ASUS	2
1927	INITIALLY CONFIGURATION OPTIONS FINALLY	2
6438	DISASTER HALF SPEED TPLINK	2
