	name	count
8023	FINALLY PATCHED NEED CLOSE	2
8019	PRODUCT INTERNET KEEP CUTTING	2
7855	VERSION AMAZON PREVIOSLY LEASED	2
845	GREAT INTERNET CONNECTION FAST	2
7949	VULNERABILITIES SOONER FRONT CUSTOMERS	2
868	WI-FI SIGNAL LAPSES DISCONNECTS	2
7998	PRODUCT CUSTOMER SUPPORT GROSSLY	2
7995	DISAPPOINTMENT PRODUCT LACK CUSTOMER	2
863	WANT POWER CYCLE DAILY	2
803	MIGHT WANT BUY NETGEAR	2
7959	STOPPED WORKING LESS MONTH	2
857	WORKS WELL CAUSES FIREFOX	2
7964	SIMPLE REVIEW QUIT WORKING	2
809	DISAGREE REVIEWS WNDR4500 N900	2
7990	99 TIME LIKE LINKSYS	2
7967	PIECE JUNK CONNECTION PROBLEMS	2
847	SINCE BOUGHT LESS 30	2
814	BREAKER ANNOYING ENOUGH MENTION	2
7947	RANDOM DROPPED CONNECTIONS INTERNET	2
816	WORK TECH SUPPORT CLUELESS	2
844	BUGGY 5GHZ BAND ROUTER	2
817	60 TIME WORKS EVERYTIME	2
7986	LIKE FACEBOOK COUPLE WEBSITES	2
7971	SOUNDS FUNNY VIDEO SEEMS	2
819	EXTENDER READY SHARE DEFECTIVE	2
7985	DELIVERS HALF SPEED GETTING	2
7984	CAN'T EXTEND WIFI NETWORK	2
823	FUNNY VIDEO SEEMS FINE	2
7983	TECHNICAL SUPPORT SORELY DISAPPOINTED	2
7974	SOOOOOO IM REALIZING GREAT	2
7981	I'M SURE WORKS WELL	2
832	ROUTER FACTORY OVERALL EXPERIENCE	2
8000	ROUTER WORKS PERFECTLY FINE	2
8001	BEWARE HIGH SPEED CONNECTION	2
769	JUNK CONNECTION PROBLEMS LACK	2
887	CALLED NETGEAR TECHNICAL SUPPORT	2
7923	DEVICE DAILY GET WORK	2
907	BOX NEEDS GET PASSWORD	2
906	FAST SPEEDS DON'T LAST	2
904	ITEM USED MISSING PIECES	2
902	SOFTWARE INSTALLED MAKE USB	2
8014	WORKED FINE DON'T KNOW	2
897	ROUTER THINKING BETTER RANGE	2
7930	3.0 HARD DRIVE ATTACHMENT	2
7931	FRUSTRATION SET-UP DOESN'T WORK	2
894	PATCHED NEED CLOSE VULNERABILITIES	2
892	DON'T LIKE CREATING PUBLIC	2
7933	NETGEAR PROVIDES ZERO SUPPORT	2
775	PAY TECH SUPPORT EVEN	2
8012	NICE UNIT NOTE SEEMS	2
875	INTERNET SPEED EVEN LAPTOP	2
884	DISAPPOINTED SHOULD'VE SPENT SOMETHING	2
7939	MONEY BUYING DIFFERENT BRAND	2
781	TIME GET ASUS D-LINK	2
882	EXTREMELY EASY SIGNAL STRONG	2
782	2.4 GHZ NETWORK UNSTABLE	2
7940	STOPPED WORKING 30 DAYS	2
785	WORKS GREAT IT'S EASY	2
787	INCREDIBLY UNRELIABLE SLOW MONTH	2
8006	HELL LOT TIME KICK	2
8005	PAY 159 90 DAYS	2
790	SET-UP DOESN'T WORK DESCRIBED	2
792	WAP SETUP ISSUES WORKING	2
8003	FREQUENCY USED DEVICES LOOKS	2
1002	POORLY GAMING SHINE STREAMING	2
686	TEAM MEMBERS SEVERAL REPAIRS	2
7729	REASON BOUGHT RESTART EVERYDAY	2
8147	UGH GREAT HACKERS TAKE	2
1127	ERRATIC TECH SUPPORT INDIFFERENT	2
1125	SEEM DROP PRETTY FREQUENTLY	2
567	EVER SINCE WORKS TERRIBLY	2
7769	V2 DROP CONNECTION ABLE	2
1118	BEST BUY CAME BOX	2
7770	LOCKS DROPS CONNECTIONS WARNING	2
8156	BUYER BEWARE PRODUCT GREAT	2
7771	CABLE COMPANY NICE SAID	2
7774	USB WORK ADVERTISED BUY	2
7776	USELESS OFFSHORE TECH SUPPORT	2
574	INFORMED WASTE MONEY SUPPORT	2
577	CONNECTION SOMETIMES DRAGS AUDIO	2
8149	CONTINUALLY REBOOT ROUTER DAILY	2
1104	LOCKS WORTH MONEY EVEN	2
7761	SUPPORT WANT CHARGE MONEY	2
1101	NEED USE DIFFERENT SSID	2
1100	ROUTER PLACE DSL/CABLE PLUG	2
7782	TRYING WORK BUGS DOESN'T	2
7783	STOPPED WORKING SUDDENLY LESS	2
1096	JUNK SEEMINGLY INNOCENT LOOKING	2
587	TECH SUPPORT EVEN WORSE	2
7785	REPLACED EASY GIVEN TIME	2
8143	USE ROUTER RECOMMEND STAYING	2
1092	UPDATE DIED SUDDENLY MYSTERIOUSLY	2
1091	SPEED ISSUES MYBOOK LIFE	2
591	PUTT END HOUSE STILL	2
7788	ROUTER WR1000 EXTENDER EXCELLENT	2
594	ROUTER MAC USERS PEOPLE	2
7762	PRODUCT WORKS FINE AFTERWARDS	2
7760	EQUAL 10YR ROUTER WR1000	2
1082	AC3200 UNIT WORKED BOX	2
8177	NETGEAR CUSTOMER SERVICE GARBAGE	2
1176	SAVING MODE WAKE NEEDED	2
8189	FAST...GREAT RANGE NICE ROUTER!...BUT	2
1173	WORKS WELL SETTING SEVERAL	2
532	GET COAX BOX NEEDS	2
1171	2.4GHZ PROVED FLAKY MAYBE	2
8185	RETURN PERIOD COMPLETE GARBAGE	2
534	COMPLETELY DISAPPOINTING MONTHS LATER	2
8184	PROBABLY WORK SETUP HUGE	2
7734	WORKED FINE MONTHS AGO	2
537	WORKING RESET SEVERAL TIMES	2
8178	INFORMATION TECHNOLOGY USED NETGEAR	2
1165	WORKING LIKE ROUTER FIREWALL	2
1163	LACK USB DEVICE SUPPORT	2
7739	EXACTLY BOUGHT 13TH OCT	2
563	MINE MUST BUM UNIT	2
7740	WIRELESSLY CONNECT PRINTER CALLED	2
1156	NETGENIE SOFTWARE KEEPING COMPUTER	2
1154	MAY GOTTEN ROUTER FACTORY	2
7748	GO BUY POWER CORD	2
7750	ORDERED VERSION RECEIVED VERSION	2
1147	WIFI MEDIA TERRIBLE POOR	2
1146	MAKE SURE IT'S V2	2
1145	LEMON BUY SOMETHING ELSE	2
8166	APPLE USEFUL ACCESS PARENTAL	2
559	MODE WOULD CRASH EVERY	2
7755	NUMBER PROBLEMS YES CUSTOMER	2
1139	CONNECTION CONSTANTLY POWER CYCLE	2
1138	OKAY TIME RELIABILITY EXPECTED	2
1085	CONFIGURATION OPTIONS FINALLY WORK	2
1081	DESIGNED CONTAINER SOFTWARE MUCH	2
684	PRINTER SOFTWARE INSTALLED MAKE	2
1019	WORKS GREAT DAYS DEVICES	2
7821	PREVIOUSLY BELKIN ROUTER INCONSISTENT	2
645	PRODUCT TERRIBLE TECH SUPPORT	2
8103	SLOWLY FAILING REQUIRING REBOOTS	2
1038	OLDER MODEL NETGEAR LASTED	2
648	RANGE IMPOSSIBLY COMPLICATED SETUP	2
7828	GARBAGE CONNECTED ROUTER ALWAYS	2
8100	OTHERWISE EXPERIENCE MARRED SOFTWARE	2
1033	COMPUTER MODE EVERY TIME	2
7830	BECAME NEARLY UNUSABLE MONTHS	2
655	DISAPOINTED NETGEAR TECH SUPPORT	2
7836	BUYING BUY ANOTHER NETGEAR	2
660	WOULD PASS UNLESS LIKE	2
8093	RANDOM LAG SPIKES RESTART	2
8092	SUPPORT MUBAI IMPOSSIBLE UNDERSTAND	2
642	INCREASE WIFI RANGE WIFI	2
664	GREAT IT'S EASY SET	2
8090	TRYING REPLACE NETGEAR N300	2
7845	POOR ROUTING PERFORMANCE ERRATIC	2
668	WORK MONTHS TROUBLE BEGAN	2
7848	SUPPORT POOR RETURN POLICY	2
669	TECH SUPPORT TRIED RIP	2
7850	PRIOR PURCHASING LOOKED GREAT	2
1009	SPEEDS DON'T LAST LONGER	2
7851	LIKE IT'S COMPATIBLE AT&T	2
8087	WASTED MONEY BUYING DIFFERENT	2
675	HORRIBLE TECHNICAL SUPPORT GAMES	2
681	UNIT NETGEAR PROVIDES SUPORT	2
683	SIGNAL US DISTANCE STATED	2
643	FINE TRIED CHANGING CABLES	2
639	CONSTANT RESETTING DUE WIFI	2
1080	IT'S LIKE CHEESY RANSOMWARE	2
1062	HORRIBLE DEVICE CONSTANT REBOOTS	2
1076	PICKY IPHONES MOBILE DEVICES	2
604	MAYBE DEFECTIVE COMPARISON ASUS	2
1075	BAND WIFI EXTENDER MINOR	2
608	OWNERS EXPECT ZERO SUPPORT	2
1074	CUSTOMER SERVICE SUCKS PRODUCT	2
8127	FREQUENTLY DROPS CONNECTION BRIDGE	2
615	5GHZ BAND WORKAROUND TERRIBLE	2
617	WORK FRUSTRATING TECH SUPPORT	2
8121	READYSHARE WEAK USB HARD	2
7799	BOUGHT HELP STEAM MOVIES	2
619	OLDER STOCK UNITS VERSION	2
8120	SERVICE DECENT PRODUCT BEWARE	2
8117	DESPITE PRIOR MODELS COMPATIBLE	2
625	DIDN'T MONTHS BUILT LAST	2
1045	RESULTS WIFI DON'T BUY	2
8114	5G BAND DOESN'T WORK...SSID	2
628	EASY SET SIGNAL STRENGTH	2
8112	AC1900 WIRELESS WI-FI GIGABIT	2
631	SOFTWARE HORRIBLE SERIOUSLY HORRIBLE	2
7809	PLUGGING ETHERNET CABLES EVERY	2
7810	WEEKS LATER ROUTER APPEARS	2
1056	BUYT CISCO ROUTER PROVIDED	2
635	EXTENDER WIFI WOULDN'T USE	2
7815	ISSUE WIRED GIGABYTE CONNECTION	2
1050	LOTS DROPPED CONNECTIONS ETC	2
637	TERRIBLE INDEFINITE REBOOT CYCLING	2
7817	STRAIGHTFORWARD CONNECT ROUTER UNFORTUNATELY	2
8107	PRODUCT POOR UPDATES EVEN	2
223	LESS EXPENSIVE ROUTERS I'VE	2
400	EASY ENOUGH I'VE REBOOT	2
8406	SET EASY ENOUGH I'VE	2
119	CONSTANT REBOOTS DEVICES CONNECT	2
120	LAST PERFORMED WELL YEARS	2
1709	BEWARE READ NEGATIVE REVIEWS	2
7366	LOSES CONNECTION CABLE MODEM	2
7368	SUPPORT NIGHTMARE COMPLEX FORMALITIES	2
8467	PRODUCT 1-HOUR WORKED...POSSIBLY DEFECTIVE	2
124	AUGUST 2015 DIED APR	2
8464	GREAT ROUTER COMPLETELY DIED	2
1702	TRIED OFFICE CONNECTION ROOM	2
1700	SLOW FRUSTRATING CUSTOMER SUPPORT	2
132	IT'S GREAT NEED WIRELESS	2
133	ROUTER HIGH END PRODUCT	2
1694	DISTANCE STATED OPEN AREA	2
1692	HOPING IMPROVE SMARTPHONE RANGE	2
7379	SPEED EVEN LAPTOP NEXT	2
1690	DROPS RECONNECTS WIRELESS CONNECTION	2
1688	N750 ROUTER GOES OFFLINE	2
8459	FAULT NETGEAR-FIOS NEWER GET	2
1679	KEEP RECEIPT GET EXTENDED	2
1678	TOLD NETGEAR THIRD-PARTY SELLER	2
141	TIME MACHINE LION LION	2
142	POS BOUGHT AUGUST 2015	2
1713	WOULD AWESOME STREAMING BRAND	2
1718	GOES ENERGY SAVING MODE	2
193	FAST WIFI RANGE DISAPPOINTING	2
109	FACEBOOK OPTION WOR PROPERLY	2
7338	BEST ROUTER TERMS PERFORMANCE	2
1749	UPON PROBLEMS IT'S GOING	2
7340	NETGEAR N300 WORKED FINE	2
8492	KNOW ITEM 110 VOLTS	2
1742	WIRED GIGABYTE CONNECTION SOMETIMES	2
7345	BLAND MENU POOR TECH	2
88	ADVERTISING BEWARE HIGH SPEED	2
7346	NETGEAR ROUTER DOESN'T HYPE	2
1736	DIDN'T WORK HOURS PHONE	2
7348	WANT ROUTER NON-WIFI QOS	2
1734	FAST SERVICE WORK DESCRIBED	2
1733	CAUSES PROBLEMS COMPUTER COMPONENTS	2
96	PARAMETERS LIKE SSID ADVANCED	2
8484	WORKED PRETTY 20 FEET	2
7351	CALLED EXTENDER REVIEWS INDICTED	2
1727	WIFI EXTENDER MINOR FLAWS	2
104	ADEQUATELY REAL CUSTOMER SUPPORT	2
1726	MISLEADING ADVERTISEMENT PERFORMANCE GET	2
7354	WORKING SUDDENLY LESS 6-MONTH	2
1724	NETGEAR BIT PAST BOUGHT	2
7356	REASONS I'D BUY SOMETHING	2
8455	SHOPPING ROUTER KEEP LOOKING	2
1667	LOOKS NICE PERFORMS POORLY	2
8453	WORKED GREAT FIRST MONTH	2
7397	WORKED GREAT DIDN'T WORK	2
1631	NETGEAR SUPPORT NON EXISTENT	2
8431	FINALLY WORKED ASUS RT-N66U	2
178	OK MINIMALLY TESTED SOFTWARE	2
181	FEATURES FULLY SUPPORTED NETGEAR	2
8428	WELL HOWEVER GOT PRINTER	2
1628	TERRIBLY COMPARED WIRED CONNECTION	2
1627	MONEY TECH SUPPORT WANT	2
1625	ROUTER DROPS STILL INTERMITTENTLY	2
8426	COMPLEX FORMALITIES PUBLIC SUPER	2
1623	ALMOST EVERYWHERE HOUSE IT'S	2
1620	CHAT SESSIONS NETGEAR SUPPORT	2
1618	CONNECTIONS WAIT SOMETHING BETTER	2
187	NETGEAR FALSELY ADVERTISED THIER	2
7424	BETTER THOUGHT WOULD BEWARE	2
1616	DON'T EVEN GETTING SUPPORT	2
188	WORST WORST WORST TIME	2
1615	WORKED GREAT WEEKS STARTED	2
8423	WIFI PART R6700 WORKS	2
1613	BUGGY FIRMWARE WORTHLESS SUPPORT	2
7426	IMPRESSED SEVERAL REASONS I'D	2
7427	WORKED GREAT EVER SINCE	2
8432	OK NEED ROUTER UPGRADE	2
1633	SETUP CAN'T LOG CHANGE	2
8437	TERRIBLE PRODUCT HORRIBLE CUSTOMER	2
7407	GREAT EVER SINCE WORKS	2
8448	WORTH MONEY PUT ROUTER	2
7401	SUCKS CONSTANTLY DROPPING CONNECTION	2
1659	MULTIPLE PROBLEMS NORMAL FEATURES	2
155	POINT AVERAGE PARENTAL CONTROLS	2
1656	NETGEAR ROUTER LOUSIEST TECHNICAL	2
1654	SUSPECT FREQUENCY USED DEVICES	2
8443	RELIABILITY FAILED WITHIN PUT	2
158	HAVEN'T TRIED RANGE ROUTER	2
159	FIRST TIME DISAPPOINTMENT NETGEAR	2
160	OK....WI FI DEVICES HOUSE	2
1636	LIKE CHEAP CONSUMER WI-FI...BUT	2
7409	NETGEAR 2006 ROUTER WORK	2
1647	ROUTER PRIOR PURCHASING LOOKED	2
1645	GET THING CONNECTED CUSTOMER	2
8440	RANGE POOR RELIABILITY TERRIBLE	2
8439	LIKE DOWNLOAD SOMETHING MEGA	2
7412	FREQUENCY INBOUND UNIT BROADCAST	2
167	WEAK OVERTIME TRY GO	2
7414	N900 DUAL BAND GIGABIT	2
168	WNDR4500 INSTEAD WNDR4500V2 LISTED	2
1752	LINKSYS WORKS MUCH BETTER	2
1754	REGARD QUALITY WIFI SELLER	2
8496	ERROR MESSAGE WINDOWS POINTED	2
1816	HOUSE STILL TROUBLE GETTING	2
7278	LIKE ROUTER LOOKS RANGE	2
20	V1.0.2.46_1.0.97 STILL IMMATURE LOTS	2
8539	MONTH KEEPS LOSING SIGNAL	2
1850	PERIODIC INTERNET LOSS BUY	2
1849	TIME DISAPPOINTMENT NETGEAR DEVICE	2
1847	BASIC WEB BROWSING PERFORMS	2
7286	WIRELESS LAPTOPS TERRIBLY PICKY	2
1843	WORST ROUTER EVER I'VE	2
1842	DNS SETTINGS DHCP CLIENTS	2
26	DECENT OPTIONS WIFI MEDIA	2
1840	LASTED MONTH NEEDED REPLACED	2
1836	FAST EASY USE ROUTER	2
8532	BEWARE TOLD NETGEAR THIRD-PARTY	2
33	GLITCHY MOSTLY WORKS WELL	2
7293	EXPENSIVE ROUTERS I'VE USED	2
36	HORRIBLE NEVER BUY ANOTHER	2
8525	MAC OWNERS EXPECT ZERO	2
1825	PRINTER ISSUES...WHY FORCED USE	2
7299	FAILURE WARRANTY AVOID NETGEAR	2
8523	DEAL BREAKER ANNOYING ENOUGH	2
7301	INCONSISTENT WIFI MUCH HASSLE	2
8541	12-YEAR ROUTER RETROSPECT WORKED	2
7277	WORK ACROSS CIRCUIT BREAKERS	2
7274	COVERAGE QUITE EQUAL 10YR	2
8543	SUPPORT SORELY DISAPPOINTED WAITING	2
7252	WIFI WORKED APPROXIMATELY MONTHS	2
1884	GREAT PRODUCT BUYER BEWARE	2
7255	REALLY DISAPPOINTED OLDER MODEL	2
1882	PUT MODE WOULD CRASH	2
11	CHEAP CONSUMER WI-FI...BUT REALLY	2
8547	DOWNSTAIRS AREA WORSE PREVIOUSLY	2
7261	MUCH BETTER PIECE JUNK	2
1875	EITHER WORSE DEFAULT SIGNAL	2
7262	BUY ROUTER MIGHT WOULD	2
7265	RANGE PRODUCT WOULD SUGGEST	2
7272	CONSTANTLY INTERRUPTS INTERNET CONNECTION	2
7266	EVERY TIME TRIED PUT	2
1869	WORK FLAGSHIP NETGEAR X4	2
7268	ACCESS POINT MODE WIRED	2
7269	COULD GET WORK MAC	2
1865	WORK ROUTER CABLE COMPANY	2
7270	STREAMING BRAND TV WOULD	2
17	WORKS SOMETIMES REQUIRED RESET	2
1863	ROUTER INCONSISTENT INTERNET CONNECTIVITY	2
7271	COMPONENTS HORRIBLE CUSTOMER SERVICE	2
7303	TRY SYNOLOGY EERO INSTEAD	2
1814	REALLY WANT LIKE ROUTER	2
1755	A)DARN PERFECT PRE-RATIFIED 802.11	2
7307	DON'T BUY NETGEAR PRODUCT	2
1778	GREAT WEEKS COMPLETELY DEAD	2
62	NONEXISTENT TECHNICAL SUPPORT LOOK	2
1777	REBOOTS REASON ALMOST CONTINUOUS	2
8508	DON'T BUY YOU'LL REGRET	2
1775	REFURB UNITS THEY'RE SHIPPING	2
1770	SET CONTENT FILTERING SCHEDU	2
1769	SUMMARY PRICE EXPECTED PERFORMANCE	2
8503	WIRELESS SECTION WORKED WIRED	2
1767	POWER CYCLE DAILY STAY	2
1766	2.4 GHZ CONNECTION FAILS	2
70	BEWARE PRODUCT GREAT LASTS	2
1765	CHANGE AUTO PROGRAMMED NET	2
8500	WOULD TAKE CARE BUFFERING	2
1760	WOULD BETTER RANGE AROUND	2
1759	NETGEAR SYNONYM BUY SOMETHING	2
75	CONNECTION EVEN THO SAYS	2
77	IT'S PROBABLY NETGEAR'S FAULT	2
78	MANUFACTURERS SACRIFICING USE POWER	2
1757	WIRELESS RADIO DROPPING OFFLINE	2
79	NETGEAR BEST MARKET USED	2
80	HARDWARE FAILURE LACK SUPPORT	2
60	ENJOY PLUGGING ETHERNET CABLES	2
59	ADVANCED FEATURES FULLY SUPPORTED	2
1780	BEWARE NETGEAR'S CUSTOMER SERVICE	2
1795	INTERNET CONNECTION DEVICES HOME	2
8519	PRODUCT HORRIBLE CUSTOMER SUPPORT	2
1806	EVEN HARDWIRED CONNECTIONS SEEM	2
1805	SELL SUPPORT 149 DON'T	2
46	FUNCTION WIFI SIGNAL BOOSTER/EXTENDER	2
47	COMPATIBLE DD-WRT TOMATO SHIBBY	2
8518	NEWLY PURCHASED JURY STILL	2
7316	TIME SUPPORT FINE CREDIT	2
1799	10 FEET SIGNAL DROPS	2
1798	OPTION WOR PROPERLY DISAPPOINTED	2
1794	SOLID DEVICE UPDATE FIRMWARE	2
1782	WIFI RELIABILITY NONEXISTENT TECHNICAL	2
50	ROUTER LIVING ROOM BEDROOM	2
52	FIRST CONTINUALLY REBOOT ROUTER	2
1790	HARDWIRED CONNECTIONS SEEM DROP	2
1789	WANT CHARGE MONEY ABLE	2
7320	SLOW 2.4 GHZ PERFORMANCE	2
8513	ROUTER COUPLE TIMES SINCE	2
8511	WORKING FINE GO BUY	2
7323	DESCRIPTION LITTLE DECEIVING SAID	2
1783	PAID 99.97 WORTH PENNY	2
7428	POOR RANGE CONNECTIVITY THROUGHPUT	2
831	FAILS TRANSFERRING LARGE DATASETS	2
7435	WIRELESS RANGE GREATEST 900	2
198	YOU'RE LOOKING MOVE ALONG	2
1583	5-6 DAYS COMPLETELY FAILED	2
1572	LIKE ROUTER FIREWALL SLOWLY	2
205	WORKAROUND TERRIBLE INDEFINITE REBOOT	2
216	ROUTER RELATIVELY SLOW STOPPED	2
7449	BRIDGE CAN'T EXTEND WIFI	2
1580	MOODY INTERMITTENTLY WI-FI DROPS	2
1605	NIGHTHAWK AC 1900 FAILED	2
1589	WORTH SOMEONE TIME WORK	2
217	POOR PRODUCT POOR SUPPORT	2
195	NETGEAR THIRD-PARTY SELLER AUTHORIZED	2
7433	PERFORMANCE DETERIORATION SEVERAL MONTHS	2
199	PERFECT SIGNAL YET DOESN'T	2
196	GREAT FIRST PROBLEMS MONTHS	2
200	DIED DAYS RETURN PERIOD	2
1567	DON'T BOTHER SUPPORT MUBAI	2
1579	HOPE DON'T NEED SUPPORT	2
7444	FEATURES SPEED DON'T HELP	2
202	NEVER ABLE GET INTERNET	2
1569	HELPED HOUSE BOUGHT ANOTHER	2
7448	FAILED ROUTER NETGEAR PLEASE	2
7442	WORK CAFEFUL YOU'RE PURCHASING	2
1594	FIRMWHERE UPDATE FIXES LOTS	2
8409	LAST NETGEAR FEATURES SPEED	2
211	BOUGHT ITEM LOCAL BEST	2
7441	WOW USED ACCESS POINT	2
206	WORKING WEP WORKED DOWNLOADING	2
5816	BROKE 4TH MONTH WAST	1
5826	LIKE POOR CS DOOMED	1
5827	COMPLETE WASTE TIME DROPS	1
8098	RANGE ESPECIALLY REVIEWS LET	1
5145	CUSTOMER TELEPHONE SUPPORT DIFFICULT	1
8510	GREAT DEVICE RELEASED 1.12.0.18	1
5828	TURNED SLOW EXISTING CONNECTION	1
5137	IT'S SLOW SMART DVD	1
5830	PERSONNEL OVERSEAS USELESS EVEN	1
5831	TECH SUPPORT WANTED 169.95	1
8097	SURE OK BUYING REFURBISHED	1
5824	NETGEAR TECH SUPPORT WANTED	1
8096	MBPS DESPITE FACT CABLE	1
8095	EXPENSIVE AVERAGE SPEEDS UNFRIENDLY	1
5832	CAUSING ERRATIC INCONSISTENT SPEEDS	1
5833	PROMISE OPENVPN ISSUES TERRIBLE	1
5811	AVOID NETGEAR ROUTERS COSTS	1
5834	SETTING NETGEAR WON'T HELP	1
5835	DELIVERED NY DAYS ORDERING	1
5836	HOME ROUTER ISN'T PIECE	1
8505	COULD GET WORK WIN8.1	1
5837	LONGER SUPPORTED DD-WRT 4/18/17	1
5838	FREQUENT RESETS BLOCKS CERTAIN	1
8099	DON'T BUY UNLESS FETISH	1
5138	PERFORMANCE MISBEHAVED PARENTAL CONTROLS	1
5812	REBOOT WORK FINE SINCE	1
8105	LESS CUSTOMIZABLE ASUS ROUTERS	1
5368	OK BETTER X4 5GHZ	1
8104	BROADBAND PROVIDERS LESS USEFUL	1
5817	MAY WORK GIVEN TIME	1
5818	UNUSABLE SUPPORT RESET DEVICE	1
5317	SERVICE STAY AWAY WIN10	1
5141	EVEN BROADCAST HALF WIRED	1
5369	GREAT HARDWARE START NETGEAR	1
8106	COMPARABLE OPTIONS AVAILABLE AC	1
5316	FAILURE AFTEE 15 MONTHS	1
5140	COUPLE HOURS TRYING SET	1
5819	SIGNAL STILL ISSUES WALLS	1
5820	ROUTER CONSTANTLY SUBPAR WIFI	1
5821	AWAY SLOW LIKE TURTLE	1
5822	UNIT DIED NETGEAR WOULD	1
5370	GENIE CRAMPED CONFUSING USER	1
5823	TELEPHONE SERVICE HORRIBLE PEOPLE	1
8377	WORKS I'M TECH IDIOT	1
5367	AWESOME LATER GET SLOW	1
5814	NETGEAR SUPPOSED MAYBE DONT	1
8507	PRODUCT SUCKS TECH SUPPORT	1
5813	INCOMPLETE FIRMWARE RECOMMEND ADVANCED	1
5139	PAST WARRANTY AVOID PURCHASING	1
8506	PRODUCT SUPPOSED EASY INSTALL	1
5839	POSSIBLE FIX PRESENTED FAILS	1
5439	STOPPED WORKING 18 MONTHS	1
5840	PRICE CERTAINLY ISN'T CAPABLE	1
5864	SAW COUPLE THOUGHT MAYBE	1
8079	90 DAYS LOOKS LIKE	1
5856	USED CHIPPED UNIT NETGEAR	1
5363	GET ASUS ROUTER MICRO	1
8078	LOVE SAMSUNG SMART TV	1
5857	CUSTOMER SERVICE TECH SUPPORT	1
5858	IT'S GARBAGE SLOW WIRED	1
5859	VS R8000 ETC REAL-WORLD	1
5860	RANGE EXTENDERS RARELY WORK	1
8412	HARD WORK WORTH PRICE	1
8517	SUB-PAR FIRMWARE POWER SUPPLIES	1
8077	SELL EXPENSIVE SECURITY SOFTWARE	1
5862	REAL DISAPPOINTMENT CHOOSE DIFFERENT	1
5863	SUPPORT WIRELESS SPEED 20-25	1
8411	ENOUGH HOWEVER WIFI CONNECTION	1
5362	CONSTANTLY LOSE WIFI CONNECTION	1
8082	MONTHS INTERMITTENT PROBLEMS WHOLE	1
8076	SPEND EXTRA MONEY BUY	1
5866	PRODUCT FAILED MONTHS TECH	1
5867	ROUTER EXTENDER SAD NEVERRRRRRRRRR	1
5868	SEEMS WORKING WELL ENOUGH	1
5361	FAN NOISE NEVER BUY	1
5869	TL-WDR3500 WORKED MUCH BETTER	1
8075	SLOW 2.4 GHZ WI-FI	1
8074	SPEEDS PACKET FRAGMENTATION RETRANSMITS	1
8073	WORKING WIFI OK ETHERNET	1
8072	TECH SUPPORT SETS LOW	1
5871	NEXT STEP GARBAGE SAVE	1
5872	WORKS GREAT PROBLEMS APT	1
5873	SOMETIMES EVERY 20 MINUTES	1
8381	RECOGNIZES PRONTERS WONT BUY	1
8081	YOU'LL NEED HELP SETTING	1
8083	FORM FACTOR OVERALL PRODUCT	1
5366	STATIC NOISE COMING ROUTER	1
5850	NETGEAR DM 200 COMPATIBLE	1
5841	TERRIBLE ROUTER FREEZES DOESN'T	1
5842	TIME--DON'T SPEND MONEY YET	1
5843	CONNECTION KEEPS DROPPING COULD	1
5810	AMAZON RETURN POLICY BEST	1
5844	TERRIBLE WIRELESS DROP CONSTANTLY	1
5134	LINK AC1200 25 DOLLARS	1
5845	SPEED NOTICEABLY BETTER PREVIOUS	1
5846	MESS CONNECT 2.4GHZ PRODUCTS	1
5847	DIRECTS CUSTOMERS ISSUES SCAM	1
5133	BROKEN INSECURE ENABLE ROUTER	1
5849	SAVVY PEOPLE TERRIBLE ACCESS	1
5132	HORRIBLE STRONG SIGNAL WORST	1
8091	PRICE IT'S EXPENSIVE TON	1
5365	ROUTER ALONE OFTEN BETTER	1
5130	ROUTER WAITING NETGEAR SUPPORT	1
8516	5G USELESS RETURNING REFUND	1
8089	MAY GREAT HIGH GROUND	1
5364	TWICE CUSTOMER SUPPORT SEVERELY	1
5318	STRONGER SIGNAL SIMPLER UI	1
8379	SUPPORT PERSONNEL OVERSEAS USELESS	1
5851	LINE FEATURES EXPECT HEADACHES	1
5129	USELESS ROUTER USELESS FEATURES	1
5852	USED TP LINK POWERLINE	1
8514	WOULD UPGRADE REALLY DISAPOINTED	1
8515	FIBER OPTICS WITHOUT MODEM	1
8088	INSTEAD ACTUALLY ISNTALL WORK	1
5853	ALMOST EXACTLY AGO IT'S	1
8380	HATE POST NEGATIVE REVIEW	1
8084	WIFI CONNECTED DEVICES 300MBPS	1
5855	COMES LIFETIME WARRANTY PAY	1
8512	INSTRUCTIONS RESOLVING ISSUE DROPPING	1
8376	OKAY HOPEFULLY GET FASTER	1
5809	FREE TECH SUPPORT PERIOD	1
5377	WHOLE 18 WHEELER DRIVE	1
5760	KNOW SLOW EXPERIENCE BETTER	1
5761	FIND CHANGE WIFI SIGNAL	1
8415	AUDIO DOESN'T WORK UNABLE	1
8145	HIGH-SPEED INTERNET CIRCA 1994	1
5165	ADDRESS FILTER WIRED WELL	1
5382	ROUTER PRODUCT EVEN WORSE	1
8414	WORKS WELL 150MBPS DEVICE	1
5380	USB CONNECTIVITY FILE SHARING	1
8144	BETTER SIGNAL CENTURYLINK MODEM	1
5379	SECURITY EXPERTS DEC 12	1
5763	FIRST RESPONSE PROVIDED USELESS	1
8373	LOUSY WORKS DROPS CONNECTIONS	1
5378	250-300MBPS HARDWIRED AROUND 20MBPS	1
5765	ADDITION PURCHASING IMMEDIATE UPDATE	1
5766	WORKING WIRED ACCESS POINT	1
8146	BETTER OPTIONS ESPECIALLY UPGRADING	1
8142	MAY GET DEFECTIVE ROUTER	1
8141	UPGRADED FLIP PHONE SMART	1
5376	PRICE PAY PRDUCT INSTALLMENT	1
5163	REALLY LARGE USELESS PAPERWEIGHT	1
5767	NOTICEABLY BETTER PREVIOUS ROUTER	1
5310	DEAD ROUTER IN-LAWS DHCP	1
5162	RANGE HOT DROPPED CONNECTIONS	1
8140	POINT ANYONE ACTIVELY MANAGES	1
5311	UNLESS REALLY LIKE NETGEAR	1
5769	STOPS CONNECTING INTERNET REQUIRES	1
8138	SUPPOSED BEST DON'T IT'S	1
5771	WORK US EVEN THOUGH	1
5772	SETUP CONNECTING FAST EASY	1
5312	FORGET LOOK LEAST AC1200	1
5759	GREAT 60 DAYS DIED	1
5166	BOOST SIGNAL MUCH THOUGHT	1
8137	WORKS WELL 3-STORY TOWNHOUSE	1
5169	UNLESS ENJOY RANDOM DISCONNECTS	1
5384	LIKE NETGEAR SPEND MONEY	1
5742	WENT LOCAL STORE BOUGHT	1
5743	HALF DROPPING SIGNALS LOST	1
5744	CONNECTION SPEED IMPROVEMENT WASTE	1
5745	READY<ANYTHING FEATURE SKIP ROUTER	1
5173	READYSHARE LIMITED DRIVE SUPPORT	1
8158	PRINTER SOUNDS LIKE WINNER	1
8493	DECENT WHOLE HOME SOLUTION	1
8157	WOULD CONNECT SMART TV	1
8494	DROPPED CONNECTIONS BLAZING SPEEDS	1
5747	ROUTER STOPPED WORKING DAYS	1
5748	LOSE INTERNET CONNECTION OFTEN	1
5171	CONNECTION GIVES 50MB SPEED	1
5170	SERVICE CONTRACTS WITHIN 90	1
5749	WORKS FAST UNRELIABLE CONNECTIVITY	1
5757	CAME ALREADY SET SOMEONE	1
5309	ELSE AFFORD BUY SOMETHING	1
5750	LIKE NETGEAR PRODUCTS REALLY	1
5751	REALLY SLOW THOUGHT WHOLE	1
8155	ROUTER IPV6 SUPPORT MANAGEMENT	1
8154	RELATIONSHIP ENDED US SAYING	1
8153	CHANGE DEFAULT ROUTER SETUP	1
8495	SUPPORT RECOMMENDED 3RD PARTY	1
5752	HARD GET THING GOING--FINALLY	1
5383	PURCHASE COUNTRY HOME KEPT	1
8152	POSSIBLY WORST ROUTER PURCHASE	1
5754	PAIN BECASE NET GENI	1
8151	TOP PERFORMING SINCE GOTTEN	1
8150	CUSTOMER SERVICE USELESS TELLING	1
5167	LOT TECHNOLOGY YOU'RE HAPPY	1
5773	ISN'T EVEN TODAY PROOF	1
5161	ROUTER GREAT SINCE FLASH	1
8108	10 DON'T BOTHER CONSTANT	1
5315	BAND ROUTER SUPPORT TIME	1
5154	FOREVER GET TECH SERVICE	1
5796	PRINTERS FIND WIFI SSID	1
5373	WAY WN2500RP READY PRIME	1
8119	LOVED OLDER NETGEAR MODEL	1
5798	STAY AWAY DON'T BUY	1
5799	GREAT REVIEWS EXPERIENCE WE'VE	1
5800	PREPARED EMPTY WALLET REPAIRS	1
8118	PRODUCT FAULTY TELEPHONE SERVICE	1
5153	BUYER BEWARE PREVIOUSLY OWNED	1
8116	EVEN WANT HELP DEVICES	1
8504	GAVE 25MBPS EVER TRY	1
8375	RECOMMEND UNIT STOPPED WORKING	1
5801	5-8 HOURS SOMETIMES EVERY	1
8115	STAY AWAY LOOKING PARENTAL	1
5152	RANGE ROUTER WANTED REPLACE	1
8502	PERFORM ADVERTISED SIGNAL STRENGTH	1
8113	GREAT SPECS LOOKS MONSTROUSLY	1
5151	FORUMS DISCONNECT ISSUE PURCHASE	1
5150	TIER SUPPLIER FACTORY MISSING	1
5149	RESULT KEPT LOSING CONNECTIVITY	1
8111	BRAND PRICE EASY SETUP	1
8110	EVER SINCE PURCHASED INTERNET	1
5805	WINDOWS 10 MOVE NOTCH	1
5148	FIRST PURCHASED AC 1750	1
8109	PARENTAL CONTROLS MISSING BASIC	1
5126	PAY TECH SUPPORT 90	1
5806	FINE DECIDED STOP WORKING	1
5807	BRIEFLY TIMES EVERY MINUTES	1
5147	KINDA SUCKS EXPENSIVE HIGHLY	1
5808	CONNECTED THINGS DROP SIGNAL	1
5374	THING AWFUL TOOK HOUR	1
5795	BEYOND BELIEF CUSTOMER SERVICE	1
8498	HARDWARE ROUTER GREAT SINCE	1
8131	HIGHLY SUGGEST STAYING AWAY	1
5774	CONNECTIONS HARD GET WORKING	1
5775	DIFFERENT MODELS NETGEAR N300	1
5776	BAND SO-SO 5GHZ BAND	1
5777	DEVICE NEEDS REBOOTED DAILY	1
8499	DISCONNECTS WINDOWS 10 64	1
8136	EVEN SPEED SHOWING 433	1
5778	SHOWN N300 SPECS MISLEADING	1
8135	POOR SEVERAL CALLS NETGEAR	1
5780	UNDERPERFORMED BUGGY ROUTER CONSTANTLY	1
8133	CONNECTIONS TECH SUPPORT EVEN	1
8132	BOTHER YOU'RE CENTURY LINK	1
5783	ON/OFF SWITCH LOCKS OFTEN	1
5158	HORRIBLE PRODUCT TECH SUPPORT	1
5375	DROPPING WIFI CONNECTION TROUBLE	1
8501	3.0 DON'T BELIEVE COLORATION	1
5794	GOOGLE NEXUS GALAXY S8	1
8130	PRODUCT POOR CUSTOMER SUPPORT	1
5156	SWITCH LOCKS OFTEN COULD	1
8128	IT'S GREAT WORKING DESIGNED	1
5155	USE CAUSE AGGRAVATIONNOT CASE	1
8413	BEWARE--INEXPENSIVE ROUTER ALSO UNRELIABLE	1
5786	ISSUES CONNECTION WIN7 PLATFORM	1
5787	WINDOWS 10 DRIVER HELP	1
8126	CALLED NETGEAR GOT HELP	1
8124	IT'S NICE HARDWARE REVISION	1
8123	INSTALLATION INSTRUCTIONS POOR TECHNICAL	1
5314	OK SUPPORT LONGEVITY ISSUES	1
5791	LIKE WIFI MAY 300	1
5792	EXPECTED MUCH BETTER RANGE	1
5793	AMAZING HARDWARE MEDIOCRE FIRMWARE	1
5319	GENIE PARENTAL CONTROL WORK	1
8069	BETTER 10 MBPS DESPITE	1
5125	PROPERLY CONNECTION INTERMITTENT ROUTER	1
5974	SAVE 150 BUY EXTENDER	1
5967	CONSTANTLY LOSES CONNECTION EVERY	1
5093	ROUTER DON'T BUY GO	1
5092	WORKS WELL STREAMING VIDEOS	1
5091	ROUTER CRAPPY RETURN POLICY	1
5968	TECH SUPPORT READ PURCHASE	1
5969	WORKS GREAT MONTH....BUYER BEWARE	1
5090	ORDERED USED LIKE ITEM	1
5089	CANNOT KEEP OTHERWISE DECENT	1
5088	WORSE NETGEAR ROUTER ADMIN	1
8013	DROPS CONNECTION BRIEF PERIODS	1
5971	DONT GO SUPER CHEAP	1
8390	CHANGES BEYOND BASIC NOVICE	1
5972	IGMP PROXYING IGMP SNOOPING	1
5345	LIKE MIGHT EXPECT YARD	1
5975	TECH SUPPORT USELESS PRODUCT	1
5983	ORDERED DIDN'T BROADCAST KIND	1
5344	ITEM PERFORM WELL WIFI	1
8011	IP ADDRESSES SMART PHONES	1
8010	CLOCK STILL DOESN'T WORK	1
5978	ABSOLUTELY TERRIBLE DISCONNECTED CONTINUOUSLY	1
8391	1900 POOR QUALITY CONTROL	1
5086	NOVEMBER 1ST 2013 WORKED	1
5342	GET WORK WIN8.1 MACHINES	1
5085	TERRIBLE BLOATED UTILITY INSTALL	1
8009	GARBAGE ETHERNET WORKED FINE	1
5980	ORBI WORKS WELL APPEARS	1
8008	ABLE GET 802 11AC	1
8393	WEEK AGO SUDDENLY NETGEAR	1
5340	USELESS TELLING ALREADY REGISTERED	1
5982	DON'T BUY NETGEAR PRODUCTS	1
5966	SAD WRITE REVIEWS SPECIALLY	1
8540	HORRIBLE WONT EVEN REACH	1
5965	FRUSTRATING WON'T CONNECT AIRPORT	1
5964	DON'T BUY YET NEED	1
8535	PRICE NOISE LEVEL HIGH	1
5949	PRODUCT REQUIRES DAILY HARD-CYCLES	1
5323	DOLLARS ROUTER PRETTY DEAL	1
5324	UNLESS WANT WASTE LOT	1
8024	WORKS GREAT SETUP MIGHT	1
5325	2016 UNPLUG ROUTER IMMEDIATELY	1
8022	ROLLING DICE ONES WORK	1
5952	GREAT ROUTER EXPERIENCE...AND SURE	1
5953	NETGEAR TECH SUPPORT UNBELIEVABLY	1
5954	UNRELIABLE ROUTER/ACCESS-POINT EVER OWNED	1
5955	FIND ANOTHER MANUFACTURER NETGEAR	1
5956	GREAT POTENTIAL DOGGED POOR	1
8536	WATCHING HIGH DEFINITION MOVIE	1
5957	ANYTHING BOX MUST CALL	1
8020	USELESS INSTRUCTIONS RESOLVING ISSUE	1
5096	BUY ACCESS CONTROL PARENTAL	1
8018	INFORMATION LEAD ACCIDENTAL PURCHASE	1
8537	PRODUCT MAYBE FIND OTHERS	1
8017	AMAZON NEED FALLING NEGATIVE	1
5095	NETGEAR N600 DUAL BAND	1
8538	DEFECTIVE ROUTER MAY ODDS	1
5959	SUCKED USED TP LINK	1
8016	CISCO MERAKIA 64W ROUTER	1
5349	STORE BOUGHT BETTER LESS	1
5961	TIRED REBOOTING ROUTER WAITING	1
5962	WORKS OK STILL NEED	1
5348	WORKED MONTHS SUDDENLY DISCONNECTS	1
8015	AC1900 GETS SIGNAL ADJACENT	1
5347	RECEIVED R6700V2 IT'S NICE	1
8542	TOOK 45 MINUTES GET	1
