	name	count
906	3.0 HARD DRIVE FUNCTIONALITY	1
904	BUMPING SOME DEVICES OUT	1
903	SPEEDS AND UNFRIENDLY USER	1
901	IN A 1920'S HOUSE	1
915	EVEN WANT TO HELP	1
900	TO OTHER MODELS HAVE	1
899	CAN GET MY MONEY	1
898	TO CALL NETGEAR TWICE	1
897	WAS VERY MUCH SCRATCHED	1
896	PLOWING THRU EVERY POSSIBLE	1
894	POWERED WI-FI IT WON'T	1
893	WALL TO FIND THAT	1
914	HAD HIGH EXPECTATIONS FOR	1
916	THE PRODUCT WAS FAULTY	1
840	BUT ONLY AT FIRST	1
928	BUT DEFINITELY NOT HAPPY	1
940	THE NETGEAR SUPPORT HAS	1
938	PRODUCT SUPPOSE TO BE	1
937	MORE DOESN'T EQUAL BETTER	1
935	MONEY HAD TO RETURN	1
933	WASTED SO MUCH TIME	1
931	IS VERY POOR WE	1
930	TIME YOU NEED TO	1
925	SO FAR I HAVE	1
917	UNFORTUNATE BECAUSE I JUST	1
924	THE SIGNAL AND IT	1
923	HELP OR REPLACEMENT FROM	1
922	THE MONEY WIFI CLIENTS	1
921	EVERYTIME I LOAD A	1
920	TOPS FOR THEIR PRODUCTS	1
919	IT WORSE YEAH IT	1
918	HAVE KEPT THE WNDR3700	1
890	CUSTOMER SUPPORT IS USELESS	1
889	DEFECTIVE UNIT IN MONTHS	1
888	A LITTLE BETTER THAN	1
850	WITHIN 90 DAYS GOOD	1
861	MANY WAN AND WIFI	1
859	100 BUCKS FOR A	1
857	WHAT GALLED ME MORE	1
856	DESIGNED PRODUCT UNSATISFACTORY SUPPORT	1
854	EXACTLY ONE YEAR AGO	1
853	WORST ROUTER KEEPS REBOOTING	1
851	WE'VE HAD SIMPLY DOESN'T	1
849	AS IT WILL BREAK	1
887	ROUTER BASED ON GREAT	1
848	WITH A PASSWORD PROTECTION	1
847	FIRST ONE I ORDERED	1
846	ROUTER BAD IPV6 SUPPORT	1
845	ENOUGH FOR ANY RECOMENDATION	1
844	DON'T BUY THIS ONE	1
843	A NEW ROUTER THE	1
842	HAVE A 1300 SQUARE	1
863	GETTING MORE AND MORE	1
864	TO YEAR OLD NETGEAR	1
865	NOTHING EVEN CLOSE TO	1
866	YOU HAVE A DESKTOP	1
886	SEVERAL YEARS WORKED VERY	1
885	ONE MORE CONNECTIVITY ISSUE	1
884	YOUR AMAZING BECAUSE THEY	1
883	TWO MINDS ON THIS	1
881	BUYING A NEW ONE	1
880	ROUTER BUT MY EXPERIENCE...AND	1
878	WINDOWS 10 DO NOT	1
877	THINK TWICE FOR YOU	1
876	WIFI RANGE EXTENDER TO	1
875	SUCKS ALWAYS LOOSING CONNECTION	1
874	AMAZON GAVE ME OPTIONS	1
872	NETGEAR READYSHARE FOR USB	1
870	INTERMITTENT CONNECTION BRICKED DURING	1
869	TO RESTRICT ACCESS TO	1
867	TO DO ANYTHING TO	1
719	NOT BUY DOES NOT	1
718	BAD FOR THE MONEY	1
717	IS MY SECOND ONE	1
560	MY ROUTER WAS BAD	1
573	FOR LESS THAN I	1
572	HOME PRODUCTS OR SERVICE	1
569	THAN MOST BUT THERE	1
568	IFFY ON THIS ROUTER	1
564	CONNECTION BRIEFLY TIMES OUT	1
563	ONE ISSUES WITH THIS	1
561	HORRIBLE PEOPLE CANNOT SPEAK	1
558	AWFUL DELIVERED IN NY	1
578	WAS HORRIBLE RETURNED IT	1
557	NOT AS PER EXPECTATIONS	1
554	THE ROUTER WORKED FINE	1
551	DOES NOT TURN OFF	1
550	TRIED SEVERAL LOCATIONS EVEN	1
548	OK FOR FIRST ROUTER	1
543	IT WORKS WELL BUT	1
541	USE THEM STOCK BUT	1
575	PAY FOR TECH SUPPORT	1
579	WORK RIGHT WITH CENTURY	1
600	IT SIGNAL STRENGTH RANGE	1
590	HOMES WITH THICK PLASTER	1
597	FLIP PHONE TO A	1
596	LOOK AT OTHER NETGEAR	1
595	DD-WRT UNTIL IT DOESN'T	1
594	FROM ROUTER TERRIBLE NETGEAR	1
593	HAVING ISSUES I HAD	1
592	WORKING WITH OUR SPECTRUM	1
591	SETUP WAS NO PROBLEM	1
589	DRIVES IN A LONG	1
580	HOUR AND CUSTOMER SERVICE	1
587	BECAUSE I WAS GETTING	1
586	AD THIS SMELLS LIKE	1
585	TO LET THE RETURN	1
584	IN THE FIRST SECOND	1
583	ROUTER IS A JOKE	1
582	GREAT PRODUCT BUT MISSING	1
581	WIFI AND I AM	1
540	BUT IT NEVER WOULD	1
538	X6 AC3200 TRI BAND	1
536	A GOOD ROUTER IS	1
497	SHOULD HAVE BOUGHT A	1
507	NETGEAR DUAL BAND RANGE	1
505	EXTEND VERY FAR MY	1
504	TO EXTEND A WIRELESS	1
502	THE ROUTER CONSTANTLY AND	1
500	THAT THERE WAS A	1
499	ON ANTENNA PATTERN AND	1
498	FASTER AND BETTER RANGE	1
495	PRODUCT AND EVEN WORSE	1
535	NOT SUPPORT THEIR REFURBISHED	1
494	STOPPED WORKING AFTER WEEK	1
492	MY NEBOR'S ROUTER BETTER	1
489	NETGEAR DUE TO THEIR	1
488	THEN IT'S GOING BACK	1
487	ROUTER IS GARBAGE IF	1
486	IT WORKS BUT ONLY	1
483	DROPS MY INTERNET SIGNAL	1
508	ARE BETTER OPTIONS ALSO	1
509	DID NOT LAST 30	1
510	SIGNAL ON THIS IS	1
511	ISN'T WHAT IS ADVERTISED	1
534	BOUGHT THIS BECAUSE YOU	1
533	TO SYSTEM PER INSTRUCTIONS	1
532	24TH 2015 THIS ROUTER	1
530	PRODUCT WORKS FINE ONCE	1
529	ONLY CONNECT TO PLEX	1
527	FOR ONE YEAR THIS	1
525	I GIVE UP ON	1
524	TO A LOCAL STORE	1
523	SOFTWARE/HARDWARE DID NOT PLAY	1
521	GOOD PART OF THIS	1
517	UP SO DIDN'T USE	1
515	ARE NEARLY USELESS AND	1
514	FOR TECH SUPPORT AFTER	1
513	IS OK BUT SUPPORT	1
512	A 2.4 GHZ WI-FI	1
599	WAS FINE MENTIONED THIS	1
601	IN THE RANGE OF	1
714	POOR PRODUCT=DO NOT BUY	1
677	AN IT TECHNICIAN TO	1
684	AS WIDE AS EXPECTED	1
683	DROPS ALL THE TIME	1
682	I WISH IT WERE	1
681	FOR OTHERS BUT I	1
680	THE BEST AVAILABLE AND	1
679	IS ABYSMAL PRODUCT IS	1
678	I HAD AT FIRST	1
676	COULD ASK FOR UNTIL	1
686	OLD NETGEAR N800 HAD	1
675	IF YOU CAN AFFORD	1
674	WORTH THE MONEY DOESN'T	1
671	HAS COST ME MONEY	1
670	SO PERFORMANCE AT A	1
669	PEOPLE TERRIBLE AS AN	1
668	SURE THE ROUTER I	1
667	WIRELESS-AC1900 DUAL-BAND GIGABIT ROUTER	1
685	GREAT PERFORMANCE FOR 1-2	1
687	HOMES I GUESS NOT	1
603	IT WILL DO THE	1
702	AND FAST AND RELIABLE	1
713	WORKS AS ADVERTISED EXCEPT	1
712	DEVICES STOPPED WORKING IN	1
711	THAT ISN'T EVEN TODAY	1
710	DOESN'T WORK RIGHT WITH	1
709	AND WORKED RIGHT OUT	1
706	ME IT WAS ALREADY	1
703	BETTER WIFI ROUTER INSTEAD	1
701	HORRIBLE EXPERIENCE ATTEMPTING TO	1
688	HYPE IT IS JUNK	1
700	BOX ON A 50MB/S	1
699	TO BEST BUY EVEN	1
697	WITH GOOD WIFI COVERAGE	1
695	SERVICE IS HORRIBLE PEOPLE	1
693	LIKE BUYING AUTISTIC COW	1
690	BECAUSE THE LINKSYS PERFORMANCE	1
689	OVER OR 10 MBPS	1
665	INTERNET IS WORKING FINE	1
664	AND I'M AN INFORMATION	1
662	THERE FOR THE CONNECTED	1
620	WEAK SIGNAL SPEND A	1
631	WINDOWS 10 NO UPDATED	1
630	I HAD TO CONSTANTLY	1
629	I TRIED THE LINKSYS	1
628	TON OF TIME ON	1
626	FINE AND ALSO WIRED	1
624	FOR THE CONSUMER MARKET	1
623	DONT BUY THIS ITEM	1
618	AFTER BEING ON HOLD	1
661	HOWEVER THIS IS MY	1
615	THIS DEVICE OR ANY	1
614	IT FINE BUT CAN'T	1
613	IS BUGGIE AND IT	1
611	IN WHICH IT CAME	1
608	RESETS AND BLOCKS CERTAIN	1
605	ERROR IN JUDGMENT POOR	1
604	WHOLE HOME BUT WIFI	1
632	DNS SERVER NOT RESPONDING	1
633	TERRIBLE SPEED SLOWS DOWN	1
634	AN HOUR MAX THEN	1
635	WORKING FINE AGAIN NETGEAR	1
660	NICE GREAT COVERAGE CONSTANT	1
659	NO MANUAL REDUCED WARRANTY	1
656	RIGHT AFTER THE WARRANTY	1
655	BUT I JUST NEEDED	1
654	DEFAULT WIFI CONFIGURATION WOULDN'T	1
653	BUY NETGEAR THEY DO	1
652	NOT BAD BUT KNOW	1
650	OF POTENTIAL BUT IT	1
646	OF THE BOX ON	1
642	SHOWS STRONG WIFI SIGNAL	1
641	MADE THE PROBLR=EM OF	1
640	THAT PROVIDES COVERAGE OF	1
638	OUT HOW TO CONNECT	1
637	TRYING TO SET THIS	1
636	IS IMPOSSIBLE AND TECH	1
1858	WHEN WORKING AS DESIGNED	1
1859	BUY THIS WIRELESS ROUTER	1
1860	CHARGED TO REPLACE A	1
3063	AND THEN IT'S GOING	1
3071	EASY SETUP OKAY CONNECTION	1
3070	GREAT SIGNAL TERRIBLE INTERFACE	1
3069	DOES NOT HAVE ANY	1
3068	NOT FOR GAMING AT	1
3066	AND FINALLY GOT THIS	1
3065	WHILE IT WORKED BUT	1
3064	AWAY-NETGEAR DOESNT KNOW WHAT	1
3062	GET SLOW SPEED WITH	1
3073	ITSELF IS GOOD NO	1
3060	USE AN APPLE AIRPORT	1
3059	GEN AND WHEN THIS	1
3057	AND DD-WRT NOT GOING	1
3055	ROUTER CONFIGURATION IS A	1
3054	GET THE 802 11AC	1
3052	PURCHASE FOR SPEEDS UPWARDS	1
3045	WORKED WELL FOR MONTH	1
3072	EXTENDER NO CONFIGURATION OPTIONS	1
3074	WELL THE SIGNAL KEPT	1
3043	SQUARE FOOT HOME AND	1
3087	OK WITH BUYING A	1
3095	WASTED HOURS ON THIS	1
3094	SIMPLY DOES NOT WORK	1
3093	COULD NOT COMPLETELY GET	1
3091	WORKING AFTER ONE YEAR	1
3090	SOMETHING ELSE BAD RELIABILITY	1
3089	THIS PRODUCT PRODUCED IN	1
3088	CUSTOMER DIS)SERVICE AT ITS	1
3086	RECOGNIZES PRONTERS WONT BUY	1
3075	IMPRESSED AS I WANTED	1
3084	IT'S DECENT THE SIGNAL	1
3083	IT FOR WELL OVER	1
3081	WIFI THE SUPPORT IT	1
3080	ISSUE WITH THE R8000	1
3079	I'VE BOUGHT IN AGES	1
3078	CAN DRIVE THRU IT	1
3077	GENIE FAILED AND NETGEAR	1
3044	TECH SUPPORT RIP OFF	1
3042	SOFTWARE AND ONLY A	1
3211	IS EXCELLENT STRONGER AND	1
3006	HAD TO REBOOT THIS	1
3015	RANGE IS GREAT ON	1
3014	PART ABOUT THIS PRODUCT	1
3013	PROPERLY AND I HAVE	1
3012	DISCONNECTS ALL THE TIME	1
3011	WAS UP BUT I	1
3008	DO MUCH OTHER THAN	1
3007	IT WORKS IT'S GOOD	1
3003	OF INTERNET CONNECTION DROPPING	1
3018	DO NOT WORK INTENTIONAL	1
3002	BACK OF MY HOUSE	1
3001	MONTHS AND THEN DIED	1
2999	NOT WIFI INTERFERENCE OR	1
2998	TO THE INTERNET AND	1
2997	THIS LITTLE THING ARE	1
2996	INSTALL THE INSTRUCTIONS WERE	1
2994	SEEMED TO WORK FINE	1
3016	IS HERE I HAVE	1
3019	NOT ENOUGH FOR ANY	1
3041	ON THIS MODEM AND	1
3033	TO PAY FOR TECH	1
3040	ROUTER IS ONLY COSMETIC	1
3039	UNIT BAD CUSTOMER SERVICE	1
3038	GET SETUP AND NEVER	1
3037	NOT USB 2.0 COMPATIBLE	1
3036	WORSE THAN THE BASIC	1
3035	THE HOUSE AND I	1
3034	TURNING OFF AUTOMATICALLY AND	1
3030	WOULD BUY A NEW	1
3020	ROUTER GIVE THIS A	1
3029	IS ABOUT 20 FEET	1
3028	WIRELESS SPEED IS ONLY	1
3027	JUNK FOR ANYTHING BEYOND	1
3025	YOURSELF THE TROUBLE AND	1
3024	FOR ME INTERNET WOULD	1
3022	BUT DID NOT HAVE	1
3021	WORKED GREAT WHEN IT	1
3096	GREAT IF YOUR IN	1
3097	AFTER POWER OUTAGE AND	1
3098	SEEMS TO DROP CONNECTIONTHRPUGHOUT	1
3166	DRIVE FUNCTIONALITY NEEDS FURTHER	1
3178	TO INSTALL AND DIRECTIONS	1
3176	TECHNOLOGY THAN I NEEDED	1
3175	GREAT WITH MY N100	1
3173	ROUTER THAT CAN SUPPORT	1
3172	IF YOU HAVE MANY	1
3170	SLOW AC BUT GREAT	1
3169	NICE ROUTER THIS ROUTER	1
3165	CONNECTIONS WIRELESS AND WIRED	1
3180	AGO AND IT'S ALREADY	1
3164	30 DAY AMAZON RETURN	1
3163	THE ADVERTISING FROM THE	1
3162	FIX PROBLEM WITH SECURITY	1
3161	WORKED GOOD IT THOUGHT	1
3160	NOT WPA NETGEAR SUPPORT	1
3159	NOT BUY FROM NETGEAR	1
3158	IN TERMS OF SECURITY	1
3179	NEED SUPPORT CALL FOR	1
3181	FLAWED PRODUCT STAY AWAY	1
3099	A REALLY GOOD ROUTER	1
3200	WEEK OF PURCHASE BECAUSE	1
3209	BIG WHOLE THAT A	1
3208	JOB BUT COULD HAVE	1
3206	OR ANYTHING LIKE THAT	1
3205	LOVED MY OLDER NETGEAR	1
3203	ON A BOAT IN	1
3202	OUT AD THIS SMELLS	1
3201	WITH ADVANCED FEATURES WOULD	1
3199	HAS A MASSIVE SECURITY	1
3182	SURE THIS IS THE	1
3196	SLOW AND 5G IS	1
3195	LUCK GETTING HELP--LONG WAITS	1
3194	AS POWERFUL AS I	1
3193	THIS UNIT IS HORRIBLE	1
3186	NEED TO REBOOT AND	1
3184	JUNK OLD ONE WORKED	1
3183	SAVE YOURSELF THE TROUBLE	1
3155	UP IS FAR FROM	1
3153	REALLY SUCKS BE PREPARED	1
3152	SET UP STILL CAN'T	1
3111	OF TIME WON'T BUY	1
3122	CONSTANTLY DROPPED CONNECTION WINDOWS	1
3121	HOW TO SET IT	1
3117	LOTS OF DEVICES HORRIBLE	1
3116	BY NETGEAR SUPPORT TO	1
3115	NETGEAR SPEND YOUR MONEY	1
3114	SET UP SINCE I	1
3113	IMPOSSIBLE TO RESTRICT ACCESS	1
3110	WORKS GREAT FOR THE	1
3151	DAYS IT JUST BUFFERS	1
3109	UNFORTUNATELY THIS PRODUCT DIDN'T	1
3108	BETTER THAN ROUTERS HALF	1
3106	IT WAS SO EXPENSIVE	1
3105	WELL SO FAR AND	1
3104	NETGEAR MAKES A DECENT	1
3103	BAND DO NOT BUY	1
3100	ONLY HAD A FEW	1
3125	UP OUT OF THE	1
3127	IT MAY WORK FINE	1
3128	BUT WILL BE SHOPPING	1
3129	GALLED ME MORE THAN	1
3150	FOR A 150MBPS DEVICE	1
3149	WON'T STAND BEHIND THEIR	1
3148	THE PRODUCT DOES WHAT	1
3147	STRONG SIGNAL AND THE	1
3146	SUPPORT WENT BACK TO	1
3145	THIS EASILY WITH MY	1
3142	CONNECT AND AM CLOSE	1
3141	OR SOMETIMES EVERY 20	1
3140	ABOUT HOW GOOD THIS	1
3138	REBOOT EVERY 5-8 HOURS	1
3137	NOT BAD BUT RAN	1
3136	LATEST CISCO LINKSYS PERFORMED	1
3134	TO MY WGL 160	1
3131	EXPECT A LOT MORE	1
3130	GOOD FOR A WHILE	1
2993	ORBI HAS THE BEST	1
2992	RANGE SUCKS ON THIS	1
2991	HORRIBLE FIRMWARE WITHOUT ANY	1
2850	FRAUDULENT SALE OF A	1
2859	IN A 3-STORY TOWNHOUSE	1
2858	FOR NO APPARENT REASON	1
2856	WORK WITH SAMSUNG PC	1
2854	EVEN WITH FIRMWARE UPDATE	1
2853	UP PLUGGING IN AN	1
2852	DO NOT BUY EXTREMELY	1
2851	RETAILER WITH WARRANTY ISSUE	1
2848	POWER CYCLE EVERY COUPLE	1
2861	SLOW 802.11/AC CONNECTION SPEED	1
2846	IT QUIT RESET IT	1
2844	SMALL COVERING SIGNAL RANGE	1
2843	TELL YOU THIS HAS	1
2841	WILL SUIT YOU FINE	1
2840	WILL BE DITCHING THIS	1
2839	NOT BUYING NETGEAR PRODUCTS	1
2837	GOOD LUCK GAMING OR	1
2860	DISK NO GOOD ROUTER	1
2862	VERY SLOW WEB UI	1
2886	THAT THIS ROUTER WORKED	1
2874	NOT WORK IN WIFI	1
2884	TO RESTART IT EVERY	1
2882	ROUTER ONCE YOU DUMP	1
2881	EVERYTHING FROM THE INTERNET	1
2879	CONNECT TO MY SMART	1
2878	TWO VERY DISAPPOINTED REPLACEMENT	1
2876	WORK FOR ME AT	1
2875	I'VE FOUND BETTER PRODUCTS	1
2873	THEY REMOVED THE IPV6	1
2863	ARE REAL CLOSE POOR	1
2872	MODEL WHICH BROKE AS	1
2871	TIME TO GET THIS	1
2869	TO SLIGHTLY STRONGER SIGNAL	1
2867	POOR USB DEVICE SUPPORT	1
2866	SERIAL NO NO MANUAL	1
2865	NEVER AGAIN AND NO	1
2864	ONLY WORKS UNDER CONNECTION	1
2836	THIS IS A TOTAL	1
2833	PRODUCT HAS NO TELEPHONE	1
2832	PORT NOT ENABLED THIS	1
2791	WORKS RIGHT OUT OF	1
2801	WILL NOT PURCHASE ANOTHER	1
2800	INSTALLED THE APP UPGRADED	1
2799	SEARCH ENGINE MISTAKE NEEDED	1
2797	THAN PREVIOUS VERSIONS UNTIL	1
2796	MY FIRST FLOOR IS	1
2795	UP IT IS VERY	1
2792	SEVERAL FIRMWARE PROBLEMS NETGEAR	1
2790	TIME ON PARENTAL CONTROL	1
2831	ADVERTISED WITH WINDOWS 10	1
2789	IS FINE CALL TECH	1
2788	HAVE BEEN USING IT	1
2787	THE SIGNAL STILL HAS	1
2786	PLEASES DO NOT WASTE	1
2784	DEVICE DIDN'T LIVE UP	1
2783	WAS HORRIBLE COULDN'T GET	1
2781	OTHER GOOD REVIEWS AND	1
2803	TO BE A COMMON	1
2806	COULD NOT REACH THE	1
2807	UNTIL THEY RESOLVE THE	1
2809	GREAT SECOND FLOOR NOT	1
2830	DIDNT LAST VERY LONG	1
2829	ZERO WAY THIS ROUTER	1
2825	MY WIRELESS ADAPTER GOT	1
2824	FAST AS A FIRST	1
2823	TECH SUPPORT TO GET	1
2822	45 MINUTES TO GET	1
2821	BE WORTH WAITING FOR	1
2820	PRODUCT WORSE CUSTOMER SERVICE	1
2819	DROP EVERY FEW MINUTES	1
2818	AFTER FIRMWARE UPGRADE FAILURE	1
2816	THING LIKE THE PLAGUE	1
2814	THROUGHOUT A GOOD SIZED	1
2813	EXPERIENCE AFTER MONTHS OF	1
2812	HOURS LISTENING TO HOW	1
2810	UP NOT VERY FAST	1
2885	THIS ONE IS NOT	1
2887	SEEMS NOT TO WORK	1
2989	NO LONG RANGE WIFI	1
2952	RECOMMEND NOT BUYING THIS	1
2961	CABLE MODEM IS FINE	1
2960	BAD FOR THE PRICE	1
2958	SLOWED DOWN BY WALLS	1
2957	BROUGHT A BETTER ROUTER	1
2956	STAR REVIEWS AND DON'T	1
2954	BELIEVE NETGEAR WANTS ME	1
2953	SAVE YOUR MONEY FOR	1
2951	TO INSTALL BUT VERY	1
2963	TO DO ANYTHING FOR	1
2950	MONITOR PAINTING EVERY OTH	1
2949	DECIDE BASED ON THE	1
2948	IT WAS AN PAIN	1
2947	CONNECT 30 FEET FROM	1
2946	IT WILL EXTEND YOUR	1
2945	ADVERTISING FROM THE MANUFACTURER	1
2943	REVIEW SINCE I NEVER	1
2962	THAT THE ONLY GOOD	1
2964	DISAPPOINTED IN THE WI-FI	1
2888	NEVER EVER BUY A	1
2981	PROXY DHCP BUG CAUSES	1
2988	THE PASSWORD IS COSTUMER	1
2987	BE SATISFIED THE UNIT	1
2986	SLOW WEB UI PERFORMANCE	1
2985	IT CUTS OUT FREQUENTLY	1
2984	FOR FREE LIFETIME WARENTY	1
2983	BRAND AC MIMO DUAL	1
2982	TECH SUPPORT LOUSY BRIDGING	1
2975	YEAR LATER THIS THING	1
2965	EXPERIENCE ATTEMPTING TO SET	1
2974	DOES NOT MEET RANGE	1
2972	RANGE AND DROPPED SIGNAL	1
2971	WORST PIECE OF GARBAGE	1
2970	RANGE COMPARED TO OUR	1
2969	FOR LACK OF RELIABILITY	1
2967	DROPS LATENCY AND POOR	1
2966	NEEDS TO POWER UP	1
2942	AT BEST BUY THEY	1
2941	CAN'T GET A RMA	1
2940	OUT WITH PERMANENT MARKER	1
2903	AND PLAN ON BUYING	1
2912	KEEPS CRASHING MY LINKSYS	1
2911	DOWN PRETTY EASY MY	1
2910	PLUG DIDN'T WORK PROPERLY	1
2908	IT DROPS THE SIGNAL	1
2906	DIDN'T WORK GOT LONG	1
2905	YOU MAKE THIS THING	1
2904	IN THE IT FIELD	1
2902	THE LATEST CISCO LINKSYS	1
2936	WORKED LIKE A CHARM	1
2901	PRICE IS PREMIUM THE	1
2899	FOR ALMOST A YEAR	1
2896	ALREADY HAD MULTIPLE PROBLEMS	1
2895	WORK GREAT I HAVE	1
2893	WORKS PRETTY WELL WITH	1
2891	IT TRANSMITS 40 LESS	1
2890	CAUSE AGGRAVATIONNOT THE CASE	1
2913	AND EASY TO INSTALL	1
2914	THAN X4 THE 5GHZ	1
2917	POOR REACH AND PUSHY	1
2918	ON THIS DEVICE IS	1
2935	TECH SUPPORT IS WORTHLESS	1
2934	ISSUES WITH FIRMWARE UPDATE	1
2933	THE SPEED IS NOTICEABLY	1
2932	DOESN'T WORK I'M STUCK	1
2931	THE QOS AND VOILA	1
2930	I WOULD GET BETTER	1
2929	FOR ME...OR 40 OF	1
2928	LOOKS GREAT WORKS BAD	1
2927	NO BAND STEERING GREAT	1
2926	WORKS HORRIBLE WHEN IT	1
2925	IN A MARINA THAT	1
2924	WIRELESS ELECTRONICS NOT AS	1
2923	ALMOST LIKE AN OLD	1
2922	ROUTER/ACCESS-POINT I HAVE EVER	1
2919	BUY THE REFURBISHED UNITS	1
3210	ADAPTER WHICH WORKED JUST	1
3212	NO FUNCIONA IT DOES	1
2778	THIS PRODUCT IS PRETTY	1
3527	SURE IT'S NOT NORMAL	1
3536	ROUTER...DEFECTIVE PRODUCT THAT IS	1
3535	FORMAT OF THE AC3200	1
3534	INERNET AVOID AT ALL	1
3533	WHAT I EXPECTED FOR	1
3530	N300 WITH THIS NEW	1
3529	WILL NOT HOLD AT	1
3528	I HAVE USELESS CD	1
3525	WORKED MUCH WORSE THAN	1
3539	ALREADY LOOKING FOR A	1
3524	AND CONFUSING USER INTERFACE	1
3523	AFTER UPDATING THE FIRMWARE	1
3521	GREAT UNFORTUNATELY I'M EXPERIENCING	1
3520	DROPPED CONNECTIONS TECH SUPPORT	1
3519	THING HAS A VERY	1
3518	TERRIBLE PRODUCT BAD CUSTOMER	1
3517	OR HARDWIRE IN A	1
3537	THE RADIO STARTED FAILING	1
3543	AND HARD ABOUT BUYING	1
3515	N300 WALL PLUG VERSION	1
3556	WIFI EXTENDER DOESN'T LOOK	1
3563	HAS PROMISE OPENVPN ISSUES	1
3562	DECENT WIFI ROUTER BAD	1
3561	PLAN ON BUYING A	1
3560	PRODUCT BACK DUE TO	1
3559	DOWN OVER AND OVER	1
3558	LIKE THIS ROUTER SOME	1
3557	WORK HARD TO GET	1
3555	A DIRECT FIBER OPTIC	1
3544	PERFECTLY IN THE FIRST	1
3554	NOT COMPATIBLE WITH ALARM	1
3552	AND LOOKS MONSTROUSLY GREAT	1
3550	HAD THREE OF THEM	1
3549	NETGEAR SOMEDAY FIXES THEM	1
3547	A GOOD ROUTER...DEFECTIVE PRODUCT	1
3546	QUITE THERE YET FOR	1
3545	NO WIFI IMPROVEMENT OVER	1
3516	USED PRODUCT NOT NEW	1
3514	BOUGHT THIS IN JANUARY	1
3213	HAS MANY FIRMWARE PROBLEMS	1
3477	NOT GIVE MY ASUS	1
3485	HAVING PROBLEM WITH THE	1
3484	STOCK FIRMWARE SUPPORTS DD-WRT	1
3483	I HAD IN THE	1
3482	TAKE A TIME TO	1
3480	PROBLEMS SETTING IT UP	1
3479	WARRANTY ON REFURBISHED ITEMS	1
3478	AFTER ABOUT 14 MONTHS	1
3476	AND IT'S ALREADY GARBAGE	1
3487	DIDN'T WORK AND POOR	1
3474	DON'T BUY NETGEAR PRODUCTS	1
3473	BEWARE CHEAP EXTENDER USED	1
3470	TO HAVE RUN OK	1
3468	HAVE RUN OK FOR	1
3467	GOOD REVIEW UPDATED ON	1
3466	AC1750V2 IS A GOOD	1
3464	TECH SUPPORT BUSINESS MODEL	1
3486	2005 AND IT WORKS	1
3488	DON'T WANT CONSISTENT WIFI	1
3513	GARBAGE DIED WEEKS AFTER	1
3502	UP AND THIS IS	1
3512	DOESNT KNOW WHAT TO	1
3510	CONNECTION LESS THAN YEAR	1
3509	IS HORRIBLE IT DROPS	1
3507	FOR GAMING AT ALL	1
3506	BROWSING BUT ALMOST LIKE	1
3504	DOES NOT FIND A	1
3503	UNIT COST MORE THAN	1
3501	AND THE NETGEAR SUPPORT	1
3489	WORST SUPPORT EVER STAY	1
3499	ELSE BAD RELIABILITY POOR	1
3498	IS PAINFULLY SLOW AND	1
3495	LEAST DOES NOT FUNCTION	1
3493	ONLY WATCH MOVIES AND	1
3492	LATER AND IT IS	1
3491	THAN MANY OTHER ROUTERS	1
3490	WHO ACTIVELY MANAGES THEIR	1
3564	IPV6 DHCPV6 WITH PREFIX	1
3568	MANUAL DIRECTS CUSTOMERS WITH	1
3569	YET READY FOR PRIME	1
3643	FOR 3/4 OF THE	1
3651	RECOMMEND TRYING TO SHOP	1
3650	DOESN'T DO AS DESCRIBED	1
3649	YOU'LL NEED AN ADAPTER	1
3648	HEAR IT'S GOOD BUT	1
3646	FANTASTIC WIFI AND I	1
3645	AND SET UP WITH	1
3644	FOR A 180 ROUTER	1
3642	BACK DUE TO NETGEAR	1
3654	ROOM WHERE THE THE	1
3640	IT WORK WITH CENTURYLINK	1
3639	GOOD RANGE IS JUST	1
3638	USB QUIT WORKING AFTER	1
3636	BEYOND TYPICAL BROWSING WITH	1
3633	BUT DISAPPOINTED SO FAR	1
3632	WITH EVERYTHING WIRED POSSIBLY	1
3631	THE PRODUCT THIS ID	1
3652	ABLE TO MAKE IT	1
3656	DELIVERED UNIT DOES NOT	1
3570	SERIOUS WI-FI CONNECTION PROBLEMS	1
3673	SMART TV AT THE	1
3683	POWER USERS STAY AWAY	1
3682	CREDIT WHICH WAS PROMPT	1
3681	SERVICE GOOD PRODUCT IS	1
3680	RATING HAS LITTLE IF	1
3679	SO COOL AND DISAPPOINT	1
3678	THEN IT WORKED GREAT	1
3675	SPEEDS BUT THE SHARING	1
3671	WAS GETTING MORE AND	1
3657	FOR THE MONEY IT	1
3668	TIME IT COULD BE	1
3667	THE RETURN WINDOW HAS	1
3666	VERY OFTEN I DON'T	1
3662	POWER UP TERRIBLE CUSTOMER	1
3661	PARTY SUPPORT THAT WAS	1
3659	JUST AS BAD AS	1
3658	TRIED ALL SORTS OF	1
3630	FIX OR GET HELP	1
3629	ENTRY LEVEL ROUTER BUT	1
3627	ORBI OUTAGES RANDOMLY BYE	1
3583	PRODUCT DO NOT BUY	1
3593	FOR THE MONEY JUST	1
3591	AT THE PRODUCT DESCRIPTION	1
3589	HOME SHARING NOT WORKING	1
3587	BUT WOULD NOT CONNECT	1
3586	UNITS NO SERIAL NO	1
3585	IS NOT EASY YO	1
3584	BAD SERVICE FROM NETGEAR	1
3582	SEE VERY LITTLE DIFFERENCE	1
3626	NOISY FAN COMES WITHOUT	1
3580	IT'S NOT EASY FOR	1
3578	MUCH BETTER COVERAGE THAN	1
3577	LOOKING FOR A WIFI	1
3575	BUT WAS REALLY HOPING	1
3574	PRICE AND GOOD FOR	1
3573	STRONGER SIGNAL THAN WHAT	1
3572	ENHANCING THE WIRELESS RELIABILITY	1
3595	AFTER THE 90 SUPPORT	1
3596	TIME WARNER INTERNET NOT	1
3599	THE PROBLEM IS IT	1
3602	AND USING GOOGLE CHROMECAST	1
3623	ROUTER WORKS GREAT ONCE	1
3619	TO EXPERIMENT WITH POSITIONING	1
3618	LATEST DOWNLOADED FIRMWARE FROM	1
3616	SET UP FOR OLDER	1
3615	LESSON LEARNED YOU GET	1
3613	CORRECTLY FROM THE START	1
3612	WITH USED CHIPPED UNIT	1
3610	WORKING 30 DAYS LATER	1
3609	NOW THEY JUST TRY	1
3608	BUT I HAD/HAVE FIRMWARE	1
3607	SURE IF I LIKE	1
3606	THE R7000 NOT BLOCKED	1
3605	ON 2.4 AND USING	1
3604	IDEA BAD TO IMPLEMENT	1
3603	PRODUCT I DIDN'T PAID	1
3463	BEEN GOOD I HAVE	1
3462	SETTINGS WIFI EVERY TIME	1
3460	THIS AT ALL COSTS	1
3292	TRICKY BUT NOT TOO	1
3303	PRODUCT FUNCTIONS BUT DEFINITELY	1
3302	SUCH A GREAT SIGNAL	1
3301	INTERNAL HARD DRIVE GET	1
3299	PRODUCT IS SUPPOSED TO	1
3298	TAKE BACK DEFECTIVE ITEM	1
3296	A NAS TO THE	1
3295	HOMES UPDATE FIRMWARE NOT	1
3289	THAN I PAID FOR	1
3305	SO YOU CAN RETURN	1
3285	SPEED SLOWS DOWN SIGNIFICANTLY	1
3284	DID BUY THE NETGEAR	1
3283	ANY SETTINGS CHANGES ABOVE	1
3282	GET MUCH BETTER COVERAGE	1
3281	FOR USE OF YOU	1
3280	NOTHING TO DO WITH	1
3279	LIKE BE THE STYLE	1
3304	MONEY ON THIS YET	1
3306	ETHERNET PORT IF YOU	1
3328	AT MICRO CENTER WHEN	1
3317	A BROKEN ROUTER THAT	1
3326	GOOD FOR 10 DAYS	1
3325	CUSTOMER SUPPORT WIRELESS SPEED	1
3323	RUN ON MAC IT'S	1
3322	HARD WORK TO WORTH	1
3320	WITH YOUR SURFACE DEVICES	1
3319	WORKING WIFI IS OK	1
3318	MUCH WRONG WITH IT	1
3315	AND HAS REALLY GOOD	1
3307	FIX THEM CONFIRMED JUNK	1
3314	MODEM IS FINE THE	1
3313	ROUTER APPEARED FINE BUT	1
3312	CONNECTED THINGS WILL DROP	1
3311	WITH THIS WORKING WITH	1
3310	DRIVERS AND ENDED UP	1
3309	A STRONG SIGNALS AT	1
3308	AND THE WORST PART	1
3278	DROOPS BOTH WIRELESS AND	1
3276	FT ONE LEVEL TOWN	1
3275	MONEY AND MY TIME	1
3228	I PREFER AMAZON PRIME	1
3239	ROUTER BUT NOT USABLE	1
3238	ON MAC IT'S GARBAGE	1
3237	AND RIGHT AWAY I	1
3236	WELL BUT REQUIRES TROUBLESHOOTING	1
3235	TO IT AS WELL	1
3233	THIS SMELLS LIKE A	1
3232	IT USED A N300	1
3225	WORK FINE WITH THE	1
3274	LONGER THAN ONE YEAR	1
3222	A CLASS ACTION LAWSUIT	1
3220	SUPPORT FROM NETGEAR OVERSEA	1
3219	REFURBISHED ROUTER ORDERED FROM	1
3218	200 FOR FREE LIFETIME	1
3216	DOWN ON THIS ONE	1
3215	NETGEAR CUSTOMER SERVICE ADMITTED	1
3214	INSTALL NO TECHNICAL SUPPORT	1
3244	THE PRODUCT ITSELF MIGHT	1
3245	THIS PRODUCT WORKS GREAT	1
3246	MAC TO ROUTER VERY	1
3247	TO REPLACE OUR OLD	1
3273	SPEEDS ON THIS ROUTER	1
3272	BUT THERE ARE SOME	1
3271	AND USUALLY IT IS	1
3270	NOT EVER REACH THE	1
3266	WE GOT IT TO	1
3260	ABOUT A WEEK AGO	1
3259	YOU HAVE TIME WARNER	1
3258	DISCONNECT FOUR TIMES A	1
3257	THIS ID MY SECOND	1
3256	COMPUTER IT ACTUALLY MADE	1
3254	JUST LIKE THIS ONE	1
3253	WIFI IS GREAT PARENTAL	1
3252	THAN A CHEAPER UNIT	1
3249	AS QUALITY AND AS	1
3248	DISCONNECTS WHERE IS NETGEAR	1
3327	IT'S BLAZING FAST AS	1
3329	WAS NOT WITHIN RANGE	1
3459	AND I LOSE SIGNAL	1
3411	RANDOMLY STOPS CONNECTING TO	1
3425	IT TO YEAR OLD	1
3420	I HAD PROBLEMS WHEN	1
3419	TIME IT GOES OFF	1
3417	ONLY HAS USB PORTS	1
3415	I HAPPENED TO READ	1
3414	GREATLY DISAPPOINTED WITH THIS	1
3413	REVISION I DO NOT	1
3410	BASIC ACCESS RESTRICTIONS FUNCTIONALITY	1
3428	WORK NO TECH SUPPORT	1
3409	ON MY DO NOT	1
3407	UI PERFORMANCE DEFAULT WIFI	1
3406	WIRED SET UP WIRELESS	1
3404	BEST BUY AND GET	1
3403	HAS NO SET-UP SUPPORT	1
3402	DON'T UNDERSTAND ALL THE	1
3401	DROPPING SIGNALS I NEED	1
3427	IT'S MUCH WORSE THAN	1
3430	ME AND WIN PROBLEMS	1
3330	THERE IS NO KNOWN	1
3449	WAS PRETTY GOOD FOR	1
3458	MORE POWERFUL THAN ISP	1
3457	IT'S LETTING ME DOWN	1
3455	INITIALLY PURCHASED THIS ROUTER	1
3454	SEPARATE UNITS SAME QUALITY	1
3453	OVER TIME AND FORGET	1
3452	THE MODEM IN FINE	1
3451	PERFECT STILL WORKING SECOND	1
3448	433 MBS UNINSTALLER IT	1
3432	NETGEAR THIS ITEM WAS	1
3447	YOU WANT CONSTANT CONNECTION	1
3446	HELP SETTING IT UP	1
3444	IS HORRIBLE WONT EVEN	1
3441	ONGOING SERVICE COSTS FROM	1
3440	GREAT BUT DISAPPOINTS OVER	1
3439	LAST 10 IS REALLY	1
3435	HAD PROBLEMS WHEN SURFING	1
3400	MORE PNG/MS THEN MODEM	1
3398	REVIEWS BEFORE YOU BUY	1
3397	BLACKED OUT WITH PERMANENT	1
3341	MY SYSTEM AND CALL	1
3359	MONSTROUSLY GREAT SOFTWARE SEEMS	1
3356	THIS BOOSTER HELPS IN	1
3351	TOO MANY WAN AND	1
3350	THEN IT HAS WORKED	1
3345	DOES NOT READ THE	1
3344	WASTED WAY TOO MUCH	1
3343	WAS TOTALLY USELESS VIA	1
3339	AN APPLE AIRPORT EXPRESS	1
3395	NETGEAR SUPPORT TO BUY	1
3338	DAY AMAZON RETURN POLICY	1
3337	IS UP TO DATE	1
3336	TERRIBLE UNIT AVOID BUYING	1
3335	WHOLE LOT BETTER BUT	1
3334	THE LOOK AND FEEL	1
3332	DID FIND OUT WHAT	1
3331	TRY A DIFFERENT ROUTER	1
3362	WITH IT IS UNUSABLE	1
3364	ISN'T THAT GOOD IT	1
3365	UP STILL CAN'T GET	1
3367	DON'T BUY THE NETGEAR	1
3394	MULTIPLE PROBLEMS WITH THIS	1
3393	SAID THAT NEW ROUTERS	1
3392	WHILE TO CONNECT TO	1
3391	STARS BECAUSE WHEN IT	1
3389	ONLY OFFERED AN APOLOGY	1
3388	IF YOU WANT AN	1
3382	NEGATIVE REVIEWS THIS WILL	1
3381	THAN MY 50 YEAR	1
3376	DISAPPOINTED MY OLD NETGEAR	1
3375	TECH SUPPORT ONLINE OR	1
3374	ROUTER WOULD BE EASY	1
3373	ON THIS IS HORRIBLE	1
3372	TIME--DON'T SPEND YOUR MONEY	1
3370	OFFICIAL RETAILER WITH WARRANTY	1
3369	PIECES OF TECHNOLOGY I'VE	1
2779	WAS NOT GOOD STRENGTH	1
2777	INTERNET EVER SINCE I	1
1862	AND REPLACEMENT PROCESS WAS	1
2158	WORKED MUCH BETTER AND	1
2168	IN ANOTHER ROOM 30FT	1
2166	SECOND FLOOR AND OTHER	1
2165	100 PIECE OF TRASH	1
2163	WOULD JUST DIE ALREADY	1
2161	THE CABLE MODEM IS	1
2160	IT WITH A METAL	1
2159	DROPPING CONNECTIONS LESS CUSTOMIZABLE	1
2157	GOOD BUT APPEARS COMPARIBLE	1
2170	PERFORMANCE AT A HIGH	1
2155	BEEN STAMPED WITH AN	1
2150	SAME RANGE AS THE	1
2148	ACTUALLY WORKS AS ADVERTISED	1
2147	HARDWARE REVISION I DO	1
2146	FEELS LIKE A WASTE	1
2145	AM HAVING MAD ISSUES	1
2144	ADVERTISE AS WORKING WITH	1
2169	BEWARE--INEXPENSIVE ROUTER BUT ALSO	1
2171	THIS PRODUCT BROKEN FIRMWARE	1
2142	DEFECTIVE ROUTER POOR TECHNICAL	1
2191	A GOOD BUY DOES	1
2200	COULDN'T BE MORE DISAPPOINTED	1
2198	CAN ONLY CONNECT TO	1
2196	FIRMWARE DRIVES ME CRAZY	1
2195	ALSO BOUGHT THE ASUS	1
2194	SIGNAL DO NOT WASTE	1
2193	SOMETHING THAT NEVER WORKED	1
2192	WHICH BROKE AS WELL	1
2190	WORKED GREAT PRIOR THOUGH	1
2173	WAS PLACED IN A	1
2186	REFURBISHED AND WORKS LIKE	1
2185	DISABLE THE ROUTER FUNCTION	1
