	name	count
24024	FOR CUSTOMER SERVICE AFTER	1
24023	THE IT FIELD AND	1
24020	BOUGHT THIS PRODUCT NOVEMBER	1
24019	DON'T BUY THIS THIS	1
24018	YOU WANT A DUAL	1
24017	EXTENDER DID NO IMPROVE	1
24015	NOT SUITABLE FOR HOMES	1
24005	POWER OUTAGE AND POOR	1
24014	UNSTABLE PRODUCT BAD SUPPORT	1
24011	INSTALL AND I AM	1
24010	BUY THIS GO FOR	1
24009	COAXIAL CONNECTION ETHERNET TO	1
24008	FOR WINDOWS 10 AND	1
24007	ARE OK WITH BUYING	1
23984	UP TO FOUR TIME	1
23981	HAVE WINDOWS 10 DO	1
24027	EASTERN OREGON 35 MILES	1
23980	CHECK YOUR REQUIREMENTS FOR	1
23949	THE ANTENNA IS LOOSE	1
23948	OWN A SAMSUNG PHONE	1
23947	BEST I DON'T THINK	1
23945	BUT LESS RELIABLE THAN	1
23943	INCONSISTENT INTERNET SPEEDS THROUGH	1
23941	MAKES PROMISES IT CANNOT	1
23940	SLOW MY SMART DVD	1
23939	NETGEAR TECH SUPPORT PROBLEMS	1
23938	TOO BIG AND TOO	1
23937	NOT MY BEST BUY	1
23936	THIS IS NOT USB	1
23934	WANT TO WASTE MONEY	1
23933	ONLY HAS ETHERNET CONECTION	1
23932	WAS GREAT NOW NETGEAR	1
23931	BETTER LOVED MY OLDER	1
23951	ITS POSSIBLE THERE IS	1
23952	OF ALL THE FAKE	1
23953	WANTED FAST WIRELESS FOR	1
23970	EXPERIENCED THE WIFI SIMPLY	1
23977	AC BUT GREAT PRICE	1
23976	A COMPETITORS THAT WORKED	1
23974	PROBLEMS WITH CONSISTENT CONNECTION	1
23973	YOU'LL GET WITH HIS	1
23972	WELL AT MY HOUSE	1
23971	GARBAGE THAT WILL DRIVE	1
23968	ROUTER NEEDS TO GO	1
23954	ACCESS BY WIRELESS DEVICE	1
23967	ORDER AND NETGEAR'S SUPPORT	1
23965	CUSTOMER SERVICES AND DIFFICULT	1
23964	IS GREAT ON THIS	1
23961	TV IS HAVING ISSUES	1
23956	FOR GAMING STAY AWAY	1
23955	ME WITH NONE OF	1
24025	THE NETWORK THAT IT	1
24028	ABLE TO SETUP RETURNED	1
23707	HAS ENDED IN US	1
24081	WEP NOT WPA NETGEAR	1
24112	FOR VERY SMALL NETWORKS	1
24106	INSTALLED THIS ROUTER WI-FI	1
24102	GREAT FOR 92 DAYS	1
24100	IF YOU READ THE	1
24098	LAST LONGER THAN YEARS	1
24097	ONLY MONTHS WARRANTY THEN	1
24096	POOR PERFORMANCE AND LOUSY	1
24095	RELIABLY FOR THE FIRST	1
24094	WILL BREAK IN A	1
24093	ORBI SYSTEM USELESS DUE	1
24091	ROUTER CAME WITH INSTALLATION	1
24090	AND INSECURE DO NOT	1
24088	TWO DAYS THEN USELESS	1
24086	MINS RANGE IS HORRIBLE	1
24085	UP IS EASY THE	1
24114	WITH IPADS STREAMING NETFLIX	1
24117	GO IN THE NEXT	1
24118	BUT FLAKY IPV6 SUPPORT	1
24133	TO LIKE THIS PRODUCT	1
24142	10 ON SPEED ON	1
24141	AT FIRST SIGHT BUT	1
24140	QUITE READY SAVE YOUR	1
24139	WEB AND ON PHONE	1
24136	AFTER WEEKS NETGEAR WOULDN'T	1
24135	REPLACE MY OLDER BELKIN	1
24132	A MONTH AND AT	1
24119	GREAT SIGNAL BAD STABILITY	1
24130	IS IN INSTALLATION CD	1
24129	PASSWORD IS COSTUMER SERVICE	1
24126	10 MOVE UP A	1
24124	NOTHING SPECIAL...DEFINITELY NOT A	1
24122	WORKS MUCH BETTER NOW	1
24120	SUPPOSED TO BE EASY	1
24083	PLEASE GO TO NETGEAR	1
24079	WIRELESS ADAPTER LIKE THE	1
24029	INTERNET SIGNAL SEVERAL TIMES	1
24077	BAND NOT EASY TO	1
24051	ON HOLD FOR 1/4	1
24050	RANGE WHEN IT WORKS	1
24047	PROVIDE 150MBPS WIRELESS CONNECTIVITY	1
24046	BUT NOT STRONG ENOUGH	1
24045	DEVICES HORRIBLE WITH WIRELESS	1
24043	WINDOWS 10 DRIVERS ARE	1
24042	THIS UP AND THEN	1
24039	OTHER ROUTER BRAND STAY	1
24036	MONEY AND GET SOMETHING	1
24035	DROPPING SIGNALS AND LOST	1
24034	IS UNUSABLE AND I	1
24033	NOT TURN OFF AND	1
24032	GREAT WHEN YOU NEED	1
24031	NETGEAR ROUTER SOME PC	1
24030	COMPATIBLE AS OF 8-13-15	1
24052	WIRELESS ROUTER OK FOR	1
24053	EVEN IN A 20	1
24055	COVER MY MEDIUM SIZED	1
24069	AWAY AND BUY AN	1
24076	MY WORD FOR IT	1
24075	ROUTER IN JUST A	1
24073	NO UPDATED DRIVES IN	1
24072	MY SECURITY AND IT'S	1
24071	RANGE A LITTLE UPSETTING	1
24070	NEEDED A DIRECT ROUTER	1
24066	ROUTER WORKS FINE..WHEN IT	1
24056	BY HIGH SCHOOL KIDS	1
24065	WITH A LINKSYS USB	1
24063	THAN THAT NO MATTER	1
24062	WHEN IT'S WORKING IT	1
24060	NETGEAR TO BE SATISFIED	1
24059	WITH IT FOR WELL	1
24057	FINE THE ONLY INCONSISTENT	1
23929	WIRELESS-N DUAL BAND ROUTER	1
23928	FOR MONTHS THEN DIED	1
23927	ALTHOUGH IT DOES WORK	1
23755	NO GOOD NOW I'M	1
23778	GOOD REVIEWS WHICH IS	1
23777	THE SPEED UPGRADE THIS	1
23776	NEEDS TO GO BACK	1
23775	WHEN IT WORKS WHICH	1
23774	ME BECAUSE OF WINDOWS	1
23772	IT SET UP SO	1
23769	EXTRA COST OF TECH	1
23768	A DISAPPOINTMENT SINCE I	1
23767	WASTE MONEY GET A	1
23764	YOUR TIME CONTACTING NETGEAR	1
23763	LOWEST GRADE OF SPEED	1
23762	HAS VERY POOR RANGE	1
23760	NOT VERY GOOD PRODUCT	1
23759	REPLACEMENT NIGHTHAWK R6700 WORKING	1
23757	IT'S GREAT FOR OR	1
23779	UPGRADE BUT AM SENDING	1
23781	RECOMMEND FOR ADVANCED USERS	1
23783	FOR SEVERAL STREAMING CONNECTIONS	1
23798	WITH AN ALMOND 2015	1
23807	TO WORK ON BOTH	1
23806	KNOW WHAT THE PASSWORD	1
23802	PRODUCT VERY FAST MBPS	1
23801	UPGRADE PERFORMANCE HAS IMPROVED	1
23800	SETUP TO REPLACE DEAD	1
23799	GREAT PRICE AND FAST	1
23796	BY ITSELF BUT APPEARS	1
23785	TOO DIFFICULT TO INSTALL	1
23794	AWAY TIME AND CLOCK	1
23793	IT JUST MY LUCK	1
23791	PRODUCT HAS VERY POOR	1
23790	BETTER THAN LIST FORMAT	1
23788	SETUP PROBLEMS PERFORMANCE MAKES	1
23786	FOR SOME DAYS AND	1
23756	A FEW MONTHS OF	1
23754	HARD DRIVE IN IT	1
23926	SPEEDS WERE GOOD RANGE	1
23753	DIDN'T KNOW ANY BETTER	1
23726	GOOD ROUTER AND PUT	1
23725	WORK PROBLEMS WITH PORTS	1
23723	NEVER BY NETGEAR AGAIN	1
23721	ROUTER BEFORE WORKED FINE	1
23720	REVIEW AND I HATE	1
23719	THIS AS A ZERO	1
23718	IT WORKS IT'S GREAT	1
23716	GOOD ABOUT THIS ROUTER	1
23715	RECOMMEND ANYBODY TO BUY	1
23713	I LIKE NETGEAR PRODUCTS	1
23712	DRIVERS AND DEVICE DISCONNECTS	1
23711	WOULD BE STARS IF	1
23710	THUS I'M NOT SURE	1
23709	RESULT KEPT LOSING CONNECTIVITY	1
23708	THINGS WILL DROP IN	1
23728	A ROUTER IT'S GREAT	1
23729	AND NOT REALLY PLUG	1
23732	THE TIME 80 OF	1
23745	THIS PRODUCT WAS EASY	1
23752	DISAPPOINTED DEAD AFTER MONTHS	1
23751	WHO HAVE INTERNET SPEED	1
23750	AND HAD TO SPEAK	1
23749	BUY ONE 1/10 OF	1
23748	A GOOD SOLUTION FOR	1
23747	ME TO RETURN THIS	1
23744	GET EXCHANGE WHEN I	1
23733	A PARTICULARLY GOOD JOB	1
23742	NOT APT FOR APPLE	1
23741	AS A WHOLE HOME	1
23740	DIDN'T MAKE A DIFFERENT	1
23736	BROKE BY AWFUL FIRMWARE	1
23735	ON BOTH WIRELESS AND	1
23734	NOT BUY IS YOU	1
23808	FULL PRICE ON SOMETHING	1
23813	IT WOULD HAVE A	1
23814	ITS FOR HOME PRODUCTS	1
23815	EDIT WENT FROM STARS	1
23891	MONTHS THEN STARTS DROPPING	1
23890	THEFT HELP PHONE NUMBER	1
23889	WAS USED AND HAD	1
23888	SETUP AND OUTSTANDING RESULTS	1
23886	THE MONEY IF YOU	1
23884	MOVE UP A NOTCH	1
23883	BUT CANT REVIEW PROFORMANCE	1
23880	UP WHEN CALL FOR	1
23877	ITS AMAZING THAT NETGEAR	1
23875	ONLY CONNECTS ONE DEVICE	1
23871	ADVERTISED SO FAR BUT	1
23870	ANNOYING BECAUSE I'M CONSTANTLY	1
23866	BOUGHT ANOTHER BRAND AND	1
23863	USE YOUR CPU UNNECESSARILY	1
23862	DO YOU MAKE THIS	1
23894	WAS ABLE TO GET	1
23896	TO S7UDENTMAN REVIEW POSTED	1
23898	HELP TO SETTING NOT	1
23912	FEATURES I LIKE IN	1
23925	COMPANY MADE A SERVICE	1
23924	ACTUALLY A WIFI EXTENDER	1
23923	THE ROUTER I RECEVED	1
23921	INTERNET WOULD DROP CONSTANTLY	1
23915	GET MY MONEY BACK	1
23913	AT BEST SKETCHY WANTED	1
23910	V2 MODEL UNTIL YOU	1
23899	PURCHASING WHAT I THOUGHT	1
23908	IS USEFUL FOR ME	1
23907	FROM INTERNET DAILY I'VE	1
23903	FIRMWARE SOURS EXCELLENT HARDWARE	1
23902	OF FEATURES BUT CONNECTION	1
23901	TO SET UP FAILED	1
23900	GREAT DISTANCE ONLY LASTED	1
23861	CLOCK STILL DOESN'T WORK	1
23860	CHEAP N300 I BOUGHT	1
23859	R6300 WAS MORE STABLE	1
23829	NOT THAT GOOD I	1
23835	WORKS WELL WITH NETGEAR	1
23834	IN THE FIRST MONTH	1
23833	WIRELESS MODEL LINKSYS COMPARISON	1
23832	BUT CANT REACH INTERNET	1
23831	SAME PROBLEM AS EVERYONE	1
23830	OFF AUTOMATICALLY AND WON'T	1
23828	IT LOOKED TO GOOD	1
23837	BAD PROMOTION HUSTLE YOU	1
23826	THE INFERIOR R6700V2 NOT	1
23825	NOT SURE WHAT THIS	1
23824	WHEN IT WORKED DIED	1
23822	IN JUDGMENT POOR POOR	1
23819	THIS IS NO EXCEPTION	1
23817	RESTARTED SEVERAL TIMES A	1
23836	REFURBISHED THOUGHT IT WAS	1
23838	I FOUND THE SYSTEM	1
23858	OUR INTERNET COMPANY WAS	1
23850	A GOOD PRODUCT AND	1
23857	WORK WITH MY SYSTEM	1
23856	NETGEAR PRODUCT I EVER	1
23855	IS FINE FOR NETFLIX	1
23853	HAD GOOD NETGEAR PRODUCTS	1
23852	HAVE HAD TO MOVE	1
23851	STILL IS HERE I	1
23849	SUPPORT IS COMPLETELY USELESS	1
23839	TWO HOURS OF YOUR	1
23847	A ROUTER ANY PROBLEMS	1
23846	WAS EASY AND THE	1
23844	HAVE NOT BEEN THE	1
23843	SIGNAL CANNOT HANDLE A	1
23842	FRUSTRATING TO WASTE HOURS	1
23841	KEEPS LOSING THE SIGNAL	1
21533	YET IF YOU NEED	1
21532	ALLOW YOU TO CONNECT	1
21528	OK IT JUST TURNED	1
19236	IT NOT APT FOR	1
19259	WIRED ROUTER BUT NOT	1
19255	USELESS PIECE OF GARBAGE	1
19252	PRICEY FOR THE LIMITED	1
19251	MISTAKE NEEDED A DIRECT	1
19250	TO WORK FINALLY BROKE	1
19249	POOR PERFORMANCE AND BAD	1
19248	I AM TALKING MINUTES	1
19247	NETGEAR'S SUPPORT WAS APPALLING	1
19246	BUT IT MAY WORK	1
19245	ROUTER FOR TWO MONTHS	1
19244	OF IPV6 FIREWALL LEAVES	1
19243	IT'S FUNNY BECAUSE I	1
19242	WEBSITE BLOCKING IS USELESS	1
19241	CALLED BACK AND HAD	1
19238	BEWARE THIS IS NOT	1
19260	ON THE SECOND DAY	1
19262	TO FOUR TIME SLOWER	1
19263	MAC DRIVER IS IN	1
19276	ITEM JUST OPENED ITEM	1
19290	BUT I EXPECTED TO	1
19288	AND GENIE PARENTAL CONTROL	1
19286	HARDWIRED IN AND IT	1
19283	RECEIVED DEFECTIVE ROUTER FROM	1
19280	I LOVED THE SPEED	1
19278	REALLY NEED A ROUTER	1
19275	NOT PURCHASE ANOTHER NETGEAR	1
19264	FOR THE MOST BASIC	1
19274	SHOULD HAVE PAID MORE	1
19273	A ROUTER THIS EXPENSIVE	1
19272	ELECTRONICS IN THE HOUSE	1
19271	UPGRADED FROM NETGEAR R6300	1
19269	NEW ROUTER THE ONE	1
19265	NETGEAR N150 POWER ADAPTER	1
19237	NOT HAVE ASSUMED MY	1
19235	DISAPPOINTMENT WITH NETGEAR TECH	1
19294	NOT WORTH THE TIME	1
19234	FIRMWARE UPDATE TECH SUPPORT	1
19207	WORSE I HAVE A	1
19204	RELIABILITY POOR CUSTOMER SERVICE	1
19201	WAN AND WIFI ISSUES	1
19198	AS I READ IT	1
19194	THE NETGEAR WEB SITE	1
19192	10 DRIVERS ARE FAULTY	1
19189	RECOMMEND AGAINST THE ITEM	1
19188	AWAY FROM NETGEAR DUE	1
19187	30 ROUTER WITH THIS	1
19186	X4S DEVICE SILENT REBOOTS	1
19185	VERY INCONSISTENT INTERNET SPEEDS	1
19183	IT GETS YOU ON	1
19182	ARBITRARY CODE EXECUTION SECURITY	1
19181	THIS ALMOST EXACTLY ONE	1
19180	RUNS GOOD FOR 3/4	1
19208	VIRTUALLY UNUSABLE FOR WIRELESS	1
19209	BEEN HAVING CONNECTIVITY ISSUES	1
19214	SIGNAL EVERY HOUR AND	1
19225	ZERO DAY SECURITY FLAW	1
19233	THAN LIST FORMAT OF	1
19231	ANGLE AS RECOMMENDED OH	1
19230	AM SO GLAD I	1
19229	ABSOLUTELY STAY AWAY TIME	1
19228	WORK TO WORTH THE	1
19227	NOT WINDOWS 10 COMPATIBLE	1
19224	HAD TO CALL NETGEAR	1
19216	TESTED LEAVES YOU WITH	1
19223	CONTACTED NETGEAR FOR ASSISTANCE	1
19222	SOMETHING BETTER BECAUSE THIS	1
19221	ABOUT TWO WEEKS STOPPED	1
19220	SITTING IN ANOTHER ROOM	1
19219	IS COOL AND EVERYTHING	1
19217	FAILED IN LESS THAN	1
19293	INSTRUCTIONS AND WARRANTY MISREPRESENTED	1
19295	THERE IS NO RESOURCE	1
19403	DOES NOT MEET EXPECTATION	1
19348	YOU HAVE A S***TY	1
19372	I BOUGHT IN ABOUT	1
19371	LIVE ON HIGH GROUND	1
19369	GREAT ROUTER ONCE YOU	1
19367	USB DRIVE FOR TIME	1
19366	YEAR THIS NETGEAR NIGHTHAWK	1
19364	A SECURITY UPDATE FROM	1
19363	EXPERIENCE AS FAULTY AS	1
19361	ROUTER BUT NOT SO	1
19360	CERTAIN SITES FOR NO	1
19356	PACKET LOSS GOES FROM	1
19354	IS TERRIBLE I STAND	1
19353	WORKS WELL BUT REQUIRES	1
19352	ROUTER POOR TECHNICAL SUPPORT	1
19351	AND I REALIZED HOW	1
19350	MAY BE GREAT IF	1
19374	WINDOWS 10 AND WOULD	1
19377	LOOKS MONSTROUSLY GREAT SOFTWARE	1
19379	NO CUSTOMER SUPPORT DON'T	1
19391	NETGEAR MANUAL DIRECTS CUSTOMERS	1
19401	RAN INTO PROBLEMS GETTING	1
19400	DID THE NETGEAR UPDATE	1
19398	AND I WANTED TO	1
19396	GOOD PRICE BUT WILL	1
19394	OK NO LONGER WORKS	1
19392	DO IN A PINCH	1
19390	IN A CLEAR SPOT	1
19380	SIDE ONES FLOP DOWN	1
19389	ROUTER IS VERY LOW	1
19388	UPDATE WHICH CAUSED MAJOR	1
19387	IS NOT USB 2.0	1
19385	THIS THING POOR ANTENNA	1
19383	REBOOT AND WORK FINE	1
19381	SWITCHED BACK TO THE	1
19349	THE DISC TO CONNECT	1
19345	FROM A YARD SALE	1
19296	TERRIBLE BARELY HAVE A	1
19344	WORK SO RETURNING BOTH	1
19314	DIFFERENCE IN MBPS I	1
19313	AND NETGEAR SUPPORT HAS	1
19312	LOVE MOST NETGEAR PRODUCTS	1
19311	SIGNAL DROPS ALL THE	1
19310	NOT SURE WHY EVERYONE	1
19309	CONNECTIONS...FOR A 200 ROUTER	1
19308	AND GREATEST WHEN YOU	1
19307	WORTH THE PRICE AND	1
19305	BUT IT HAS BIG	1
19304	LACKING WEB UI ITS	1
19303	IS NO DISC TO	1
19300	RANGE IS JUST AS	1
19299	TO REQUIRE PERSONAL INFORMATION	1
19298	MY LAPTOP WOULD RANDOMLY	1
19297	USE AS REPEATER SHAME	1
19315	PRODUCT WAS GARBAGE ETHERNET	1
19316	WIFI SYSTEM CALLED NETGEAR	1
19320	STRONGER SIGNAL IN MY	1
19330	GOOGLE NEXUS GALAXY S8	1
19342	HAD IN THE PAST	1
19340	NOT THAT EASY TO	1
19339	SET UP INSTRUCIONS SUPPORT	1
19335	TRYING TO ESTABLISH CONNECTIVITY	1
19334	TRYING TO INSTALL TO	1
19331	HERE I HAVE OVER	1
19329	LOAD AND I RECEIVED	1
19322	NOW IT IS WORKING	1
19328	GREAT COVERAGE WON'T RECOMMEND	1
19327	YOU ARE A HEAVY	1
19326	RUN DON'T WALK AWAY	1
19325	DUE TO LACK OF	1
19324	THE HOUSE AND PATTIO	1
19323	GOOD PRETTY FASTER SPEED	1
19178	WAS LISTED AS IN	1
19177	FREE SERICE HAS RUN	1
19175	YARD SALE BUT IT	1
19009	DIDN'T WORK GOING BACK	1
19033	IS THE RANGE SUCKS	1
19032	OK TOO MUCH PROPRIETARY	1
19031	YEAR THEN WHEN IT	1
19030	EXTENDER NOT A ROUTER	1
19029	BUT I WAS UNSUCCESSFUL	1
19027	MORE REAL WORLD TESTING	1
19026	WORKED VERY WELL WHILE	1
19022	HAS REALLY GOOD RANGE	1
19021	I WANTED TO REPLACE	1
19019	BEST THING YOU CAN	1
19018	BUT DIDNT IMPROVE OVER	1
19017	MY PATHETIC TIME WARNER	1
19016	HOME SHARING DIDN'T WORK	1
19014	ABSOLUTELY TERRIBLE DISCONNECTED CONTINUOUSLY	1
19012	DIES AFTER 33 DAYS	1
19036	THIS ROUTER HAS BEEN	1
19039	BEWARE HORRIBLE FIRMWARE WITHOUT	1
19040	SET UP WITH NO	1
19057	CABLE INTERNET COMPANY MADE	1
19064	AT LEAST AN AC1200	1
19063	USE OUT OF THIS	1
19062	TRANSFER SPEEDS WERE AWESOME	1
19061	NIGHTHAWK X6 I TRIED	1
19059	BE A LEGITIMATE NEW	1
19058	BETTER OUR CABLE-BASED INTERNET	1
19056	MAC COMPATIBLE NOR VIRTUALBOX	1
19041	NETGEAR AGREED TO SEND	1
19053	SPEAK ENGLISH AS A	1
19051	NETGEAR CUSTOMER SERVICE WAS	1
19050	YET COULD NOT BE	1
19049	WORKED GREAT FOR 60	1
19046	WIRED CONNECTIONS FAIL REGULARLY	1
19044	SLOW UNTIL YOU EXPERIENCE	1
19010	A WEEK THEN CONSTANT	1
19007	USE THIS WITH YOUR	1
19174	ADMIN PAGE IF YOU	1
19006	WITH CONNECTIONS THROUGHOUT MY	1
18981	I ACTUALLY LIKE THIS	1
18980	BUT IT'S NOT THE	1
18978	WEAK SOFTWARE AND LIMITED	1
18977	APPEARED FINE BUT IT	1
18976	ROUTERS ARE NOT SLOWED	1
18975	OTHER EQUIPMENT I'VE SEEN	1
18974	THIS THING IS FAST	1
18973	THIS IS THE LATEST	1
18972	GREAT TWICE IT DIDN'T	1
18971	WAIT FOR A FIRMWARE	1
18968	THE WIRELESS RELIABILITY THROUGHOUT	1
18967	NOT SURE WHAT'S GOING	1
18966	WAS BAD HAVE YET	1
18965	I'M NO TECH IDIOT	1
18964	WILL NOT GET WHAT	1
18982	TO HELP ME INSTALL	1
18983	IT WAS BETTER BUT	1
18984	SETTINGS CHANGES ABOVE AND	1
18997	SUPPORT OR LACK THERE	1
19005	JUST WANT TO TAKE	1
19004	THIS ROUTER MONTHS AND	1
19002	BEWARE OF MANUFACTURE'S POLICY	1
19000	BETTER PRODUCTS THAT COST	1
18999	NOT HAVE NEARLY ENOUGH	1
18998	GOOD DAYS AND BAD	1
18996	THAT I HATE THE	1
18985	USER INTERFACE IS GOOD	1
18994	GARBAGE I HAD TO	1
18993	LOSS GOES FROM TO	1
18992	REPLACED ONCE IT WORKED	1
18990	NOT JUST VERY ANNOYING	1
18989	JUST NOT QUITE AS	1
18986	IMPROVEMENTS IN WIFI SIGNAL	1
19065	THAT WHAT CAME WITH	1
19066	IS SLOW AND UNSTABLE	1
19068	LOOKED TO GOOD TO	1
19070	SIGNAL LIKE NO OTHER	1
19140	DECENT ROUTER BE WARY	1
19138	I'VE TRIED ALL SORTS	1
19137	HOURS OF TECH SUPPORT	1
19136	DON'T ALSO HAVE A	1
19131	REALLY REALLY WANTED TO	1
19130	WORK WITH EPB FIBER	1
19129	OVERHEATS AND SHUTS DOWN	1
19128	MACHINES RETURNED FOR REFUND	1
19127	TECHNOLOGY I'VE EVER PURCHASED	1
19126	NICE CHIPSET LAME STOCK	1
19124	MODEM BUT MAY NOT	1
19121	AND IT'S DEAD AS	1
19120	NETGEAR'S SUPPORT WAS USELESS	1
19119	SWITCH AND UNPLUG IT	1
19118	RETURN THIS ONE LIKE	1
19141	PROFORMANCE AS I HAVE	1
19147	RIGHT AS HENRY FORD	1
19148	THAT HAD VERY POOR	1
19163	WORKS BETTER THAN A	1
19173	IT'LL KEEP YOU DISCONNECTED	1
19169	NEED TO BE PRETTY	1
19168	NETGEAR ROUTERS ARE BAD	1
19166	WARY OF ORDERING THIS	1
19165	WORKS BUT DO NOT	1
19164	FEW DAYS AND WAS	1
19162	SET UP VERY FAULTY	1
19151	BUT VERY UNSTABLE AND	1
19161	PROCESS THAT KEEPS FAILING	1
19160	SIGNALS I NEED TO	1
19158	THEN IT JUST DIED	1
19154	BOUGHT AN ASUS 68U	1
19153	DISAPPEARS AND THERE IS	1
19152	BAD NEWS I JUST	1
19117	GREAT POTENTIAL BUT STABILITY	1
19116	IT WON'T FUNCTION SO	1
19115	AMAZON WIFI ADAPTER WITH	1
19083	ADVENTURE BUT IT WORKS	1
19091	THAN THEY STATED AT	1
19090	GET THE PLEX APP	1
19089	BUT THE SINCE I	1
19088	JUST FINE GUESS I	1
19086	WORK KEEPS DROPPING THE	1
19084	LASTED LESS THEN YEAR	1
19082	VIA WEP NOT WPA	1
19094	DISTANCE ONLY LASTED A	1
19079	NEED TECH SUPPORT YOU	1
19078	USED LATEST DOWNLOADED FIRMWARE	1
19075	NOT PURCHASED THIS PRODUCT	1
19073	DROPS SIGNAL LIKE NO	1
19072	HAVE THIS ROUTER FOR	1
19071	MY TRUSTY OLD WRT54G	1
19092	BUY THIS PRODUCT READ	1
19095	NOT HONOR YEAR HARDWARE	1
19114	PERFORMANCE QUALITY AND RELIABILITY	1
19106	HOME BUT WIFI SPEED	1
19113	CONNECT WITH MY CABLE	1
19112	FINE UNTIL TODAY I	1
19111	BAND RANGE EXTENDER INSTEAD	1
19110	USB AND DLNA BROKEN	1
19108	THEM ALL DIED IN	1
19107	TO MANUALLY GO TO	1
19105	AND PUSHY UPSELL SUPPORT	1
19096	NO MANUFACTURER WARRENTY OR	1
19104	OF THERE'S SEEMS TO	1
19103	I DO NOT LIKE	1
19102	WIFI CONNECTION DON'T BOTHER	1
19101	REAL QOS MANAGEMENT TOOLS	1
19100	WERE SUCCESSFUL WITH THE	1
19099	MIRACULOUSLY PULL IN WEAK	1
19402	ROOMS TO SWITCH NETWORKS	1
19404	BUT THEY DROP EVERY	1
18961	HORRIBLE PRODUCT AWFUL SUPPORT	1
19669	DISAPPOINTMENT FOLLOWED THE DIRECTIONS	1
19689	IT WORKS JUST NOT	1
19686	SENT ME A PIECE	1
19685	SUCKS AVOID AT ALL	1
19684	EXTENDED WIFI CONNECTIONS ARE	1
19683	FROM MAIN WIRELESS THAT	1
19682	NOT AN ACCES POINT	1
19680	AND CELLPHONES DO AS	1
19678	OF 1/2014 NOT STABLE	1
19677	LEAST ONCE A DAY	1
19676	OR MAY NOT WORK	1
19675	ONLY INCONSISTENT THING IS	1
19674	AT THE SAME TIME	1
19673	HOOK UP NOR DID	1
19672	PRODUCT IS WORKING FOR	1
19671	FAILED WITHIN A WEEK	1
19690	POWER STOPPED WORKING AT	1
19691	LOOK ELSEWHERE FOR SOMETHING	1
19692	ROUTERS MODEMS BEFORE BUT	1
19702	THROUGH ROUTER DO NOT	1
19714	SEEMS LESS RELIABLE THAN	1
19712	LIKE THAT SURPRISED THIS	1
19711	ONE OF MY WIN8.1	1
19710	3RD PARTY SUPPORT THAT	1
19705	BE FOOLED BY THE	1
19704	DEPENDENT ON NETGEAR FOR	1
19701	OF THE TWO BANDS	1
19693	DESPITE ALL IT'S QUALITIES	1
19700	AND VOILA THE INTERNET	1
19699	IS SUPPOSED TO PROVIDE	1
19698	PARENTAL CONTROLS NEED DRASTIC	1
19697	FREQUENT DROPS IN INTERNET	1
19696	UNDER CONNECTION IN WINDOWS	1
19695	JUST WAS WANTING A	1
19670	IT HAS BEEN PERFECT	1
19668	WATCH MOVIES AND VIDEOS	1
19717	MY ENERGY AND TIME	1
19665	AND RE-CONNECTS EVERY TWO	1
19636	PATIENCE IS A VIRTUE	1
19635	GREAT NOW NETGEAR WON'T	1
19634	BUY UNTIL THEY RESOLVE	1
19633	HAS PROBLEMS HOLDING A	1
19629	SURE IF IT IS	1
19628	THEY WORK GREAT I	1
19626	NOT STAY CONNECTED TO	1
19625	SUPPORT AT NETGEAR AND	1
19624	THIS ROUTER CONNECTION RANGE	1
19623	INTERMITTENT USB CONNECTIVITY ISSUES	1
19622	WORKING AFTER JUST A	1
19620	ALL SORTS OF DIFFERENT	1
19619	REMOTE ARBITRARY CODE EXECUTION	1
19618	WILL ACTUALLY ISNTALL AND	1
19617	WORK PRETTY WELL THE	1
19637	THING POOR ANTENNA RECEPTION	1
19639	UP IT'S GREAT OTHER	1
19640	A FEW MONTHS IT	1
19654	BUY AGAIN UNLESS PROBLEM	1
19664	ENOUGH TO CONFIGURE BUT	1
19663	AS FAR AWAY AS	1
19661	EASILY AND WORKED GOOD	1
19657	REFURBISHED NOT WORTH THE	1
19656	FROM A REFURBER OR	1
19655	IN A SECOND ACCESS	1
19653	BASIC ONE I HAD	1
19642	WONDERFUL FOR LAN SUPPORTED	1
19649	STOPS CONNECTING TO THE	1
19648	STARS TO SLIGHTLY STRONGER	1
19647	BAD I RETURNED IT	1
19646	FIND A WIRELESS PRINTER	1
19644	TIMES A DAY IN	1
19643	OK BAD SOFTWARE AND	1
19716	OUR WIFI RANGE NETGEAR	1
19718	WITHOUT IT EVERYTHING IS	1
19406	DROPS CONNECTION EVERY 20	1
19773	THIS MIGHT HAVE TO	1
19800	SET UP EASILY AND	1
19798	NEGATIVE STARS OF THE	1
19795	WAS A DIRECT REPLACEMENT	1
19794	GOT IT BY SOMEONE	1
19791	THIS WORKING WITH OUR	1
19790	UNLESS MY DEVICE IS	1
19789	I TRY STREAMING A	1
19788	BETTER RESULTS THAT I	1
19786	WIRED ROUTER WIRELESS NOT	1
19785	SECOND FLOOR NOT SO	1
19784	OF GARBAGE DOES NOT	1
19783	AND OUT CONSTANTLY SPEED	1
19780	CONNECT WITH DIR-825 ROUTER	1
19778	HOUSE AND MY SMART	1
19777	CHECK TO BE SURE	1
19801	DID EXTENSIVE TROUBLESHOOTING IN	1
19802	SUPPORT FOR APPLE TIME	1
19803	OUT HOW TO SET	1
19817	IT BUT BAD BAD	1
19825	SOME DAYS AND DIED	1
19824	CONSTANTLY STOPS CONNECTING AND	1
19821	BUT SPENDING MORE COULD	1
19820	NEXT STEP IS TO	1
19819	ROUTER SO LONG AS	1
19818	GEAR SUPPORT IS THE	1
19816	BE GOOD MAYBE DONT	1
19804	BUYER BEWARE IF YOU'RE	1
19814	FORUMS FOR DISCONNECT ISSUE	1
19812	LOOKING FOR PERFORMANCE QUALITY	1
19811	OF HARD TO SET	1
19810	FOR HEAVY USERS GAMERS	1
19809	PREVIOUS ASUS N66 ROUTER	1
19807	FOR 1/4 HOURS LISTENING	1
19776	MY LAPTOP BUT NOT	1
19772	SERVICE CONTRACTS WITHIN 90	1
19719	TO SPEND SOME EXTRA	1
19769	UP TO THE MARK	1
19739	MUST BE MISSING A	1
19738	THAT ONE IS JUST	1
19737	NETGEAR DUAL BAND WI-FI	1
19736	AM EXTREMELY HAPPY WITH	1
19735	FILTER WIRED HAS WELL	1
19734	GOOD CHOICE IF RUNNING	1
19733	HORRIBLE NOT A STRONG	1
19732	ROUTER CRAPPY RETURN POLICY	1
19730	AND LONGER RANGE.....UNFORTUNATELY DROPS	1
19729	AND UNABLE TO RETURN	1
19728	WILL STEER CLEAR OF	1
19724	YEAR LATER AND IT	1
19723	DON'T SPEAK ENGLISH AS	1
19722	USELESS ROUTER WITH USELESS	1
19720	THE APPLE AIRPORT INSTEAD	1
19741	WILL BE THE LATEST	1
19745	AMAZON EASY RETURN POLICY	1
19746	DEVICES LOSE INTERNET CONNECTION	1
19760	WITH THE NETGEAR CUSTOMER	1
19767	TO THE INITIAL POSTING	1
19766	THOSE LOOKING TO USE	1
19764	X10 AD7200 WHICH I	1
19763	DROPS SIGNAL AND THE	1
19762	LOCAL DNS IS MISSING	1
19761	COMPATIBLE WITH ALARM NETWORK(S	1
19758	DO ON MY OLD	1
19749	USB STORAGE OR PRINTER	1
19756	SAVE 150 BUY AN	1
19755	FIRMWARE ISSUES THE 5GHZ	1
19754	OF A PREVIOUSLY OWNED	1
19753	BUT IT WON'T TRAVEL	1
19751	OFFERS GREAT PERFORMANCE FOR	1
19750	SLOWS DOWN SIGNIFICANTLY EVERY	1
19616	DURING THE MONTH OF	1
19614	THE HARD DRIVE AND	1
19611	WITH A WIRELESS CONNECTION	1
19457	CONNECTIVITY ISSUES WITH THE	1
19486	USELESS CD INSTALLATION DISKS	1
19485	AND FAST DROPS CONNECTION	1
19484	FOR JUST OVER A	1
19480	ROUTER IS PAST ITS	1
19474	A 16X80 MOBILE HOME	1
19472	TO HELP WITH THEIR	1
19471	IT GOT GOOD REVIEWS	1
19470	WE HAD IT FOR	1
19469	RESTART IT EVERY MORNING	1
19466	EXTEND MY SERVICE BUT	1
19465	I COULD I WOULD	1
19463	EXTENDERS RARELY WORK AND	1
19462	AS A NORMAL CONSUMER	1
19461	TO LOAD AND I	1
19459	QOS SOFTWARE AND FREQUENT	1
19488	WORK I'M STUCK WITH	1
19491	THE MONEY OUT THERE	1
19492	SECURITY EXPERTS ON DEC	1
19504	WHAT THIS GIZMO IS	1
19510	NOT FOR ANDROID PHONE(TESTED	1
19509	LINKSYS USB ADAPTER OF	1
19508	UNHAPPY WITH THIS ITEM	1
19507	AM VERY DECEPTIVE ABOUT	1
19506	THE WORST PART ABOUT	1
19505	YOUR SATELLITES USELESS CUSTOMER	1
19503	I NEVER USED IT	1
19493	WORKS FAIRLY WELL SLOWS	1
19502	GREAT DEVICE UNTIL THEY	1
19500	IN PRICE BUT NOISE	1
19499	MONTHS TECH SUPPORT AND	1
19497	WON'T WORK WITH MAC	1
19496	THE INTERNET BUT NOT	1
19494	THIS ROUTER AND ALL	1
19458	FOR THAT ROUTER IS	1
19456	ON REPLACING IT QUICKLY	1
19609	CONSTANT DROPPING OF INTERNET	1
19455	SOFTWARE GLITCH WILL SHUT	1
19433	FUNCIONA IT DOES NOT	1
19429	BIG WASTE OF MY	1
19428	MAKE SURE YOU ARE	1
19425	STAY AWAY-NETGEAR DOESNT KNOW	1
19424	NO NEED TO BUY	1
19420	IS GREAT BUT WE	1
19418	2016 AND NOW MY	1
19417	WITH ISSUES TO A	1
19416	ROUTER ALONE IS OFTEN	1
19415	MUCH TIME TRYING TO	1
19414	TO FIGURE IT OUT	1
19413	THE PRICE BUT CERTAINLY	1
19412	FINE I WAS HOPING	1
19409	IT IS WORTHLESS SPEED	1
19407	SERIAL NUMBER CANT REGISTER	1
19435	RECOMMEND HOLDING PURCHASE UNTIL	1
19436	I LIVE OVERSEAS IT'S	1
19437	I GOT IT BY	1
19447	COULD NOT BE FIXED	1
19454	FOR ME I HAD	1
19453	RANGE NOT HOT DROPPED	1
19451	BUT A GOOD DEVICE	1
19450	TO CONNECT THIS LOUSEY	1
19449	WAS CLEAR AND FRIENDLY	1
19448	WORKS JUST NOT IMPROVING	1
19446	BETTER THAN FIRST ROUTER	1
19438	USB DRIVE FUNCTIONALITY NEEDS	1
19445	IOS DEVICES DO NOT	1
19444	IS PRETTY DAMN GOOD	1
19443	WILL WORK BETTER THAN	1
19442	HARD DRIVE FUNCTIONALITY FROM	1
19441	WIRELESS WAS DROPPING OUT	1
19440	BOUGHT IT IN JANUARY	1
19511	DONT MEET MY EXPECTATION	1
19512	TO HAVE A TECH	1
19514	AC TO HELP BETTER	1
19517	AS TO BE UNUSABLE	1
19587	LITTLE BETTER THAN OLD	1
19585	BACK OF HOUSE AND	1
19584	HASSLE-FREE WIFI BUY SOMETHING	1
19583	THE USER INTERFACE IS	1
19582	FOR A FEW YEARS	1
19581	ROUTER THAT MIGHT HAVE	1
19580	MANY OPTIONS JUST DON'T	1
19579	BOTH ONLY LASTED YEAR	1
19578	A COUPLE MINUTES THEN	1
19577	ON HIGH GROUND BUT	1
19576	BY SOMEONE SAYING THIS	1
19575	YOU PAY FOR IT	1
19574	THAT DO NOT SPEAK	1
19570	CONNECT TO INTERNET BUT	1
19569	I WAS SURPRISED THAT	1
19588	WORKED WELL BUT HAD	1
19589	THIS PRODUCT BEFORE BUYING	1
19590	BECAUSE IT WAS SO	1
19600	CONSIDERING TO GET EXCHANGE	1
19608	TO GET ANOTHER MODEL	1
19607	WILL NOT KEEP A	1
19606	QUITE A FEW SOFTWARE	1
19604	WELL FOR THE WIFI	1
19602	IT IT WAS USED	1
19601	FINE FOR THOSE SPEEDS	1
19599	HOUSE WALLS OR THE	1
19591	TERRIBLE FIRST IT WOULD	1
19598	LOOK LIKE A NEW	1
19596	BUT THAT IS NOT	1
19595	EVERYONE WAS GIVING THIS	1
19594	SIGNAL TERRIBLE INTERFACE AND	1
19593	VERY FAST NO INSTRUCTIONS	1
19592	NETGEAR DOES NOT STAND	1
19568	IF I WERE YOU	1
19564	A SECOND TIER SUPPLIER	1
19563	WORKS FINE IF YOU	1
19529	DUAL BAND USB WI-FI	1
19536	THE SIGNAL A WHOLE	1
19535	WHEN IT WORKS FORGET	1
19534	WITHOUT CUSTOMER SUPPORT THEN	1
19533	SIGNAL AND IT WAS	1
19532	APPLE EASE OF USE	1
19530	MAC USER READY<ANYTHING FEATURE	1
19528	COULD NOT KEEP INTERNET	1
19539	KEEP CAUSING BLUE SCREEN	1
19527	I GAVE UP AND	1
19526	TO MY SMART TV	1
19523	WORK CUSTOMER SUPPORT IS	1
19522	AND DISTANCE BECAUSE I	1
19520	IS NOT SHOWN N300	1
19519	INTERLACED MONITOR PAINTING EVERY	1
19537	TO INSTALL THE INSTRUCTIONS	1
19540	BOUGHT AC TO HELP	1
19562	EXTENDER NOT A REPEATER	1
19552	ANDROID PHONE(TESTED WITH GOOGLE	1
19561	NO WI FI ON/OFF	1
19560	RANGE ISSUES RETURNING TOMORROW	1
19559	APP TO MY PHONE	1
19557	MBPS ON A 50	1
19556	ROUTER I'VE EVER OWNED	1
19555	FINE IT GETS YOU	1
19550	THE ONE I BOUGHT	1
19542	KEEPS CUTTING OFF EVERYTIME	1
19549	ITEM THAT DOES NOT	1
19548	THEY WERE EXCELLENT ABOUT	1
19547	LASTED BUT NOT LONG	1
