	name	count
14161	WAS EASY GIVEN THE	2
23930	CONSTANTLY HAVE TO RESTART	2
15399	BUT V2 ISN'T COMPATIBLE	2
14165	YOU HAVE A HIGH	2
23935	AND NOT WORKING LIKE	2
14166	TECH SUPPORT AS I	2
1614	WISH IT WAS BETTER	2
1631	DON'T BUY STARTS DYING	2
15391	WORKING AFTER THREE MONTHS	2
1616	COUNT ON THE WARRANTY	2
23950	IN MY ZONE HOME	2
23942	A BAD PRODUCT AT	2
23944	YOU WANT IT OR	2
14176	MANY HAVING THAT ISSUE.....BE	2
23917	AS STRONG AS NETGEAR	2
1609	BEEN DELIVERED WITH AN	2
1608	IT KEEPS LOSING SIGNAL	2
14147	OTHER REVIEWERS SHORT LIFE	2
1683	NEW ROUTER I RECEIVED	2
1601	IT WOULD WORK IN	2
15385	CONTINUOUSLY REBOOTS WITH NO	2
1681	SOMEONE WITH TIME TO	2
23897	WITH PRODUCT AND COMPANY	2
14143	MY 10YR OLD ROUTER	2
14144	IS GREAT WHILE IT	2
23960	SEVERAL REASONS I'D BUY	2
23959	DON'T LAST LONGER THAN	2
1671	PARENTAL CONTROL ISSUES BEWARE	2
1657	POOR QUALITY AND NO	2
23905	HAS BEEN EXCELLENT SO	2
23906	DROP OUT PRETTY FREQUENTLY	2
14148	ANYONE WHO NEEDS TO	2
23958	ABOUT 20 FEET OF	2
23909	IN MY HOUSE AND	2
14150	IT WORKS BUT MAYBE	2
23957	PRODUCT BUT ONE GLITCH	2
15406	AFTER YOU PASS THE	2
23916	NOT GET WNDR4300 2ND	2
15380	I WAS NOT HAPPY	2
1582	FIRMWARE WORTHLESS SUPPORT STAFF	2
15376	MUST SWITCH NETWORKS EACH	2
23978	LOSES CONNECTION TO CABLE	2
14076	FLAKY FOR ME MAYBE	2
23795	AND FAILS TO ASSIGN	2
1544	HAD TO SEND BACK	2
14214	QUALITY WAS A BIT	2
23797	OVERALL A PRETTY NICE	2
15361	NUMBER ON UNIT DROPPED	2
1547	BUT HAVING INTERMITTENT WIRELESS	2
1835	AND GET YOURSELF A	2
1834	REACH INTO TWO OTHER	2
1831	AC 1750 THE PERFORMANCE	2
15451	REFURBISHED AT THE PRICE	2
1827	AFTER A MONTH OF	2
23804	FAULTY AND NOT WORKING	2
1822	TIME TRYING TO CONFIGURE	2
23998	SEVERAL TIMES AND WOULD	2
1818	A COUPLE OF TIMES	2
14085	ABLE TO GET ANY	2
1551	OLD NET GEAR THAT	2
1816	PERSONALLY LIKE HOW THIS	2
23810	HUNG OUT TO DRY	2
1813	NOT FOR THE NON-TECHNICAL	2
14074	AN AUTHORIZED DEALER AND	2
14215	SO NICE ROUTER!...BUT READYSHARE...DOES	2
24003	BROKEN OUT OF BOX	2
14219	TO BE A SCAM	2
1873	GREAT ROUTER FOR ABOUT	2
15358	CALLED TECH SUPPORT AS	2
1533	YEAR...WISHED I'D BOUGHT A	2
23773	ANNOYING FOR THE PRICE	2
1869	GREAT BUT DOC AND	2
15463	IT LASTS BUT WON'T	2
1863	WAS EASY ENOUGH I'VE	2
1861	HAD A DIFFICULT TIME	2
14066	NEEDS BETTER QA COMING	2
1535	THE PRICE TAG IS	2
23789	LOOKS GREAT PERFORMANCE DEPENDS	2
23782	NEVER WORKED AS ADVERTISED	2
1536	THAT WORKS 99 OF	2
14069	GOOD BUT CANT HANDLE	2
1854	RANGE LEAVES SOMETHING TO	2
23784	THIRD-PARTY SELLER IS NOT	2
1852	MAY JUST BE MY	2
1537	V1.0.2.46_1.0.97 STILL IMMATURE LOTS	2
14218	RESPONSE IN MONTHS-HORRIBLE EXPERIENCE-DONT	2
14216	CAREFUL DOES NOT SUPPORT	2
23811	IMPROVE FROM WHAT I	2
23812	DEALER AND THEY WILL	2
1809	AND WORKED FINE FOR	2
23983	MODE EVERY TIME I	2
15438	I BELIEVE IT DOES	2
15437	AT THE PRICE OF	2
1774	MY RETURN PERIOD COMPLETE	2
15371	DID YOU TURN IT	2
1771	NOT ALLOW YOU THE	2
15372	ISSUES WITH BETTER SIGNAL	2
1768	THING PROBABLY WILL WORK	2
23840	MY COMPUTER NETGEAR IS	2
1765	I'VE ALWAYS HAD THE	2
14197	AND OFTEN ONLY ONE	2
1779	MONTH AND I NEEDED	2
14196	WAY TO RECONNECT IS	2
1760	GAMBLE WITH NETGEAR HARDWARE	2
23848	DROPS AND RECONNECTS MY	2
1573	IT MIGHT BE GOOD	2
1756	NETGEAR HAS EVER RELEASED	2
14113	SOFTWARE NOT SO MUCH	2
23979	SO I CALLED NETGEAR	2
1753	I DO NOT RECOMMENDED	2
14115	NETGEAR PROVIDES ZERO SUPPORT	2
14099	IT PERFORMS POORLY FOR	2
1780	I MUST HAVE RECEIVED	2
15447	PARENTAL CONTROL IS REALLY	2
1557	FULL USB DEVICE SUPPORT	2
23816	FINE TRIED CHANGING CABLES	2
15445	WELL BUT WONT PROJECT	2
23818	DOESN'T WORK AND TECH	2
1802	WITHIN A FEW MONTHS	2
1555	SERIOUS ISSUES ON THE	2
23820	IS MUCH MORE STABLE	2
14208	RELIABILITY NONEXISTENT TECHNICAL SUPPORT	2
1799	I CAN'T LOG IN	2
1798	RESEARCHED THIS ROUTER PRIOR	2
23821	REALLY WELL CUSTOMER SERVICE	2
14205	OFF AND ON AGAIN	2
23823	TO CONFIGURE BOTH TIMES	2
14092	AND MONEY ON THIS	2
1793	PURCHASING FROM THEM AGAIN	2
1790	IF THERE IS A	2
1788	HARDWARE FAILURE AND LACK	2
23827	VERY HARD TO GET	2
1785	SUPPORT FOR 149 DON'T	2
14096	JUNK WON'T WORK NETGEAR	2
15439	FIRMWARE IS USUALLY VERY	2
2120	FINE AND TO GO	2
24101	COMPATIBLE WITH DD-WRT OR	2
15544	TO BE ABLE TO	2
2420	SPEED BUT NOT SURE	2
2453	YOU A YEAR SUPPORT	2
14340	WORK ON MY MAC	2
23373	FRUSTRATION SET-UP DOESN'T WORK	2
2447	USED VERSION ON AMAZON	2
24188	POORLY MADE IN CHINA	2
1269	HORRIBLE SIGNAL CONSTANT DISCONNECT	2
1270	ROBUST WIRELESS ACCESS POINT	2
24183	GREAT AT FIRST BUT	2
23380	SAME MISTAKE AS I	2
1276	THAN A WEEK GOING	2
23383	BAD ROUTER DO NOT	2
14332	SUPPORT WAS GOOD BUT	2
23384	THIS THING CONNECTED CUSTOMER	2
1278	NO REAL CUSTOMER SUPPORT	2
23386	BUY A NEW POWER	2
15640	I SUSPECT THE FREQUENCY	2
2431	VERY WELL AFTER SETTING	2
15639	A CHANCE AND LOST	2
15288	WHAT A WONDERFUL DEVICE	2
15635	NOW BUYING A DIFFERENT	2
15634	WI-FI IS A CONCERN	2
1262	HAVING INTERMITTENT WIRELESS CONNECTION	2
13789	PRETTY GOOD SIGNAL CAN'T	2
2457	DROPS CONNECTION AND HORRIBLE	2
1252	GOOD BIT IN THE	2
15658	IS NOW WORSE THAN	2
2475	SHOPPING FOR A NEW	2
13776	SLOW INTERNET SPEED ISSUES	2
13777	NOT WHAT NETGEAR USED	2
23356	NEED NETGEAR CUSTOMER SERVICE	2
13778	I GOT FOR MY	2
13779	WAS TOLD THE PRODUCT	2
23359	A SERIOUS SECURITY FLAW	2
23360	I OFTEN HAD TO	2
1253	TO WORK AT FIRST	2
2458	DROP SIGNALS CONSTANTLY NOW	2
24196	BE UP FRONT WITH	2
1256	GREAT WHILE IT LASTS	2
14342	ALL THE REVIEWS WARN	2
15654	RETURNED DIDN'T WORK AND	2
15653	NOT AWRSOME FOR WHAT	2
15278	DRECK SMELLS BETTER THAN	2
15651	SPEED OF MY YEAR	2
24192	WASTE YOUR HARD EARNED	2
15650	HELPS BUT NOT AWRSOME	2
23395	COULD NEVER GET THE	2
23397	NETGEAR ROUTER THAT DOESN'T	2
14285	CONSUMER WI-FI...BUT REALLY EXPENSIVE	2
23399	BUT THEN IT DOESN'T	2
13822	STOPPED WORKING JUST AFTER	2
13823	BEWARE PRODUCT IS GREAT	2
13824	TERRIBLE WASTE OF MONEY	2
23423	UNDEPENDABLE GOOD LOOKING POS	2
23424	A ROUTER NON-WIFI WITH	2
2382	IN MY HOUSE I	2
1300	IT WORKS FINE TRIED	2
2378	ARE FRUSTRATED FROM EXTREMELY	2
15622	DONT APPLY FIRMWARE UPGRADES	2
14321	PASS THE HELL OF	2
2375	CONNECTIONS SEEM TO DROP	2
15620	SUPPORT WASTE OF MONEY	2
2373	AND POOR TECH SUPPORT	2
13831	NOT HAVE BEEN RELEASED	2
24164	DUE TO RESTRICTED NAT	2
2365	PERFORMANCE DEPENDS ON YOUR	2
2364	IS GOOD FOR A	2
23437	OF POSSIBLE INTERNET SPEED	2
1304	A FEW MONTHS VERY	2
15615	PREPARED TO PAY 159	2
2357	AND THE THROUGHPUT IS	2
24168	SERVICE IS REALLY BAD	2
2392	RESEARCH RESEARCH RESEARCH BEFORE	2
2393	FOR ME BE CAFEFUL	2
24170	SLOWLY FAILING AND REQUIRING	2
2415	UP TO MANUFACTURER'S HYPE	2
15289	WITH A LOT OF	2
23400	ROUTER HAS A FIREWALL	2
1287	THAN MY NET GEAR	2
15633	TO USE THE AUTO	2
14326	INTERFACE AND USER APPLICATIONS	2
14325	THAN MONTHS-OPENED CASE NO	2
15632	BUT NOT AWRSOME FOR	2
24172	LOTS OF PERFORMANCE AND	2
23405	COULD NOT GET STEADY	2
13818	SET UP AND SERVICE	2
23407	WORKS WELL WHEN WORKING	2
2403	SOMETHING ELSE SAVE YOURSELF	2
13813	CUTS IN AND OUT	2
15629	PROBLEM WITH THIS MODEL	2
2399	DAYS OUT OF MY	2
24169	PORT 21 SAMBA SERVER	2
15627	BAD ROUTER FROM THE	2
23413	WITH FLAGSHIP NETGEAR X4	2
13817	GET A COAX BOX	2
24200	BUT WONT PROJECT SIGNAL	2
23351	FOR A WHILE WITH	2
15274	RETURN FOR A FULL	2
2480	PROBLEMS UPON PROBLEMS IT'S	2
23285	TO DRY WITHOUT SUPPORT	2
23286	MESSAGE FOR WINDOWS POINTED	2
24227	JUST LIKE THE ROUTER	2
2568	ON MULTI-LEVEL HOUSE THEN	2
13729	IN DISAPPOINTMENT BUT PRODUCT	2
13731	SOME EFFORT BUT IT	2
15266	WAS FINE UP UNTIL	2
24223	A COAX BOX NOT	2
15683	I RECOMMEND NOT BUYING	2
23294	HAPPY CUSTOMER MUCH BETTER	2
2560	WORRIED WHEN YOU BUY	2
13735	ROUTER WORK BETTER THEN	2
24222	WORK THE BUGS OUT	2
13737	REVIEW FOR THIS PRODUCT	2
23299	GREAT EXCEPT ONE CHANNEL	2
2550	WIRELESS ACCESS POINT BELOW	2
23301	MY SMARTPHONE RANGE IN	2
23305	SUPPORT AND REFUSED TO	2
2542	COMPLETELY DISAPPOINTING MONTHS LATER	2
1219	OF THE BOX FOR	2
1221	SEVERAL CHAT SESSIONS WITH	2
15264	IN A GOOD LOCATION	2
2574	BUT I WOULD NOT	2
23283	VS D-LINK AC3200 VS	2
23275	TO CONNECT TO MY	2
23267	BOUGHT THE ROUTER FOR	2
23268	AT FIRST WAITING ON	2
23269	SEEMINGLY INNOCENT LOOKING DEVICE	2
2598	TO BE FIXED BY	2
15691	HOUR ALL MY DEVICES	2
23273	THEM CREDIT FOR THAT	2
24235	IT QUIT WORKING IN	2
1199	FREQUENTLY KIND OF A	2
2590	SCOTT IS PESSED OFF	2
15260	CRAPPY DEVICE WITHOUT ME	2
1207	SAYS SHOULD NOT HAVE	2
2586	RETURN PERIOD COMPLETE GARBAGE	2
2585	SUSPECT THE FREQUENCY USED	2
2582	TIP FOR USING AS	2
15689	ROUTER UNLESS YOU WANT	2
2580	NOTE THAT IT SEEMS	2
13723	NETGEAR GENI SET UP	2
1202	NOT ALL IT'S CRACKED	2
13724	DAYS THE REPLACEMENT QUITE	2
13726	UNITS THEY'RE SHIPPING CHARTER	2
2540	KNOW WHERE TO SEND	2
2538	HAVE PROBLEM WITH IT	2
2537	WITHOUT HELP FROM NETGEAR	2
2493	GOOD VERY WEAK WITH	2
2500	THE FIRMWARE AND THAT'S	2
23336	BEGINNING COMPLETELY DISAPPOINTING MONTHS	2
24208	TRIES TO SELL YOU	2
1240	THE HARDWARE IS GOOD	2
23338	FIXED BY NETGEAR SUPPORT	2
15666	PIECE OF JUNK CONNECTION	2
15273	FROM WHAT YOU'D EXPECT	2
23340	WITH NO REASON AFTER	2
24204	TO ASSIGN IP ADDRESSES	2
24203	PAID 99.97 BUT NOT	2
23333	X6 VS D-LINK AC3200	2
15664	INDICTED IT WAS SOOOOOO	2
1244	CURRENTLY SERVING ITS PURPOSE	2
15663	YEAR OF CONTINUOUS USAGE	2
13769	V2 DROP CONNECTION WHICH	2
2487	TO HAVE IT REPLACED	2
23346	PROBABLY DESERVES A AT	2
24202	GROUND ON THEIR SERVICE	2
13772	IT DOES NOT WORK	2
2481	CONNECT TO INTERNET TO	2
13763	TECH SUPPORT WILL WANT	2
1235	INBOUND WITH THE UNIT	2
2536	REVIEW ONLY DROPPING SIGNAL	2
24215	THIS ROUTER WORKS TERRIBLY	2
2534	WORKS BUT LIMITED REACH	2
23310	BETTER AS FAR AS	2
24216	ISP FACTORY REPLACEMENT REQUIRED	2
13746	OF MANUFACTURERS SACRIFICING USE	2
23312	NOT FOR SOMEONE THAT	2
1224	AND YET IT DOESN'T	2
1225	BUT ANNOYING ENOUGH TO	2
23318	I DOWNLOAD SOMETHING FROM	2
13751	BUT THERE IS A	2
2519	AND AM NOW BUYING	2
15670	DEAD AFTER 1.5 YEAR	2
2518	YEAR CANNOT CONNECT TO	2
24214	DOESN'T EXTEND THE RANGE	2
24212	FADES IN AND OUT	2
23325	BELKIN BRAND THE LAST	2
2512	IN BAD SPOT OF	2
13756	YEAR OLD TPLINK ROUTER	2
13758	FOR MAC USERS OR	2
13759	STOPPED WORKING IN ABOUT	2
23330	DEVICES IN A SMALL	2
13838	FUNCTION AS A WIFI	2
1305	AS MY LAST NETGEAR	2
2355	TO RESTART IT EVERYDAY	2
15306	THEN STARTED DROPPING THE	2
1358	ROUTER WITH A LOT	2
1360	PICKY ABOUT IPHONES AND	2
2199	YOU THE SET UP	2
23546	FORCED TO USE USB	2
23547	THE EXTENDER DOES INCREASE	2
23548	IT TO CHANGE ANY	2
13914	IS A GREAT PIECE	2
23550	WORK I'M JUST NOT	2
23551	AND I NEEDED TO	2
2189	WAS BROKEN RIGHT OUT	2
2188	AUGUST OF 2014 AND	2
2187	AC3200 VS ASUS RT-AC3200	2
13916	SUPPORT UNLESS YOU PAY	2
24125	1750 THE PERFORMANCE WOULD	2
2183	SET IT UP THUS	2
1364	SHORT WITH GOOD PARENTAL	2
14293	OF PENNY MY YEAR	2
2176	GIGADROPPED CONNECTIONS PER SECOND	2
2172	I MAKE THAT DISCLAIMER	2
23560	BUGGY READYSHARE CLOUD RASPBERRY	2
1368	WITH WITH THIS ROUTER	2
2201	AND MONEY DON'T BELIEVE	2
15567	HARD TO GET THIS	2
2205	IS NOT THAT GOOD	2
2217	HAVE MORE THAN 10	2
2230	WITH UNIT ALREADY POOR	2
15307	SHOULD HAVE BEEN BETTER	2
2227	AND MY STREAMING FOR	2
13902	RANGE POOR RELIABILITY AND	2
2224	DAYS AND COMPLETELY FAILED	2
2222	BARELY USEFUL BUT NOT	2
2221	REQUIRED ME TO RESET	2
23534	PROBABLY NOT NETGEAR'S FAULT	2
13905	LEAST RELIABLE DEVICE IN	2
2214	BEWARE IF YOU HAVE	2
1354	WI-FI KEEPS DROPPING AND	2
2213	POOR ROUTING PERFORMANCE ERRATIC	2
1349	ADVERTISED FOR A YEAR	2
2212	ISSUES ON THE 5GHZ	2
1351	THE BOX I FOUND	2
2211	BUT ITS A GOOD	2
2210	THE OTHER CHANNEL WAS	2
24131	A DUD ACCORDING TO	2
1353	A YEAR INTO THE	2
15569	IT...BUT IT HAS IPV6	2
15559	NETGEAR WNDR4500 ISN'T A	2
15558	IS THE BEST ON	2
2167	I'M SENDING THIS BACK	2
24110	COMPUTER AND IT'S NOT	2
2137	YOU NEED AN EXTENDER	2
23583	R6700V2 IS TERRIBLE...JUST LIKE	2
1380	WORK WITH MY WINDOWS	2
13935	WORST USER INTERFACE AND	2
14287	BOTHER IF YOU END	2
23587	NEVER BUY ANOTHER ROUTER	2
2130	TECHNICAL SUPPORT FROM NETGEAR	2
15548	UNRELIABLE AND MOODY INTERMITTENTLY	2
24111	WITH TIME MACHINE ON	2
24109	OUT MOST OF NETGEARS	2
2139	GET SOMETHING THAT WORKS	2
24107	WOULD NEVER RECOMMEND THIS	2
23590	THE BANDWIDTH ON THIS	2
23591	TWICE FAILED BOTH TIMES	2
15546	REVIEW UPDATE AFTER MONTHS	2
1390	A NETGEAR PRODUCT AGAIN	2
24105	WHILE IT WAS WORKING	2
1392	EASY ENOUGH I'VE HAD	2
2122	HAVING TROUBLE GETTING A	2
24104	AND THE RANGE IS	2
24113	5G JUST STOPPED WORKING	2
1378	REVIEW IT QUIT WORKING	2
23564	THIS PRODUCT IT NEEDS	2
2154	WORSE AND KEEPS BUMPING	2
23566	UP TO NETGEAR REPUTATION	2
2162	THIS ITEM HAS SOME	2
15311	THAT NETGEAR HAS EVER	2
14291	WHILE IT LASTS BUT	2
23570	ABOUT THE PRODUCT NEW	2
2156	SWITCH NETWORKS EACH TIME	2
23572	NOT VERY EASY AND	2
24116	FOR PRINTING DOES NOT	2
14288	BUT NOT AS STRONG	2
2153	I CHANGED MY OPINION	2
2140	NETGEAR FALSELY ADVERTISED THIER	2
2152	ITS A GOOD ROUTER	2
15553	OPTIONS WIFI FOR MEDIA	2
2149	A YEAR AND OUR	2
23574	IT'S LIKE SOME CHEESY	2
23575	AC1900 IS A LEMON	2
23577	REALLY GREAT AND STABLE	2
13930	IF YOU ARE LOOKING	2
1377	A BRIDGE CAN'T EXTEND	2
23581	ONLY NO PLACE FOR	2
23527	SUPPORT THEY DETERMINED THAT	2
13900	ABOUT HOW BAD IT	2
15614	THE WI-FI DROPS OUT	2
2233	FOR A SHORT TIME	2
2317	RELIABLE I WOULD NOT	2
2315	NEED A NEW ROUTER	2
2314	CALLED NETGEAR WHO TRIED	2
23471	ACCESS POINT MODE WITH	2
23472	EVEN THINK ABOUT GETTING	2
1319	DISSAPOINTING SHORT SIGNAL RANGE	2
13864	GREAT THEN A BIG	2
23475	MONEY AND AM NOW	2
1320	A WASTE OF TIME	2
14310	YOU'RE SHOPPING FOR A	2
23479	MANUAL FOR FEATURE SET	2
1323	MY ROUTER WORKS PERFECTLY	2
13868	REPLACE MY MEDIALINK ROUTER	2
23481	A WEEK OR SO	2
23482	FAR ONE OF THE	2
23483	TIME MACHINE FOR LION	2
2298	ISSUE ON PORT 21	2
2297	SIGNAL CAN'T COMPARE TO	2
2295	CALLED NETGEAR FOR TECHNICAL	2
23485	IT WAS WORKING GREAT	2
2290	PLEASE DO NOT BUY	2
15599	SOMEONE AT NETGEAR ABOUT	2
15600	DRIVE SUPPORT POOR ROUTING	2
14312	ALTHOUGH THE NIGHTHAWK'S INDICATOR	2
15606	RANGE ISN'T THAT GOOD	2
2353	WAITING ON REPLACEMENT FROM	2
1306	EXCELLENT PLACEMENT AND STRONG	2
23447	WOULD TAKE CARE OF	2
13846	OTHER ISSUES WITH DEVICES	2
14317	ISNT THAT GOOD FOR	2
23456	WIRED CONNECTION IS GOOD	2
2338	WILL WANT TO CHARGE	2
2337	ON THE PERFORMANCE YOU	2
2336	TECH SUPPORT IS OUTSOURCED	2
2334	WORKS FINE BUT READYSHARE	2
13858	PRODUCT WITH POOR UPDATES	2
2332	TIME I TRIED TO	2
23459	WORK ACROSS CIRCUIT BREAKERS	2
2329	THAN THE DEFAULT SIGNAL	2
2326	THE BUT TO HAVE	2
13855	AND SUPPORT TRIES TO	2
15601	AND HAVE USED NETGEAR	2
1314	TO GET SET UP	2
2323	RECOMMENDED IT I HAS	2
13857	BUT THIS WAS USED	2
24149	PIECE OF CRAP DAYS	2
24148	FAST SPEEDS THAT DON'T	2
2289	PERFORMANCE WOULD BE BETTER	2
14301	SEND IT BACK TO	2
15579	FOR GAMING DUE TO	2
23515	WIRED PORTS DID NOT	2
2251	TOO MUCH HASSLE WITH	2
13894	VERY DIFFICULT TO SECURE	2
2249	THAN PREVIOUSLY WITH A	2
23517	JUNK DON'T BUY IT	2
24137	CONNECTIVITY ISSUES WITH WIRELESS	2
13895	IS USUALLY VERY POOR	2
13896	IN AUGUST OF 2014	2
23521	BUT THEY KILLED IT	2
13892	NOT FOR YOU EITHER	2
23522	WITH WIRED DLNA MEDIA	2
2241	N600 THE INTERFACE IS	2
2240	JUST AN OVERALL BAD	2
1343	JUST WORKED OUT OF	2
2239	BEST ROUTER I'VE OWNED	2
23523	GOOD COUPLE OF MONTHS	2
2237	A WASTE OF YOUR	2
1344	FIRST DISAPPOINTING AMAZON PURCHASE	2
2234	CURRENT MANUAL FOR FEATURE	2
24138	SHORTER RANGE MORE DROPPED	2
13891	MY OLD NETGEAR ROUTER	2
13872	BUT IT CUT THE	2
23499	WORK AND NETGEAR'S CUSTOMER	2
15591	GREAT ROUTER BEYOND AWFUL	2
15590	HOUR CUSTOMER SERVICE WAS	2
2284	SETTINGS FOR PARENTAL CONTROL	2
2283	RANGE EXTENDER FOR MY	2
1329	THE MONEY EVEN IF	2
13876	I HAVE EVER BROUGHT	2
2278	A YEAR THEN A	2
23496	ITS NO BETTER THAN	2
14307	TO KICK START AND	2
2273	DON'T DO THIS ONE	2
2257	ROUTER I EVER BOUGHT	2
2272	BUT DON'T MOVE AROUND	2
24144	UP AFTER FOUR MONTHS	2
13883	POORLY FOR GAMING AND	2
23504	IF YOU END UP	2
1335	WORKS GREAT THE PACKAGING	2
2263	BE FIXED BY NETGEAR	2
2261	IN INFORMATION TECHNOLOGY AND	2
13888	PRETTY FREQUENTLY KIND OF	2
13889	SUPPORT POOR RETURN POLICY	2
761	THIS ONE WHILE IT	2
3355	READ OTHER REIVIEWS THESE	2
12918	WORKING SUDDENLY AFTER LESS	2
4530	SET UP CONTENT FILTERING	2
4503	TO RECONNECT IS PRESSING	2
14976	ON THIS ONE WHILE	2
12834	BUT NOT AS IMPRESSIVE	2
281	BETTER THAN THE LOWER	2
4499	2.4G ROUTER-5G BAND UNUSEABLE	2
21964	AM DISAPPOINTED IN THE	2
16321	NEWS IS THAT THIS	2
14775	THEN YOU WILL FACE	2
4493	AND THAT'S WHEN NETGEAR	2
21969	EXPERIENCE WAS PRETTY BAD	2
21970	DONT KNOW WASNT WORKING	2
16320	RANGE NOT VERY GOOD	2
14979	NOT THE CONDITION EXPECTED	2
24856	THIS PIECE OF HIDDEN	2
21975	MONTHS OF PROPER USE	2
16316	DO IT FOR ME	2
4479	PRODUCT AND TERRIBLE CUSTOMER	2
24854	THE GOOD NEWS IS	2
16313	WORKED AND HALF YEAR	2
4477	JUNK BUYER BEWARE READ	2
4476	WORKS BUT NOT AS	2
12832	AND RANDOM DROPPED CONNECTIONS	2
21958	MANY WASTE OF TIME	2
24863	ANOTHER FAILED ROUTER FROM	2
4522	FOR THE 1-HOUR IT	2
12823	A HORRIBLE GLITCHY PRODUCT	2
14783	WEB SITE WAS USELESS	2
24871	THAT THIS WOULD HAVE	2
24870	WORK WITH FLAGSHIP NETGEAR	2
4527	REASON I DON'T LIKE	2
4525	FOR 30 DAYS BUT	2
14780	5GHZ RADIO FAILURE APPARENTELY	2
4524	PROBLEMS TECH SUPPORT IS	2
4523	HAPPY PRODUCT BUT ONE	2
14975	ON THE 5GHZ BAND	2
4509	TOLD BY NETGEAR THAT	2
4521	I GOT TWO FOR	2
21951	SPEEDS WHEN IT WORKED	2
24866	LIVE UP TO HYPE	2
24865	SLOW AFTER SOME TIME	2
16327	PARENTAL CONTROLS DO NOT	2
4514	1-HOUR IT WORKED...POSSIBLY DEFECTIVE	2
14778	DROP CONNECTION WHICH WAS	2
12829	HORRIBLE NO SERIOUSLY HORRIBLE	2
4512	THE PRICE I EXPECTED	2
4475	HATES BROTHER LASER PRINTERS	2
14769	VIDEO SEEMS FINE AND	2
16312	NET GEAR 300 VERY	2
22017	ANOTHER NETGEAR ROUTER THAT	2
24841	BUT TO HAVE TO	2
12869	BACK AND WORKED FINE	2
24840	THE PRODUCT NEW THESE	2
16295	FALLS SHORT WITH GOOD	2
4432	ONE YEAR CANNOT CONNECT	2
4430	SERVICE AND WORK AS	2
4427	SPEED COVERAGE IN AN	2
22014	BUT READYSHARE DOES NOT	2
22015	ROUTER FOR 13 MONTHS	2
4420	KEEPS DISCONNECTING NEVER WORKED	2
14984	NOT THE WIFI YOU'RE	2
16292	DUD ACCORDING TO NETGEAR	2
16291	FINE I WILL BE	2
12877	WNDR4300 IS NOT FULLY	2
14760	WILL WORK BUT THE	2
16289	PERMANENTLY BRICKED ITSELF AFTER	2
22025	I BOUGHT THIS BECAUSE	2
14759	THAT I EXPECTED FROM	2
14758	FINE BUT READYSHARE DOES	2
4412	INCONSISTENT CONNECTION POOR CUSTOMER	2
12867	WORK WITH MAC PRODUCTS	2
14763	LIKE IT HAPPENS A	2
293	DON'T BUY THIS NETGEAR	2
12856	THE DICE AND BUY	2
4472	AGAIN A ROUTER THAT	2
4471	ISN'T A ROUTER IT'S	2
4470	SO FAR IT WORKS	2
12849	BE CAFEFUL WHAT YOU'RE	2
24851	POSSIBLE INTERNET SPEED EVEN	2
16310	IT DOES SOME THINGS	2
21988	PIECE OF JUNK WON'T	2
16309	DROPPING INTERNET SIGNAL ON	2
297	WITHIN YEAR OF BEING	2
24847	A PRE-RATIFIED 802.11 AC	2
22005	TIME I HAVE HAD	2
303	THIS IS A WASTE	2
4453	A NETGEAR N300 WHICH	2
21998	TO LIKE IT BECAUSE	2
14765	HAVE UPDATED THREE DIFFERENT	2
4450	ARE RUNNING WINDOWS 10	2
12863	OF THE CONNECTION SETTING	2
22004	IT WORKS BUT BE	2
4441	PRINTING DOES NOT WORK	2
4440	PRODUCT POOR SUPPORT POOR	2
12822	PIECE OF HIDDEN BECAUSE	2
16330	HAVE TO CALL IN	2
4410	THE R6700 WORKS FINE	2
21941	ALL IT'S ADVERTISED TO	2
21877	DON'T SPEND YOUR MONEY	2
14804	SETTING IT UP SEVERAL	2
21878	BUY ANY TECHNOLOGY ITEMS	2
21880	HOUSE BUT THEN I	2
14803	THE ROUTER APPEARS TO	2
12782	IT BUT HAVING TO	2
16357	MOODY INTERMITTENTLY THE WI-FI	2
16356	LIKE THE ROUTER BEFORE	2
12785	WORKED FOR 24 HOURS	2
12786	DISAPPOINTED IN THIS NETGEAR	2
21889	GREAT ROUTER BUT HAVING	2
21890	ROUTER CONTINUOUSLY REBOOTS WITH	2
16354	IS NOT FULLY CONFIGURABLE	2
4607	IF IT CANT LAST	2
21895	GREAT IN REFUNDING MY	2
228	ISSUES A BLAND MENU	2
21897	PROBLEMS WITH UNIT ALREADY	2
14797	NOW THEY DON'T WORK	2
4601	IS GOOD TO ABOUT	2
21900	I WOULD LIKE IT	2
234	10YR OLD ROUTER WR1000	2
219	EXCEPT ON 2.4 GB	2
4631	NETGEAR WON'T HONOR YEAR	2
21875	IMPOSSIBLY COMPLICATED SETUP BAD	2
21864	THE SHORT TIME I	2
24914	CLEAR THAT NETGEAR HAS	2
12766	IT AT LEAST ONCE	2
4656	WAS GOOD BUT ROUTER	2
12767	LISTEN CAREFULLY DOES NOT	2
14955	UPDATED THREE DIFFERENT FIRMWARE	2
12769	WOR PROPERLY I VERY	2
12770	FROM THE BEGINNING THE	2
21863	A THREE BAND PRICE	2
14806	HARD DRIVE SUPPORT IS	2
4646	FEET BEFORE SIGNAL DROPS	2
4633	SHORT TIME I HAD	2
24910	TECHNICAL SUPPORT AND I	2
16363	WEAK SIGNAL STAY AWAY	2
4642	THE BEST RANGE FOR	2
16361	DEVICE BRUTAL SET-UP PROCESS	2
4639	WAITING FOR 20 MINUTES	2
21873	REQUIRED LESS THAN A	2
217	THAT THIS ITEM IS	2
12779	USED NETGEAR A GOOD	2
4634	HAVE A SMART HOME	2
12794	WITH WIRELESS ISP FACTORY	2
4598	BUT PRODUCT WORKS SO	2
24896	HAVE SLOWLY QUIT WORKING	2
21934	BUT CAUSES MY FIREFOX	2
21923	BAD AND IT IS	2
24879	NEVER HAD THAT ISSUE	2
257	3.0 HARD DRIVE ATTACHMENT	2
21926	IT WORKS THAT WELL	2
16337	IT WORKS IT IS	2
4557	WHILE IT WORKED FOR	2
21929	DOES NOT EXTEND AS	2
4555	GREAT FOR WEEKS COMPLETELY	2
12813	UNIT ALREADY POOR PERFORMANCE	2
4549	DOES NOT WOR PROPERLY	2
4566	SET UP FOR WHAT	2
260	IS NOT THE GREATEST	2
4545	OLD ROUTER WHICH IS	2
12816	BE BETTER IN GENERAL	2
261	AFTER WAITING FOR 20	2
4542	EXTEND THE RANGE OF	2
4540	WHICH WAS NOT ABLE	2
4539	NEED AN EXTENDER FOR	2
14785	WELL SO FAR BUT	2
4537	A LITTLE PRICEY BUT	2
4564	CONNECTED CUSTOMER SUPPORT IS	2
251	ROUTER BUT DIED AFTER	2
4596	COMPANY WITH AMAZON WAS	2
12799	THE ROUTER BEFORE IT	2
4593	WITH THE UNIT TO	2
24894	THEN UPGRADED TO A	2
4592	PERFECT FOR A PRE-RATIFIED	2
21904	AMAZON AND NETGEAR ARE	2
24892	FOR GAMING AND DOES	2
21907	WHEN NETGEAR SCREWS YOU	2
4584	WIRELESS IS FINE BUT	2
240	WORKED GREAT UNTIL IT	2
4582	WHEN USING THE PRINTER	2
16346	LAST LESS THAN YEARS	2
250	DO NOT RECOMMENDED IT	2
21913	LIVING UP TO NETGEAR	2
24890	AC NIGHTHAWK AC 1900	2
21915	NOT FOR THE ONES	2
14966	INTO TWO OTHER BUILTINGS	2
24888	A WEEK GOING BACK	2
4572	WORKED POORLY ON MULTI-LEVEL	2
4571	MY BEST LUCK WITH	2
24886	GREAT FOR BASIC WEB	2
14969	THE RECEPTION IN OUR	2
4411	INDICATOR LIGHTS SHOULD EXCELLENT	2
4409	IS VERY EASY TO	2
16204	THIS ROUTER WORKED PRETTY	2
22119	PROBLEMS AND POOR SUPPORT	2
4248	IN NO WIFI DON'T	2
24786	AND IT WAS A	2
4244	UNTIL YOU UPDATE THE	2
4242	PLEASE READ THIS REVIEW	2
22144	JUST STOPPED WORKING ONE	2
4240	DID NOT I HAD	2
12961	RETURNED THIS AND PURCHASED	2
396	AM HAVING IS THE	2
12962	BUT WIFI RANGE IS	2
24783	PROBLEMS WITH OTHER COMPUTER	2
4236	WHEN IT WORKS PROPERLY	2
22148	WITHOUT ME PAYING FOR	2
12964	TO SIGN UP HEN	2
4232	UP TO THE PROMISE	2
22150	BUT MAY JUST BE	2
4227	RELIABILITY FAILED WITHIN YEAR	2
12968	WORK IT WAS A	2
22155	AND MORE FORMALITIES THAN	2
4223	WIRELESSLY CONNECT MY PRINTER	2
4222	WOULD BE BETTER IN	2
4221	RANGE MORE DROPPED CONNECTIONS	2
14732	FACEBOOK BUSINESS WIFI FEATURE	2
4250	WAS USED AND DID	2
4251	BUT OTHERWISE GOOD ROUTER	2
4264	CANT EVEN CONNECT TO	2
14735	BAD PRODUCT AT ALL	2
22123	TO HAVE TO SET	2
16240	GOT IT WORKED FINE	2
4273	KEPT DROPPING OFFLINE SO	2
22127	AUDIO AND SOUNDS FUNNY	2
4269	TO RMA A UNIT	2
22129	HUNGER BUT ITS A	2
4267	STATED IN OPEN AREA	2
4266	CONFIGURE BOTH TIMES I	2
4263	LIKE BEING HUNG OUT	2
4252	VERSION TWICE FINALLY GAVE	2
24790	AND UNRELIABLE CONNECTIVITY AND	2
22133	UNRELIABLE AGGRAVATING UNRELIABLE ROUTER	2
24788	SUPPORT TEAM MEMBERS AFTER	2
22134	GOOD TO ABOUT 80	2
4258	LOSS OF WORDS FOR	2
12953	NOT GREAT WITH APPLE	2
22136	HAD WAP SETUP ISSUES	2
16236	TECH SUPPORT EVEN FOR	2
12956	JUST TWO DAYS OUT	2
4220	MARKET BUT THIS WAS	2
4219	GEAR 300 VERY DISAPPOINTED	2
22157	LEAST ONCE PER DAY	2
4174	AC 1900 FAILED CUSTOMER	2
16214	FOR A MONTH OR	2
4191	WOULD NOT CONNECT TO	2
4190	NOT HAVE TO MANUALLY	2
4185	LASTS BUT WON'T LAST	2
4184	PRE-RATIFIED 802.11 AC ROUTER	2
4182	AND I WILL NEVER	2
22183	WITH THE N600 THE	2
22184	FROM EXTREMELY LOW SPEED	2
421	WORKED FINE FOR 30	2
4173	NEEDS CONSTANT RESETTING DUE	2
12983	UP WAS A SNAP	2
4172	CONNECT TO MY WIFI	2
24768	KEEPS LOSING SIGNAL AND	2
22191	I RECEIVED UNITS AND	2
424	WAS CONNECTED THROUGH A	2
4165	I RETURNED THIS AND	2
426	BUDGET WIFI EXTENDER BETTER	2
4162	I'VE HAD A FEW	2
24766	USE AND POWER IN	2
24764	ROUTERS YOU CAN GET	2
12985	WHETHER YOU WANT IT	2
22173	GUESS IT WORKS OK	2
400	COMPUTER NETGEAR IS USUALLY	2
24776	WITH DD-WRT OR TOMATO	2
4217	99 OF THE TIME	2
403	POORLY ON MULTI-LEVEL HOUSE	2
404	IS NOT AS FAST	2
14726	ROUTER I'VE EVER PURCHASED	2
406	EXCEPT ONE CHANNEL DOESN'T	2
407	NETGEAR-FIOS NEWER GET A	2
24778	IT WORKS FINE I	2
4209	I WAS JUST TOLD	2
4208	FOR SEVERAL REASONS I'D	2
12977	A RANGE EXTENDER AS	2
14722	TO A SLOW 2.4G	2
411	AS NEW BUT IT	2
16219	BACK AND GET A	2
22168	I WAS HOPING FOR	2
413	I EVER HAD AND	2
4201	CONSTANTLY INTERRUPTS INTERNET CONNECTION	2
4200	IS RUNNING FOR MORE	2
4199	THE LOCAL BEST BUY	2
24773	WORKS OK AS AN	2
24772	TIMES DAILY AND LOSES	2
16243	SIGNAL WITH LATEST FIRMWARE	2
385	AT FIRST BUT AFTER	2
318	ROUTER AND IT MIGHT	2
24794	YOU'RE LOOKING FOR MOVE	2
16277	MY FIREFOX TO CRASH	2
4378	GARBAGE I HAVE UPDATED	2
4377	WAS ADVERTISED AS NEW	2
4376	LINKSYS PRODUCT DOESN'T WORK	2
4375	THIS NETGEAR ROUTER--NUMEROUS AND	2
4373	DISAPPOINTING I'M RETURNING IT	2
22052	THINKING IT HAS A	2
16275	RANDOMLY STOPS WORKING SAME	2
22056	MAKE THE USB PORT	2
24825	MY OPINION OF NETGEAR	2
4364	IT WOULD CRASH EVERY	2
4362	DEFINITELY NOT AS EASY	2
4361	IF YOU USE X10	2
14752	GREAT SPEEDS AWESOME RANGE	2
24821	ON THIS ROUTER IS	2
24819	IS MORE CONCERNED WITH	2
344	SUPPORT IS FINE I	2
4357	NOT A VERY GOOD	2
24818	IT NEEDS RESETTING DAILY	2
16270	YOU ARE FRUSTRATED FROM	2
346	STRONG AS NETGEAR N300	2
333	WAS A BIT MORE	2
22048	A HUNK OF JUNK	2
16279	IT TO WORK AT	2
12889	THE INTENTION OF FLASHING	2
12882	DROPPING AND RANGE IS	2
4406	WITH THIS ROUTER AT	2
24835	AND SET UP WAS	2
12885	WIFI AND SELLER SERVICE	2
14756	THE ERROR MESSAGE FOR	2
24830	TO IT TO CHANGE	2
22033	MONEY FOR SUPPORT FOR	2
325	WORKED PRETTY WELL WITH	2
4398	AS CREATING ITS OWN	2
4395	SAMBA SERVER FAILS TRANSFERRING	2
332	GOOD DEVICE BUT FOR	2
22037	IT WAS USED USED	2
24828	YET IT DOESN'T STREAM	2
12891	SETUP IS A HUGE	2
4390	IS NOT AN AUTHORIZED	2
22042	THE NEGATIVE REVIEWS AS	2
12892	DEFECTIVE OUT OF THE	2
328	THINGS I DON'T LIKE	2
24826	OR LONG RANGE AS	2
22045	NOT WORK WITH WINDOWS	2
22064	JUNK THIS SEEMINGLY INNOCENT	2
4352	DOESN'T WORK WITH MACS	2
14987	FOR A BIT STRONGER	2
24801	AND NO WARRANTY AVOID	2
366	SO LEMON FRESH PORT	2
14995	THE PRICE OF A	2
24802	NETGEAR N750 BUGGY READYSHARE	2
4312	REFURBISHED I KNOW IT	2
22098	THIS PRODUCT BECAUSE I	2
